Volume,Issue,Journal Name,Published Date,Link,Title,Journal Year,Author 1,Author 2,Author 3,Gender_Author 1,Gender_Author 2,Gender_Author 3,Article_Gender,Intro,Citations
35,2,Economia Politica,08 November 2017,https://link.springer.com/article/10.1007/s40888-017-0083-1,The elasticity of personal income: evidence from survey data,August 2018,Gian Maria Tomat,,,Male,Unknown,Unknown,Male,"Within the field of optimal taxation theory recent research has been dedicated to the estimation of the elasticity of taxable income. This paper provides econometric estimates of the elasticity of personal income in Italy for the 2000–2012 period and examines some implications for the structure of personal income taxation. The paper begins with an introduction of the main features of the Mirrlees (1971, 1986) optimal taxation model. In later sections the estimates of the average personal income elasticity parameters are applied to the analysis of the welfare consequences of a modification of the structure of personal income taxation introduced by the Renzi-Padoan government: the “80 euro tax bonus”. The review of the tax model is based on the versions recently provided in Diamond (1998) and Saez (2001). The econometric application uses as main sources of data the Survey of Household Income and Wealth (SHIW) and the OECD Tax Database. The paper describes how the SHIW data on personal income is combined with the tax data in the OECD Tax Database, in order to provide the dataset used in the econometric application. In addition, the paper provides an illustration of the main features of the system of personal income taxation in Italy for the 2000–2012 period and of the changes occurred during the sample period. The analysis focuses on the features of the system of taxation, that are more relevant for the econometric application. The personal income elasticity estimates are robust to different specifications of the set of conditioning variables in the regression model. Moreover, a difference in differences analysis, in correspondence of the two most important reforms of the system or personal income taxation during the sample period, confirms the results obtained in the regression analysis. Finally, the results obtained in estimation are consistent with some of the main findings of the recent econometric literature on the subject. The estimates of the personal income elasticity are more stable, the broader is the definition of the personal income variable. This result provides evidence, that in addition to pure labour supply effects, tax avoidance and income shifting effects are important determinants of the personal income elasticity. The rest of the paper is structured as follows. Section 2 reviews the optimal tax model and describes the econometric regression model used for the estimation of the elasticity of personal income. Section 3 presents the data. Section 4 describes the structure of personal income taxation in Italy and the main changes occurred during the 2000–2012 sample period. Section 5 presents the econometric estimates of the personal income elasticity. Section 6 describes the difference in differences estimates, obtained with reference to the two sub-samples 2000–2006 and 2004–2012. Section 7 presents the analysis of the welfare effects of the “80 euro tax bonus”. Some conclusions are drawn in Sect. 8.",
35,2,Economia Politica,16 June 2018,https://link.springer.com/article/10.1007/s40888-018-0125-3,Immigrants’ employment and the business cycle in Spain: taking account of gender and origin,August 2018,Mercè Sala-Rios,Teresa Torres-Solé,Mariona Farré-Perdiguer,Female,Female,Unknown,Female,"There is no doubt that since the end of the 1990s, immigration has become an important issue in the Spanish society and economy. From 2000 to 2005, the number of immigrants quadrupled, reaching in 2010 roughly 12% of the total population. In this year and due to the global economic crisis, a trend towards change was discernible, with the total number of immigrants reduced in both absolute and relative terms. At the beginning of 2016, immigrants comprised about 9.9% of the total population—two points below the pre-crisis levels. The highest proportion of immigrants comes from eastern European countries, South America, and Africa. At the same time, over the years, Spanish immigration has become more gender balanced among foreign-born females and males. A large percentage of the immigrant population are between 20 and 45 years old and play an active role in the labour market. They usually have activity and unemployment rates above those of natives. Data from the Spanish National Statistics Institute (INE) indicate that the immigrant activity rate was around 75% and that of natives around 60%. With respect to the unemployment rate, before the 2007 crisis, the rate for immigrants was around 12%, and that for natives was around 8%. During the core of the crisis, the figures increased to 30% and 21%, respectively. Moreover, more than 30% of immigrants are overqualified for the job they carry out (García 2009; Godenau et al. 2014).Footnote 1
 This framework provides the basis for an interesting analysis about how immigrants fare in the labour market and what is their linkage with the business cycle. Research findings on the impact of the business cycle on the immigrants’ labour force demonstrate that the issue is not straightforward. After World War II, the “buffer theory” became popular which argued that during expansion phases, immigrants were helpful to the growth and they had to leave or be sent back during economic downturns (Dobson et al. 2009). However, this special relationship between migratory flows and business cycles was left out because reality showed that economic contractions did not involve a significant decrease in migration rate. There are many factors that explain this circumstance. Among others, we highlight the globalisation of the immigration, the lack of legal status that makes it difficult to return, the economic conditions in the country of origin, the difficulty to move between the origin and destination and the fact that immigrants are not a homogeneous group and their reactions are different during an economic downturn (Bradatan and Kolloju 2015). Since the early 1970s, the international economy underwent important changes fostered by globalisation, the increasing privatisation processes and new technologies, among other key factors. These changes entailed replacing mass production with flexible specialisation. Post-Fordism became the dominant system and was accompanied by the decline of regulation and the rise of global markets. The new capitalism system brought about the deregulation of the labour market, but not people’s mobility. Portes and De Wind (2004) indicate that economic reasons demand that the borders be opened, whereas political and legal logic demand closing them. Globalisation has increased the complexity of migration flows and has raised new motivations related to personal self-realisation (King 2006). However, Massey (2007) points out that the immigrants are still vulnerable due to their class, race and gender. They are vulnerable, which is required by the labour market of the developed countries (Sassen 1988) and, in addition, most of them are concentrated in lower occupational categories in destination countries. This stage traps immigrants in the lower tiers of society, but at the same time, entails a special relationship between their employment and the business cycle fluctuations. Currently, there is a broad consensus in recognising that immigrants relative to natives show larger unemployment sensitivity to business cycles (Aydemir 2003; Orrenius and Zadodny 2009, 2010a, b; Dustmann et al. 2010; Mandelman and Zlate 2012; Prean and Mayr 2016; Clemens and Hart 2017). However, the core of the matter is far from being as simple as it might seem at first sight. This necessitates broadening the scope of research. For instance, it is necessary to analyse whether the response of the immigrants’ labour market supply to movements in economic activity depends on the gender and the origin of the immigrant labour force. We seek to explore this issue. The purpose of this paper is to provide an empirical overview of the relationship between the business cycle and the immigrant employment cycle in Spain, differentiating by gender and origin, during the period 1999–2017. The study focuses on three main goals. First, we identify and compare the phases of the female and male immigrant employment cycles and the phases of the business cycle by means of their turning points. This target also includes the analysis of the differences in the cyclical pattern between immigrants’ and natives’ employment. A well-established methodology is used to examine the intensity of the cycles’ synchronisation. Second, we wonder to what extent the crisis initiated in the middle of 2007 modified the cyclical fluctuations of immigrants’ employment and whether there are significant differences between female and male employment. Finally, we study whether immigrants’ origin plays a role in their employment fluctuations both pre- and during the crisis. We carry out a shift-share analysis to find out whether origin matters. Analyses of the differences between immigrants and natives in employment over the business cycle in Spain have already been conducted (Lacuesta and Puente 2010; De la Rica and Polonyankina 2013; Carrasco and García-Pérez 2015). However, no work has looked at distinctions between gender and place of origin. This paper fills this gap. Such distinctions become noteworthy points in our empirical analysis. In contrast to other studies in this field, what is lost with a holistic perspective is gained through more accurate results. Therefore, our work becomes more significant. In this sense, understanding how immigrants from different origins and different genders face business cycle fluctuations is a key issue, not only from a demographic point of view, but also for any policy recommendation. As this paper offers this information, we will be able to discuss whether the measures adopted by the Spanish government were shaped correctly to optimise the effect of economic growth and to minimise the effects of the downturns in immigrants’ employment. On the other hand, if we find that gender and origin matter, any well-defined model trying to estimate the interactions between immigrants’ employment and economic factors in Spain, should include variables to proxy both gender and origin. The overall conclusions are the following. First, the Spanish economy has more capacity for growth than creating immigrant employment, being more evident in the case of females. However, in contraction phases, females show higher resilience to losing their employment than do males. Second, immigrants are more sensitive to the GDP upturns than natives. Finally, the study also confirms that the origin of immigrants matters. We find that origin influences the immigrant employment fluctuations, in both the pre- and crisis periods. The paper is organised as follows. Section 2 describes the data used in this study. Section 3 identifies and compares the cycle phases by means of their turning points. The section closes by exploring the cycles’ synchronisation. Section 4 discusses to what extent the 2007 crisis modified the cyclical fluctuations of immigrants’ employment and whether there are significant differences between females and males. In Sect. 5 we study whether the origin of immigrants matters. The conclusions are drawn in Sect. 6.",1
35,2,Economia Politica,20 August 2017,https://link.springer.com/article/10.1007/s40888-017-0075-1,Overeducation among Italian graduates: do different measures diverge?,August 2018,Luca Cattani,Giovanni Guidetti,Giulio Pedrini,Male,Male,Male,Male,"Overeducated workers are basically individuals endowed with educational attainments, were their knowledge, competences or skills, in excess of what is actually needed or required to perform tasks associated to their current job.Footnote 1 The economic literature on overeducation starts with Freeman (1976) as an aggregate study on decreasing returns to education investments, proxied by the average college premium paid to graduate workers in American labor markets. In this view, public and private overinvestments in education result in lower levels of returns due to the fact that the supply of highly qualified labour is outpacing its relative demand and thus causing a depreciation of college premiums. At a micro level, overeducation is interpreted as a source of inequality among peers, such as workers with the same educational levels but earning different wages once employed in differently demanding jobs (Frank 1978; Berg 1970). Duncan and Hoffman (1981) implement an extended version of the Mincerian equation in order to estimate separately the effects on wages of required, surplus or deficit years of schooling and kick-start the overeducation literature, a popular and much debated economic subfield lying in between labour economics and the economics of education. At the operational level, measuring overeducation consists in assessing the gap between the required and the attained years of schooling for each individual in a given sample. However, while it is quite easy to assess employees’ education with a specific additional question in the questionnaire, measuring what employers are effectively demanding has proved to be less simple, dividing the most of the contributions to this debate between supporters of workers’ self-assessment (WA) or job analysis (JA) measures. On the one side, WA measures can be severely biased by individuals’ characteristics and perceptions. On the other side, JA may neglect the potential influence of supply forces. We contribute to this debate by introducing a new measure for job requirements based on the classification of occupations proposed by Cattani et al. (2014) and assessing its validity with respect to Italian graduates. With respect to the existing literature, the new measure allows to fully exploit the information concerning the cognitive and skill content of the tasks associated to a particular job in a precise and up-to-date manner. Our purpose is to determine the incidence, determinants and impact on earnings of overeducation by using this new measure and iterate the same analysis utilizing an alternative measure based on workers’ self-assessment in order to compare the two different outcomes and to show the benefits of the new measure. The Italian context represents an interesting case study. In early 2000s Italy has experienced a sudden increase in the number of graduates due to the participation expansion in tertiary education. In addition, Italy has completed in this decade the implementation of the so-called “3 + 2” system.Footnote 2 This expansion combined with the dramatic recession that hit the country in the 2008–2012 period, has raised growing concerns on graduates’ overall employability and wage penalties associated with overeducation. The structure of the paper is as follows. Section 2 introduces the most relevant measurement issues, Sects. 3 and 4 present the new measurement of overeducation adopted in the paper, Sects. 5 and 6 describe the estimation strategy along with the dataset, Sect. 7 contains some key descriptive statistics, Sect. 8 presents and discusses estimates of the determinants of overeducation and its impact on wages, Sect. 9 performs the robustness checks. Conclusions will follow.",4
35,2,Economia Politica,05 July 2018,https://link.springer.com/article/10.1007/s40888-018-0122-6,R&D&I and firms’ internationalization: introduction to the special issue,August 2018,Elena Huergo,Maria Garcia-Vega,,Female,Female,Unknown,Female,"Over the last two decades, the offshoring of manufactures has taken a back seat to that of services. Reasons behind the rise of service offshoring are the liberalization of trade, economic and regulatory reforms, technological advances in communication and digitalization, and the new commercialization of certain goods. Nowadays, an important proportion of exchanges of knowledge-intensive services corresponds to the offshoring of research, development and innovation (R&D&I) activities, which are decisive for the economic growth and development of countries. In this respect, the March 2005 OECD Forum on the Internationalization of R&D already recognized the internationalization of R&D as a crucial feature of globalization with a major impact on economic development and public policy. Globalization and the spread of information technologies have influenced the creation of innovation networks (Freeman 1991). For example, aerospace companies obtain some pieces from very specialized foreign providers; manufacturers of food and industrial ingredients buy research studies on dietary habits from external companies in order to meet the requirements of their overseas customers; cars integrate software from other companies to download maps, directions, or music (The Economist Intelligent Unit 2007). Technological sourcing and the delocalization of innovative activities is an important strategy for companies because it can offer the possibility to buy the best available technology (Baumol 2001; Grimpe and Kaiser 2010; Bertrand and Mol 2013). From a firm’s point of view, the internationalization of R&D activities implies substantial potential benefits: a more cost-efficient innovation process, better ability to learn about R&D conducted by other companies/institutions, a quicker road to commercialization, and a positive impact on the firm’s own innovation capacity (OECD 2008). In this analysis, large multinational enterprises (MNEs) are key actors because they benefit from knowledge generated in other countries by both domestic firms and foreign subsidiaries, which are in many instances worldwide centres of knowledge. In addition to MNEs, an important part of R&D offshoring is undertaken by independent-domestic firms with a very different decisional context. The internationalization of R&D&I is also part of the broader process of firms’ internationalization, which includes exporting activities or cooperative agreements with foreign suppliers, customers and even competitors. The recent economic crisis along with the intensified global competition has forced companies to accelerate the internationalization of R&D&I. As a consequence, from a public policy perspective, the globalization of R&D&I has led to the reformulation of national innovation and industrial policies, which have to coexist in global markets with policies developed by supra-national institutions. The purpose of this special issue is to provide new empirical evidence on the increasing phenomenon of globalization of R&D&I. The special issue has collected articles on trends in the internationalization of firms’ R&D&I strategies, as well as its implications on firms’ performance. There is a special focus on the role of Multinationals (MNEs) due to their internationalized structure.",1
35,2,Economia Politica,03 March 2018,https://link.springer.com/article/10.1007/s40888-018-0107-5,Determinants of R&D offshoring: firm-level evidence from a small open economy,August 2018,Gavin Murphy,Iulia Siedschlag,,Male,Female,Unknown,Mix,,
35,2,Economia Politica,15 February 2018,https://link.springer.com/article/10.1007/s40888-018-0100-z,Intramural and external R&D: evidence for complementarity or substitutability,August 2018,Dolores Añón Higón,Juan A. Máñez,Juan A. Sanchis-Llopis,Female,Male,Male,Mix,,
35,2,Economia Politica,14 March 2018,https://link.springer.com/article/10.1007/s40888-018-0105-7,International patenting decisions: empirical evidence with Spanish firms,August 2018,Pilar Beneito,María Engracia Rochina-Barrachina,Amparo Sanchis,Female,,Female,Mix,,
