Volume,Issue,Journal Name,Published Date,Link,Title,Journal Year,Author 1,Author 2,Author 3,Gender_Author 1,Gender_Author 2,Gender_Author 3,Article_Gender,Intro,Citations
1.0,2.0,Economic Theory Bulletin,13 April 2013,https://link.springer.com/article/10.1007/s40505-013-0012-6,Alternative proofs of Arrow’s general possibility theorem,November 2013,Susumu Cato,,,Male,Unknown,Unknown,Male,"Immediately after the publication of Social Choice and Individual Values (Arrow 1951), Inada (1954) provided alternative proofs of three results in the book, including for Arrow’s general possibility theorem. Later, Blau (1957) pointed out that the original version of the theorem is incorrectly stated; his observation also applies to Inada’s proof. In response to Blau (1957), Arrow (1963) provided a restatement of the general possibility theorem and its proof. Since then, most authors have followed the revised version, which is included in the second edition of Arrow’s book. As Blau (1957) and Arrow (1963) reformulated the set of axioms on which Inada’s proof was based, Inada’s proof has not received much attention in the context of Arrovian social choice theory. The present article aims to rehabilitate Inada’s proof of Arrow’s general possibility theorem. In line with Inada (1954), we provide two simple proofs of the second version of the general possibility theorem. These proofs have some notable features compared with the existing ones. The standard approach to prove Arrow’s theorem was developed by Arrow (1963) and Sen (1970, 1979).Footnote 1 Most proofs of the theorem are constructed along the same lines (Fishburn 1970; Blau 1972; Sen 1986, 1995; Denicolò 1996, 2001; Suzumura 2000). In such proofs, the so-called field expansion lemma is established as the first step: it says that if a group of individuals has decisive power over some pairs of alternatives, then it has decisive power over all pairs. Thus, this lemma shows that the decisiveness structure is invariant across all pairs under Arrow’s axioms.Footnote 2 As the next step, the group-contraction lemma is proved using the field expansion lemma: for any decisive group with more than one individual, there exists some smaller decisive group within it. The theorem immediately follows from this lemma. In Contrast to the standard proof, Inada and we do not construct the field expansion lemma as an auxiliary step. Instead, we employ the concept of a minimal (almost) decisive set to construct a group-contraction procedure as the first step: we prove that a minimal (almost) decisive set is a singleton for all pairs. Next, we show that the minimal (almost) decisive set is invariant across all pairs. Finally, we explain the relationship between our proofs and Inada’s. Inada used the concept of a decisive set, whereas we apply the concept of an almost decisive set in our first proof. This difference is because of the difference between the original axioms and those of the 1963 theorem. In our second proof, we reconstruct the argument to apply standard decisiveness. It is one of the simplest proofs of Arrow’s theorem.",2
1.0,2.0,Economic Theory Bulletin,31 August 2013,https://link.springer.com/article/10.1007/s40505-013-0015-3,An interpretation of Ellsberg’s Paradox based on information and incompleteness,November 2013,Luciano I. De Castro,Nicholas C. Yannelis,,Male,Male,Unknown,Male,"Much has been written about the Ellsberg (1961)’s Paradox, including a special symposium on its 50 years; see Ellsberg (2011). Therefore, the following description is already familiar for many readers. Consider an urn with three balls, one of which is red, and the other two are either black or yellow, but the exact composition is unknown (see Fig. 1). An Ellsberg urn with three balls We will draw a ball from this urn and we offer two different pair of bets for an individual to choose. In the first pair, the choice between the actFootnote 1
\(f_{1}\) that pays \(\$1\) if the red ball is drawn and zero otherwise and the act \(f_{2}\) that pays \(\$1\) if the ball is black and zero otherwise is offered. For convenience, we normalize \(u(1)=1\) and \(u(0)=0\). In the second pair, the choice is between an act \(f_{3}\) that pays \(\$1\) if the ball is either red or yellow and zero otherwise and the act \(f_{4}\) that pays \(\$1\) if the ball is either black or yellow and zero otherwise. To summarize, \(f_{i}\) is given, for \(i=1,\ldots ,4\) as follows: Most individuals will exhibit preferences as: \(f_{1}\succ f_{2}\) and \(f_{4} \succ f_{3}\).Footnote 2 This is called the Ellsberg Paradox because there is no expected utility that can rationalize this choice, since the first preference would imply \(\pi (\{R\}) > \pi (\{B\}\), while the second, that is, \(\pi (\{B\}) > \pi (\{Y\})\) and these implications contradict each other. Now, let us formulate this example in the asymmetric information terminology. Let \(\Omega =\{R, B, Y\}\) denote the state space; each \(\omega \) corresponds to the color of a ball (red, black, yellow) to be extracted from an urn. For simplicity, let us assume that the utility index of the individual is \(u(x)=x\). The agent’s information about the state of the nature is described by the algebra generated by the following partition: \(\mathcal F = \{ \{R\}, \{B, Y\} \}\), and his belief \(\mu : \mathcal F \rightarrow [0,1]\) is given by \(\mu (\{R\}) = \frac{1}{3}\) and \(\mu (\{B,Y\}) = \frac{2}{3}\). Therefore, the acts \(f_{1}=1_{\{R\}}\) and \(f_{4}=1_{\{B,Y\}}\) are measurable, while the acts \(f_{2}=1_{\{B\}}\) and \(f_{3}=1_{\{R, Y\}}\) are not. Thus, while \(U(f_{1})=\int u(f_{1}) \mathrm{\ d} \mu = \mu ( \{R\})= \frac{1}{3}\) and \(U(f_{4})=\int u(f_{4}) \mathrm{\ d} \mu =\mu ( \{B,Y\})= \frac{2}{3}\), the integrals \(U(f_{2})=\int u(f_{2}) \mathrm{\ d} \mu \) and \(U(f_{3})=\int u(f_{3}) \mathrm{\ d} \mu \) are not defined! Therefore, in this standard preference, the individual is unable to compare act \(f_{1}\) with \(f_{2}\) (and \(f_{4}\) with \(f_{3}\)). In other words, this preference is incomplete, that is, it does not obey the completeness axiom, which requires that either \(f_{1} \succcurlyeq f_{2}\) or \(f_{2} \succcurlyeq f_{1}\) for every pair of acts \(f_{1}\) and \(f_{2}\). However, in the above example, we forced the individual to make a choice. This means that the individual has to find a way to complete her preferences.
",10
1.0,2.0,Economic Theory Bulletin,09 July 2013,https://link.springer.com/article/10.1007/s40505-013-0016-2,A one-shot proof of Arrow’s theorem and the Gibbard–Satterthwaite theorem,November 2013,Ning Neil Yu,,,,Unknown,Unknown,Mix,,
1.0,2.0,Economic Theory Bulletin,29 September 2013,https://link.springer.com/article/10.1007/s40505-013-0017-1,A characterization of maximin,November 2013,Kristof Bosmans,Erwin Ooghe,,Male,Male,Unknown,Male,"Maximin and leximin epitomize the extremely egalitarian position in comparisons of social welfare. Both criteria support complete equality, except if this makes everyone worse off.Footnote 1 Maximin focuses solely on the lowest utility. Leximin extends maximin lexicographically by focusing on the second lowest utility if the lowest utilities tie, on the third lowest utility if the second lowest utilities also tie, and so on. The two criteria have been put forward and studied as formalizations of (a utility-based version of) Rawls ’ (1971) well-known difference principle.Footnote 2
 The axiomatic social choice literature has traditionally given less attention to maximin than to leximin.Footnote 3 In this note, we provide a characterization of maximin in the spirit of Hammond ’s (1976) classic characterization of leximin. Hammond shows that leximin is the only criterion satisfying anonymity, strong Pareto and Hammond equity. Hammond equity requires that a utility transfer from a better off individual to a worse off individual results in a social improvement, irrespective of how leaky the transfer is. The axiom is usually regarded as a demanding ethical requirement. However, (Hammond (1991), pp. 209–210), stresses that Hammond equity is demanding only if utility differences (as opposed to only utility levels) are interpersonally comparable. Indeed, otherwise utility leaks have no meaning. Our setting allows both the case of comparable and non-comparable utility differences. We, moreover, consider a new variation on Hammond equity. Weak Hammond equity is concerned only with alternatives in which there is a single worst off individual, while the remaining individuals are all equally well off. The axiom recommends transfers that diminish the gap between the worst off individual and the group of best off individuals. Such transfers, contrary to those recommended by Hammond equity, unambiguously diminish inequality in the overall population. We show that maximin is the only criterion satisfying anonymity, continuity, weak Pareto and weak Hammond equity. As a corollary, we obtain a natural counterpart of Hammond ’s (1976) result, viz., a characterization of maximin on the basis of anonymity, continuity, weak Pareto and the standard Hammond equity axiom.",12
1.0,2.0,Economic Theory Bulletin,26 September 2013,https://link.springer.com/article/10.1007/s40505-013-0018-0,Liapounoff’s vector measure theorem in Banach spaces and applications to general equilibrium theory,November 2013,Michael Greinecker,Konrad Podczeck,,Male,Male,Unknown,Male,"In various contexts, it was observed that measure spaces of uncountable Maharam type allow for useful constructions that are not available for the unit interval with Lebesgue measure; see, e.g., Scott (1967), Hoover and Keisler (1984), Rustichini and Yannelis (1991), Podczeck (2008), or Keisler (2009). Continuing this line, Khan and Sagara (2013) recently established a version of Liapounoff’s theorem for vector measures with values in a Banach space. The main result in Khan and Sagara (2013) says that if \((T,\varSigma ,\mu )\) is a totally finite measure space and \(G\) is a \(\mu \)-continuous countably additive vector measure defined on \(\varSigma \) with values in a Banach space \(X\), then the range of \(G\) is a convex and weakly compact set in \(X\) if \(\mu \) is Maharam-type-homogeneous with Maharam type strictly larger than the algebraic dimension of \(X\). In this note, we sharpen this result of Khan and Sagara (2013). In particular, we remove the hypothesis of Maharam-type-homogeneity, and, in the condition on the codomain of a vector measure, replace the algebraic dimension of a Banach space by the cardinal of some point-separating family of continuous linear functionals. The latter has drastic consequences; see the comments after Corollary 5 below. We provide two proofs of our main result. Our first proof is very short. It reveals that versions of Liapounoff’s theorem based on the Maharam classification of measure spaces are, in fact, a straightforward consequence of Knowles’ version of Liapounoff’s theorem in the weak topology (Knowles 1975), which we use in the form as stated in Diestel and Uhl (1977, Theorem IX.1.4). Our second proof is essentially measure-theoretic and works without the extreme point arguments on which the proof of Diestel and Uhl (1977, Theorem IX.1.4) is based. Instead, it makes use of an idea introduced by Maharam (1942) in the proof of her classification result for measure algebras. We illustrate the usefulness of our main result with three applications. First, we establish results on the convexity of the Aumann integral of a correspondence taking values in a Banach space, following the lines of the classical proof by Richter (1963) for the case of a finite-dimensional codomain. Second, we show that the result in Schmeidler (1972) on blocking power of small coalitions can be extended to infinite-dimensional commodity spaces, covering in particular models of commodity differentiation. Finally, we establish a result on core-Walras equivalence in coalitional exchange economies in the spirit of Vind (1964) when the commodity space is an order-continuous Banach lattice.",8
1.0,2.0,Economic Theory Bulletin,23 October 2013,https://link.springer.com/article/10.1007/s40505-013-0019-z,An outside-option-sensitive allocation rule for networks: the kappa-value,November 2013,Julia Belau,,,Female,Unknown,Unknown,Female,"In an economic or social situation where agents have to group in order to achieve common goals, how should we allocate the worth arising from the coalition formation among the agents? There are various frameworks and various allocation rules. This paper suggests an allocation rule for network structures which, in contrast to existing allocation rules, accounts for both outside options and the role of an agent within the network. We analyze situations where coalition formation is restricted by an undirected graph, that is, the economic or social structure is described by a network which captures the (bilateral) relations between agents and agents can only form a coalition if they are connected in such an interaction network via path (directly or indirectly). This approach was introduced by Myerson (1977) [for applications and further approaches on communication structures, see for example, van den Brink et al. (2007) or van den Brink et al. (2011)]. We use undirected networks to describe the relations between the agents while it would also be possible to use directed networks (i.e., interaction has a fixed direction) as analyzed by González-Arangüena et al. (2008). They use generalized characteristic functions as introduced by Nowak and Radzik (1994), that is, games where the worth of a coalition depends on the order in which agents enter the coalition. In our approach, interaction is not directed and the order of entry does not change the worth of the coalition. There are various examples in which an allocation rule should take into account outside options. As a simple example, consider a glove game, introduced by Shapley and Shubik (1969), with two right gloves and one left glove. A pair of gloves produces worth which has to be distributed among the agents holding the gloves. Due to the bargaining position (outside options) of the left glove holder, this agent should obtain a higher payoff than the others. This game has a nice economic interpretation and it is used to analyze simple markets (cf. Shapley and Shubik 1969). Tutic et al. (2011) show in their experimental work about social interchange that outside options significantly affect negotiations. This connection has also been mentioned by Maschler (1992) as “the need to let the players know what to expect from each coalition structure so that they can then make up their mind about the coalitions they want to join, and in what configuration” (p. 595). In a similar spirit, von Neumann and Morgenstern (1944) state that any formed coalition between individuals “only describes one particular consideration”. The result of negotiation between the individuals will be “decisively influenced by the other alliances which each one might alternatively have entered”. “Even if [...] one particular alliance is actually formed, the others are present in virtual existence: although they have not materialized, they have contributed essentially to shaping and determining the actual reality.” (p. 36) Furthermore, an allocation rule should take into account the specific position of agents within the network, that is, taking into account the path of information flow. As a simple example take the train connections between England, France and Germany. The Eurostar train connects London and Paris and the Thalys train connects Paris and Cologne while there is no direct train connection between England and Germany. Hence, as a transit country, France has to be passed for any kind of flow via trains between England and Germany (travel, trade,...). As further examples consider cost allocation among the nodes in energy networks or social networks used for job offers: nodes with a lot of links should be treated differently to nodes with just a few links. The literature suggests different allocation rules. The Shapley value (Shapley 1953) as well as the component-restricted Shapley valueFootnote 1 (Aumann and Drèze 1974) and, as another modification of the Shapley value, the Owen value (Owen 1977) do not take into account the network structure as they are designed for coalitional models without any interaction structure. Also more recent allocation rules that account for outside options, the Wiese value (Wiese 2007) and the \(\chi \)-value (Casajus 2009b), do not account for the inner interaction structure of a coalition. In order to account for the position within the network, this paper only analyzes allocation rules designed for networks (without further structure). These are the Position value (Meessen 1988; Borm et al. 1992), the graph-\(\chi \)-value (Casajus 2009a) and the Myerson value (Myerson 1977) or, as a generalization of the latter to a wider class of networks, the equal bargaining rule (Jackson and Wolinsky 1996).Footnote 2 The Position value never accounts for structures outside the own coalition, hence, is outside-option-insensitive while the graph-\(\chi \)-value generally does not take into account the network structure within a coalition for weighted voting games with minimal winning coalitions. The Myerson value, and hence the equal bargaining rule, even have both these drawbacks. Hence, there is a need for a new allocation rule. The contribution of this paper is the definition and characterization of a new allocation rule, the kappa-value, that is outside-option-sensitive and takes into account the position of an agent within the network. To the best of our knowledge, there exists no other allocation rule combining these properties. The kappa-value has a nice axiomatization, we only need already known and approved axioms or weakened versions of them (which combine the ideas of known and approved axioms). The kappa-value combines the advantages of the graph-\(\chi \)-value and the Position value while lacking their drawbacks and furthermore provides an elegant use of the quite intuitive concept of the Position value. We further show the independence of the characterizing axioms. To motivate the need for an allocation rule accounting for both outside options and the specific position of agents within the network, consider the following weighted voting game: we have four agents \(\{1,2,3,4\}\) holding weights \((w_1,w_2,w_3,w_4)=(39,30,25,6)\) and let the threshold be \(T=60\), that is, the worth of a coalition is 1 if the sum of weights of the coalitional agents is at least 60 and 0 otherwise. Hence, minimal winning coalitions are \(\{1,2\},\{1,3\}\) and \(\{2,3,4\}\). We consider minimal winning coalitions without organized opposition, that is, agents outside the winning coalition stay as singletons. The networks that could occur are shown in Fig. 1. Networks for minimal winning coalitions Table 1 reports the distribution of worth assigned by the Position value, denoted by \(\pi \), the graph-\(\chi \)-value, denoted by \(\chi ^\#\) and the new allocation rule suggested in this paper, the kappa-value, denoted by \(\kappa \).Footnote 3
 Consider the networks \(g^{3{-}2{-}4}\) and \(g^{2{-}3{-}4}\): the graph-\(\chi \)-value assigns the same payoff to agent \(2\) even though its position in the first case is stronger than in the second case while the Position value accounts for the different positions. On the other hand, the Position value does not take into account the existence of alternative winning coalitions, that is, outside options: consider the network \(g^{3{-}2{-}4}\) again and note that agents 3 and 4 obtain the same payoff even though 3 would have the outside option of a winning coalition with 1 while 4 has no outside option. The graph-\(\chi \)-value accounts for outside options and assigns a higher payoff to agent 3. The kappa-value takes into account both outside options and the position within the network: consider the coalition \(\{2,3,4\}\), agents 2 and 3 always obtain a higher payoff than 4, because they could also cooperate with 1 instead, while 4 has no outside option. Agents 2 and 3 are symmetric in terms of outside options but 2 obtains a higher payoff than 3 if the coalition is connected through 2, a lower payoff than 3 if the coalition is connected through 3 and the same payoff if the coalition is connected through 4. An agent obtains the highest payoff within the coalition if she has the strongest position. Note that not every outside option has the same value/impact: consider \(g^{1{-}2}\) and note that agents 1 and 2 have the same position in this network. Agent 1 obtains a higher payoff due to the fact that her outside option (building a coalition with 3) is valued higher/has a larger impact than the outside option of 2 (cooperating with \(\{3,4\}\)). This can be explained by the fact that in smaller coalitions, the worth has to be distributed among less agents. In contrast to defining a coalition as the group of agents that is connected via path, one could define a coalition by complete subnetworks, that is, as the group of agents that are directly connected to each other. The latter definition has the drawback of not taking into account different interaction paths within a coalition and the position of all agents within the coalition would be the same. This is why we use the more general definition of a coalition. But still it is notable that also in the case of equal positions, the kappa-value is not redundant; it differs from the graph-\(\chi \)-value as shown by \(g^{1{-}2},g^{1{-}3}\) and \(g^{2{-}3{-}4{-}2}\). The paper is structured as follows: we start with the framework and drawbacks of the existing allocation rules. Following the idea of combining the properties of the analyzed allocation rules, Sect. 3 will give an axiomatic characterization of the kappa-value and analyzes independence of the characterizing axioms. Section 4 concludes.",7
1.0,2.0,Economic Theory Bulletin,26 October 2013,https://link.springer.com/article/10.1007/s40505-013-0020-6,A concise axiomatization of a Shapley-type value for stochastic coalition processes,November 2013,Ulrich Faigle,Michel Grabisch,,Male,Male,Unknown,Male,"The Shapley value (Shapley 1953) is among the most popular solution concepts in cooperative game theory and has been applied numerously. Its basic idea: consider all possible orders for the players to enter the game and compute each player’s average marginal contribution over these orders. Therefore, the Shapley value can be seen as assuming particular way of cooperative dynamics: start from the empty coalition and add player after player until the grand coalition is reached. This simple view, however, is quite restrictive from the point of view of coalition formation. So it is not surprising that the Shapley value would give counterintuitive results in some situations (see, e.g., Roth 1980; Shafer 1980; Scafuri and Yannelis 1984). A much more general framework for a value, suited to coalition formation, has been developed by Faigle and Grabisch (2012). It takes into account that several players may enter at any step of the coalition formation process and also that some may leave the current coalition. Moreover, the process is not assumed to stop when the grand coalition is formed but may continue to evolve. Indeed, the evolution may be governed by a Markov chain or any kind of stochastic process. The authors have presented two values, called Shapley I and Shapley II, which define allocation schemes for this general situation. While both include the classical Shapley value as a particular case, a closer study of their properties suggests, however, that Shapley II seems to be more appropriate in practical settings. Faigle and Grabisch (2012) give an axiomatization of Shapley II (see a corrected version in Faigle and Grabisch 2013), with a very complex proof that is similar to the proof of Weber (1988) for the axiomatization of the classical Shapley value. The aim of this note is to provide a much more transparent proof exists for an only slightly weaker axiomatization. In addition, the logical independence of the axioms can be demonstrated. To achieve this, we replace the anonymity axiom (invariance of the value under permutations of the players) by the weaker symmetry axiom (symmetric players receive the same payoff) and base our present proof on the decomposition of a game as a sum of unanimity games (as it is done in, e.g., Faigle and Kern 1992; van den Brink 2001). The paper is organized as follows. Section 2 describes coalition formation processes and the allocation scheme (value) we suggest. Section 3 establishes the new axiomatization. Finally, we prove our axioms’ logical independence in Sect. 4. Throughout the paper, \(N\) denotes a finite set of \(n\) players. We often omit braces for singletons, writing, e.g., \(S\cup i\), \(S\setminus ij\) instead of \(S\cup \{i\}\) and \(S\setminus \{i,j\}\). Generally, we restrict our exposition to a minimum and refer the readers to Faigle and Grabisch (2012, 2013) for full details and more examples.",2
