Volume,Issue,Journal Name,Published Date,Link,Title,Journal Year,Author 1,Author 2,Author 3,Gender_Author 1,Gender_Author 2,Gender_Author 3,Article_Gender,Intro,Citations
38,3,Economia Politica,18 July 2021,https://link.springer.com/article/10.1007/s40888-021-00236-6,"Europe, public debts, and safe assets: the scope for a European Debt Agency",October 2021,Massimo Amato,Everardo Belloni,Lucio Gobbi,Male,Male,Male,Male,"The Covid-19 emergency has proved to be a watershed in how the issue of fiscal policy and its financing is addressed (Baldwin & Di Mauro, 2020; Carnazza & Liberati, 2021; Draghi, 2020; ECB, 2020a, b; Galí, 2020; Kapoor & Buiter, 2020; Krugman, 2020; Morelli & Seghezza, 2021; Romer & Garber, 2020; Stiglitz, 2020). Perhaps it is not only a watershed but also a point of no return. At the Eurozone level, the problems of insufficient performance on the demand side, which were clearly apparent even before the Covid-19 crisis, have been joined by problems of inefficiency on the supply side, hence by problems of coordination between demand and supply. Moreover, on considering the economic effects of the prolonged duration of the pandemic and the level of public expenditure planned in the USA, it cannot be excluded that the fiscal expansions provided until now in Europe could prove insufficient. What is at stake in this new Covid and post-Covid scenario is twofold. On the one hand, the gaps opened by the fall in income due to repeated waves and subsequent lockdowns must be filled. On the other hand, filling those gaps cannot always leverage on re-establishment of the ‘old normal’: the issue emerges of the investments required by a deep re-infrastructuring of the EU economy, since the restart of production to close the gaps will entail structural changes as well as redefinition of the relationships among sectors (Baldwin & Evenett, 2020; Bamber et al., 2020; Fornaro & Wolf, 2020; Gereffi, 2020). The Covid crisis has been generated by a symmetrical and completely exogenous shock; but it has had, and will continue to have, largely asymmetrical effects. This is particularly relevant in the EU and in the Eurozone, where integration mechanisms have never included the common financing of public debts in the name of a strict fiscal policy discipline and of a rigid notion of convergence (see Table 1). Since the inception of the euro, this has meant the exclusion of any mutualisation and transfer mechanism intended to absorb asymmetric shocks. The exceptional nature of the present situation and its likelihood of being a point of no return have highlighted the need for new ways to finance a fiscal manoeuvre unprecedented in scale and scope. Hence policy views that were unthinkable before the emergency became commonly shared. In countries in which the circuit with the central bank and treasury is already in operation, the shift to the ‘new normal’ has been smoother. For the Eurozone, it has implied more dramatic changes: in short, suspension of the ‘old normal’. Undoubtedly, the debate on public debt and its financing, as well as on the role that sovereign debts can play within economies and financial markets, has begun to be revisited. Once again, the shift has been more dramatic in the EU context, where the previous public debt crisis was tackled with few and only temporary deviations from the procedures dictated by financial orthodoxy. Nowadays, orthodox approach is considered insufficient and dangerous by many economists (Baldwin & Di Mauro, 2020; Blanchard & Brancaccio, 2019; Blanchard & Leigh, 2013; Cerniglia & Saraceno, 2020; De Grauwe, 2013; Fatás & Summers, 2018). It is precisely those deviations, their amplification and their ‘institutionalization’ that are now at stake. We are in a situation in which some radical decisions, taken first by the ECB, and then also by the European Commission (EC), seem to evidence not only the technical feasibility of a reform, but also the political will to change some central aspects of political and monetary union. In this perspective, an institution intended to efficiently perform the common management of the Eurozone debt would prove not only fundamental for the future of the Eurozone, but also, as we shall show, would have proved fundamental since its inception. Let us start with a quick update on the situation. The European response to the Covid-19 shock has taken various forms, but in all cases, it has shown an increasingly decisive orientation of the EU institutions (in particular the Commission, but also the ECB) towards a progressive extension of the scale and scope of the instruments put in place. As regards the European Commission, the process began with suspension of the Stability and Growth Pact and an initial aid package of around 540 billion euros. It comprised: (i) the possibility for Member States to obtain loans from the European Stability Mechanism for a maximum amount of about 2% GDP in 2019, with light conditionality, for health-related expenditure; (ii) enhancement of the ability of the European Investment Bank to grant loans to businesses of up to 200 billion euros; and (iii) the activation of the SURE (Support to mitigate Unemployment Risks in an Emergency) programme for 100 billion euros. Concerning the financing of these new tools, a debate has arisen in which some economists and practitioners have proposed the issue of sovereign perpetuities (Giavazzi & Tabellini, 2020; Soros, 2020). In the wake of this debate, proposals have also been made by Member States, like the Spanish one, for instance (Reuters, 2020). Eventually, the European Council formulated a proposal to establish a Recovery Fund (also called NextGenerationEU) of 750 billion euros. After the negotiations in July 2020, the fund provided for the disbursement of 390 billion euros in subsidies and 360 billion euros in loans. Subsequently, specific programmes under the long-term budget for 2021–2027 were reinforced by 15 billion euros. Even if we are already in the phase in which the money will begin to be disbursed, the Recovery Fund, notwithstanding two important innovations, still involves a ‘great unknown’. The innovations are (i) that it will be directly financed by the markets through the issue of common bonds directly backed by the EU budget; and (ii) that it will involve some kind of mutualisation, since the disbursements of subsidies to individual countries will not respect their contribution to the establishment of the fund and to the European budget. The ‘great unknown’ is the temporary vs. definitive nature of the operations envisaged by the fund, and therefore the temporary vs. definitive nature of the instruments provided to finance it. What we know for now is that the common bonds issued to finance the NGEU will have different maturities, and that the commitment is to repay them in full by 2058, with instalments starting from 2028 (ECB, 2020c). In this regard, the European Gordian knot is still untied. Despite this uncertainty, the demand expressed by the markets for those common bonds has been very high since the first issuances (EC, 2020). This is proof that the potential demand for European safe assets is very high, and that these common bonds are already considered as European safe assets. Therefore, there are good economic and institutional reasons to methodically approach the question of the possible rollover of the common debt, and to provide innovative operational solutions. Issues relating to the safe asset, with or without mutualization, and its potential rollover, are also closely linked to considerations concerning the possible synergy between fiscal and monetary policy. Because the expansions of public deficits required by a pandemic will not be reabsorbed quickly, the expansion of public spending will probably become a permanent element of the post Covid-19 scenario. Hence, the problem arises of optimizing the management of fiscal spaces at the level of the entire EU and of the Eurozone. This scenario raises the issue of mutualisation and of moral hazard, at least as regards fiscal policy within a monetary union (Arnold et al., 2018; Batini et al., 2020; Beetsma et al., 2018; Berger et al., 2019). This is crucial because, depending on how it is resolved, the issue will affect the overall expansion of the fiscal space in the EU. Furthermore, if the issuing of common bonds were to become permanent and were financed with common tax revenues, a problem would arise concerning the European debt ratio with respect to outstanding and future national debts. As regards monetary policy, given the growing amount of cumulated public debts, it is likely that the ECB will stably assume an active role, with all that this entails in terms of the interpretation of its statutory mandate. To date, the ECB has strengthened the targeted long-term refinancing operations (TLTRO III) and activated targeted long-term refinancing operations linked to the pandemic emergency (PELTRO) at subsidized rates.Footnote 1 As for the Pandemic Emergency Purchase Programme (PEPP), the ECB will continue its purchases with a total envelope of € 1,850 billion. Here too an important novelty emerges: unlike the PSPP, the PEPP involves an abandonment of the capital key rule. This abandonment was declared non-permanent, but at the same time it proved to be a necessary condition for the governance of spreads on financial markets. Also in this case, therefore, there is a problem concerning future orientations. Depending on how the issue is resolved, the potential of monetary policy and the conditions of debt sustainability for Member States, and indirectly also for the common debt, will change (ECB, 2020a, 2021). In any case, the mix of fiscal expansion (increased debts) recorded to date, combined with the monetary support for its financing (ECB role) highlights a structural problem that gripped the Eurozone even before the pandemic, and especially after the sovereign debt crisis: that is, the problem of a European safe asset (a “safe Eurobond”) able to support the stability of financial markets in times of turmoil (Beck et al., 2011; Bonnevay, 2010; Bruegel, 2020; Brunnermeier et al., 2011, 2017; De Grauwe & Moesen, 2009; Delpla & von Weizsacker, 2010, 2011; Dosi et al., 2018; Giudice et al., 2019; Gros & Micossi, 2009; Hellwig & Philippon, 2011; Juncker & Tremonti, 2010; Leandro & Zettelmeyer, 2018a; Monti, 2010; Ubide, 2015).Footnote 2 At stake are the nature of both common bonds and the issuer thereof, as well as the structural conditions of their financeability. Some important steps have already been taken in the direction of new tools and perspectives for EU integration, so that one may speak of “tools of a surrogated federalism” (Saraceno, 2020). However, as far as public debt is concerned, a structural solution continues to be needed. This solution must deal not only with the possible issue of common European bonds, but also with the common management of the national debts accumulated so far, since they will not decrease for a long time yet, alongside the likely growing quota of common debt. Absent an outright federalist solution, the institution that could take on this task, issuing in return a full-fledged European safe asset, could be what we call here a ‘European Debt Agency’. As we shall show in more depth later, this project is compatible with many of the proposals that are under the policymakers’ scrutiny. In particular, it will be able to take over from them in the medium term by absorbing any one-off issue of common bonds. By sketching the essential features of a new institution, our paper intends to address all these issues, offering a structural solution and a methodological perspective for European integration on a collaborative, not competitive, basis. The paper is divided into five sections. The foregoing Sect. 1 has introduced the topic. The Sect. 2 briefly surveys the literature on safe assets and Eurobonds. The Sect. 3 describes our proposal in its institutional and technical details. The Sect. 4 deals with simulations, while the Sect. 5 is devoted to conclusions.",3
38,3,Economia Politica,30 March 2021,https://link.springer.com/article/10.1007/s40888-021-00226-8,Immigration diversity and regional economic growth,October 2021,Claudio Di Berardino,Dario D’Ingiullo,Alfredo Cartone,Male,Male,Male,Male,"A recent stream of literature has presented compelling evidence of the significant role played by externally sourced knowledge on economic growth (Frankel & Romer, 1999; Keller, 2004; Prescott, 1998). A wealth of literature, in fact, is focused on the process of international knowledge diffusion, analysing the set of factors that affect the capability of a country to grow (Castellacci & Natera, 2013). Among the factors that influence the spread of knowledge across the globe, migration emerges as a crucial mechanism to promote knowledge diffusion by means of indirect channels of interaction (Andersen & Dalgaard, 2011; Bahar & Rapoport, 2018; Kang & Kim, 2018), together with more formal channels such as the cross-border flows of goods (international trade) and capital (FDI).Footnote 1 Migrants, becoming embedded at the local level of the receiving areas, represent natural carriers of tacit knowledge that can promote development in the host regions through their own set of intangible assets (D’Ambrosio et al., 2019; Parrilli et al., 2019). Migration flows, favoured by demographic elements and by socio-economic and institutional factors, have reached a significant dimension and enabled large-scale diffusion. Despite the fact that international immigration is at the forefront of economic and political debates, its impact on the host economy is still an open‐ended issue. The overall contribution of immigration to the growth of the host regions, besides being related to the share of immigrants over the resident population, could depend on other characteristics of these flows. Additional insights into the size effect of migration may be obtained by analysing the diversity of immigrants. Population heterogeneity is increasing in all advanced countries due to international immigration. It has been documented that the characteristics of immigration in terms of diversity could represent an element able to affect growth dynamics in the destinations (Alesina et al., 2003, 2016; Collier, 2001; Easterly & Levine, 1997; Ottaviano & Peri, 2006). Diversity can have a positive effect on output growth if a more diverse working-age population is associated with wider skills that in turn enable the production of a greater variety of goods and services (Alesina & La Ferrara, 2005). However, a more diverse population can also have detrimental effects on output growth if it is associated with increased social conflict and a reduction in the quality and quantity of public goods provision (Ager & Brückner, 2013). The present paper aims to contribute to the economic literature by providing an analysis of the peculiar features of international immigration towards the Italian provinces. We present an empirical assessment of the economic effects of immigration, distinguishing both the size (or share of immigrants) and the variety (or diversity of immigrants). The Italian context represents an interesting case study due to: (i) the wide number of origin countries of immigrants (not limited to few defined trajectories, often related to the colonial past), (ii) the higher territorial heterogeneity, (iii) the wide size of the involved phenomena, and (iv) the rapid increase of these flows. Among European countries, Italy has registered one of the widest increases in the stock of immigrants, which has risen five times since 1998 (Caritas Italiana, 2019). The increase in the number of new immigrants during the period 2007–2016 was equal to 2,023,317 (Istat, 2017). Migrants play an important role in Italy by offsetting the effects of negative demographic trends such as workforce ageing and decline, as well as more general depopulation. This is even more visible in the economy. According to the annual report on foreigners in the Italian labour market elaborated by the Italian Ministry of Labour (2018), “over the last few years, the foreign component in the labour market has become key in the Italian economy, not only because of the importance that foreign workers have had and continue to have in the performance of specific tasks, but also by virtue of the compensatory effect they have determined: […] up until 2015 [both] the EU and non-EU labour force have been able to offset the contraction of employment that affected the Italian component” (Italian Ministry of Labour, 2018, pp. 2–3). Furthermore, the high territorial heterogeneity which is present within the country could represent a further crucial factor for investigating the effects of international migration on economic growth. International knowledge diffusion, in fact, is a complex process involving the absorptive capacity of the receiving places, which is shaped by their level of development and their set of socio-economic and institutional characteristics (i.e., their level of education and social networking, see Castellacci & Natera, 2013; Williams, 2007; Williams & Baláž, 2014). Our empirical approach follows two conceptual steps. We first estimate the impact of the share and diversity of immigration on economic growth. Second, we investigate whether the economic effects of these two dimensions of international immigration differ across Centre-North and South provinces, areas characterised by different levels of development. Our contribution to the literature debate is therefore twofold. First, we find that the share of total immigrants plays a positive role for the regional economic growth. However, the diversity of immigration can also affect the growth dynamics, helping to explain the intra-national territorial disparities. The main findings seem to reveal that increases in birthplace fractionalisation significantly fostered output per capita, which is consistent with the argument that a greater diversity of the population increases output per capita by widening the variety of workers' skills and the variety of goods and services produced. Second, once we break down the set of host provinces on the basis of their level of development, only the Central-Northern provinces are those that benefit from the diversity of immigration. In contrast, for low-income provinces of the South of Italy, the most significant growth-enhancing effect is associated only with the share of foreign-born individuals. This suggests that diversity can be beneficial (or at least less detrimental) at higher levels of regional development (Alesina & La Ferrara, 2005). One potential explanation for this effect is that the beneficial consequences on the economic growth of the regions associated with the skills complementarities seem to occur only when the production processes are sufficiently diversified, as in Central-Northern provinces. The remainder of the paper is organised as follow. Section 2 provides the literature background. In Sects. 3 and 4, the descriptive analysis, the econometric model, and the results are presented. Section 5 concludes the paper.",3
38,3,Economia Politica,02 July 2021,https://link.springer.com/article/10.1007/s40888-021-00231-x,Labor market effects of dirty air. Evidence from administrative data,October 2021,Edoardo Di Porto,Joanna Kopinska,Alessandro Palma,Male,Female,Male,Mix,,
38,3,Economia Politica,28 June 2021,https://link.springer.com/article/10.1007/s40888-021-00232-w,Revisiting the literature on the dynamic Environmental Kuznets Curves using a latent structure approach,October 2021,Saptorshee Kanto Chakraborty,Massimiliano Mazzanti,,Unknown,Male,Unknown,Male,"The Rio Convention of 1992 followed by the Kyoto Summit of 1997 and the recent COP21 Summit of Paris have served as milestones for policymakers in reducing the extent of greenhouse gas (GHG) emissions and maintaining a sustainable future. However, the effect of GHGs on Earth might lead to an increase in temperatures of 3 \(^{\circ }\)C by 2050 (United Nations Climate Change Secretariat 2015), leading to catastrophic climatic changes globally. This also might lead to a reduction in economic output in developed and developing countries, and annual GDP growth might decrease by 2–4\(\%\) by 2040 and by 10\(\%\) by 2100. Therefore, a common global agenda is to reduce emission levels in both developed and developing countries without hampering economic progress (EEA 2019; Energy and Resources Institute 2019; UNDP 2021; UNEP 2011; UN 2020). Some policies developed in this regard involve funding technology transfer to the developing world and increasing the use of renewable energies (IEA 2018). Sustainable development and human development interconnections have developed a fruitful broad view on development strategies. The re-appearance of the Kuznets legacy, with the rise of the ‘Environmental Kuznets curve’ hypothesis, in the 90’s, interconnected environmental sustainability, development and inequality issues. In 1995, Grossman and Krueger (Grossman and Krueger 1995) extends the theory originally postulated by Simon KuznetsFootnote 1 and extents it to environmental degradation, assuming an inverted-U relationship between economic growth and the environment. In the Environmental Kuznets Curve (EKC),Footnote 2 the initial increase in per capita GDP is due to the shift of the workforce from agriculture to industry and causes an increase in pollution. Assuming that after a certain threshold of per capita income all basic needs are being met, contextually to a new shift to the services sector, a demand for environmental quality emerges and develops so that the supply side of the economy must adapt by introducing cleaner technologies. Technology is central also in the theoretical work of Brock and Scott Taylor (2010), which update Solow model of economic growth to incorporate technological progress in abatement. Within this framework, the relationship between climate change and economic development has been well studied (Grossman and Alan 1991; Grossman and Krueger 1995; Holtz-Eakin and Selden 1995; Carson 2010), and some extensive reviews can be found in (Borghesi 2000; Brock and Scott Taylor 2010; Uchiyama 2016). Additionally, the relationship between growth and emissions, including innovation, has been extensively used in the policy-making literature especially for developed countries (e.g. the Stern Review (Dietz 2011)). Researchers often assume that countries are similar when dealing with unobservable heterogeneity. From an econometric point of view, many methodologies have been developed from simple time-series methodologies to very complex ones using GAMS (Generalized Additive Models), Bayesian and heterogeneous estimators to tackle cross-sectional dependence (Musolesi et al. 2010; Mazzanti and Musolesi 2013, 2017). All of these works have shown the presence of strong forms of heterogeneity in developed countries.Footnote 3 This paper adopts a panel data model to account for this crucial heterogeneity. In our panel data model, cross-sectional units form a number of groups; within these groups, the slope coefficients are similar, but they vary across groups, and both the number of groups and individual group membership are unknown. This mode of determining the number of groups and group membership provides a new perspective on the EKC literature, with interesting insights for development and policy analyses. To analyse heterogeneity, we apply a recent classification method, the C-Lasso method, developed by (Su et al. 2016 [SSP (2016) hereafter] and Huang et al. 2020b [HJS (2020b) hereafter]). The methodology is pretty novel, as it provides a consistent estimator for unknown group structures and delivers oracle-efficient estimates for the coefficients of each group. We use data from 34 countries in our sample for a period of 1971–2015, and we conclude with two groups, revealing marked heterogeneity. Some diversified developmental patterns are evident from the data. Specifically, the effect of renewable energy consumption on gross domestic product is positive for one group and negative for the other. The rest of the paper is organized as follows. Section 2 provides a brief literature review, Sect. 3 explains the panel structure model and C-lasso technique provided by SSP (2016), which are used for accounting for latent group structure across different countries within the time period 1971–2015, and Sect. 4 describes the data and the model employed. Section 5 provides the results and Sect. 6 concludes.",
38,3,Economia Politica,10 February 2021,https://link.springer.com/article/10.1007/s40888-021-00219-7,Can culture save young Italians? The role of cultural capital on Italian NEETs behaviour,October 2021,Chiara Burlina,Alessandro Crociata,Iacopo Odoardi,Female,Male,Male,Mix,,
