Volume,Issue,Journal Name,Published Date,Link,Title,Journal Year,Author 1,Author 2,Author 3,Gender_Author 1,Gender_Author 2,Gender_Author 3,Article_Gender,Intro,Citations
49.0,2.0,Empirica,05 August 2021,https://link.springer.com/article/10.1007/s10663-021-09517-6,Policy instruments and self-reported impacts of the adoption of energy saving technologies in the DACH region,May 2022,Michael Peneder,Spyros Arvanitis,Martin Wörter,Male,Male,Male,Male,"The principle of sustainability has become a powerful idea and a key challenge for societies to cope with. In 2015 the United Nations (UN) launched its Agenda for Sustainable Development with an aim to pave the way for “prosperity and opportunity for all on a healthy planet.”Footnote 1 The UN further elaborated its ambitious objectives by defining 17 Sustainable Development Goals (SDGs), among which SDG8 occupies a central position for simultaneously promoting sustainable and inclusive economic growth and employment. Among others, Stern and Stiglitz (2021) highlight the strong connection between these dimensions.Footnote 2 Similarly, Mealy and Hepburn (2021, 397) point out that “traditional industrial routes out of poverty are dangerously emissions-intensive” and discuss the common features of transformational change towards the UN climate and development goals. 2021 further stress the importance of new green technologies and products in order to achieve a sustainable growth path. Finally, Stern and Stiglitz (2021, p. 19) also find reason for optimism when it comes to the role of new technology: “The fossil-fuel economy was borne of innovation, and it could as well die as a result of innovation.” This paper investigates how public policies associate with the adoption of new green energy technologies (GETs) and the self-reported impacts on competitiveness in a large sample of individual companies. Within the far-reaching agenda of the SDGs, it aims to contribute in particular at the intersection of energy efficiency, technological change and climate change. But do we really need policy to interfere with the energy efficiency of private businesses? From a conventional economics perspective, there are valid reasons to answer in the negative. Higher efficiency implies lower cost to the individual enterprise, thus providing private incentives to adopt new GETs as long as the savings match the cost of investment. Also for most non-renewable energy sources property rights are well established. If consumption is excludable, prices reflect rents from scarcity and the rate of exhaustion should be welfare-efficient (Hotelling 1931). In contrast, Solow (1992) defined sustainability as an ethical norm of inter-generational equity: to ensure that future generations can be as well off as we are. The distant future, however, is not well represented in the market, and opinion surveys have revealed comparatively low concerns in the overall population about the natural environment.Footnote 3 As a consequence, sustainability is not adequately covered by private decisions and the conventional rationale of allocative efficiency. Hence, robust concerns for sustainability arise with regard to the emission of green house gases and the consequent perils of climate change, where the sheer scope of the problem dwarfs many of the economist’s standard analytic premises. When assessing the benefits and costs of public intervention, the very long time horizon, uncertainty, nonlinear impacts and the related risk of irreversible, catastrophic events largely obliterate the use of expected values or market-based discount rates, instead calling for a general conservationist bias.Footnote 4 Most rationales of public intervention originate in the so called double externality problem, which points at the simultaneous occurrence of negative spillovers from pollution and exhaustible resources in addition to the positive spillovers from innovation and the adoption of “greener” technologies.Footnote 5 Yet in the presence of increasing returns these ecological problems are likely to be amplified by path-dependency and lock-in effects. Therefore, the conventional focus on cost-efficiency and the correction of relative prices alone won’t suffice to change trajectories.Footnote 6 According to Frankel (2004), societies face three distinct paths of transformation: One is to address the scale of operations—that is, pursuing less or no growth with all its consequences of foregone real income and distributional conflicts, especially between developed and developing regions. Even if cushioned by far reaching measures in terms of the redistribution of global incomes, the negative trade-off between such a strategy of de-growth and the UN’s SDG8 are obvious. A second path is to change the composition of activities. At high per capita income, environmental efficiency tends to improve, because of structural change in favour of services and preferences for a clean environment.Footnote 7 While this contributes to the decoupling of the growth of emissions relative to that of output, growth is nevertheless likely to further increase the cumulative stock of pollutants. Innovation and technological change open a third path, which enhances structural change but also reduces the emissions of given activities. At a fundamental theoretical level, it corresponds to the tendency of dissipative systems to either increase the access to free energy or to raise the efficiency in its use.Footnote 8 However, whether innovation and structural change ultimately can be sufficient to decouple material well-being from resource throughput will depend on the aggregate rates of growth in resource efficiency relative to that of labour productivity and of the population (Bretschger 2020; Hahnel 2021). In more practical terms, Nordhaus (2019, p. 2013) emphasises that technological change lowers the cost of reducing \(\hbox {CO}_2\) emissions and provides for a “last refuge” if other policies fail. The focus of our research is on such technological change. But unlike the growing literature on own environmental innovations, which uses patents, R&D expenditures or other relatively well-available measures from common innovation surveys as dependent variables, we are interested in the adoption and perceived impacts of the new technologies. Our central concern is how different policy instruments such as standards and negotiated agreements, taxes or subsidies are related to the adoption of GETs by the companies and thus to their self-reported environmental impacts and competitive position in the market. For this purpose, we had to create a new enterprise survey, which we then conducted simultaneously in Germany, Austria and Switzerland (the ‘DACH region’). There are obvious similarities in how the three countries deploy the policy instruments mentioned above. For instance, in the field of energy policy guaranteed feed-in tariffs for electricity from renewable sources exist in the entire region. They intend to foster investments in the production of renewable energy by reducing the uncertainty about future demand and prices, but also imply that final users must bear higher electricity prices. Similarly, all three countries levy various carbon taxes, e.g. on fossil fuels, and participate in trading systems for carbon emissions. Finally, in innovation policy the growing concerns about climate change tend to shift funding priorities in favour of GETs. But each country has its distinct history, institutional setting and policy framework. For example, during the past decades Germany has put much emphasis on the promotion of renewable energy,Footnote 9 which is expected to substitute for nuclear power after its planned fade out. Germany was the first of the three countries to introduce guaranteed feed-in tariffsFootnote 10 for electricity from renewable sources already in 1991. This contributed greatly to the remarkable increase of the share of wind and solar power in total electricity production.Footnote 11 Another policy that led to higher energy prices was the ecological tax reform in 1999, which included the introduction of a new electricity tax. In addition, the petroleum tax was redesigned to provide better incentives for the purchase of energy-efficient vehicles. A further example is the CO2 Building Rehabilitation Programme aimed at incresing the incentives for energy-efficient building refurbishments. The German Federal Government is also running several R&D programmes that foster the development of energy-saving technologies. Generally, there are no large-scale voluntary agreements on energy saving or energy efficiency on a cross-industry level, though individual industries, such as the chemical industry or the automotive sector, have been following such an approach. In Austria the relative abundance of hydraulic power has provided a comparative advantage to energy intensive industries, such as metal processing or cellulose and paper, which still produce a comparatively high shares of manufacturing output. Another particular characteristic is Austria’s ban on nuclear energy, which was enacted after a public referendum in 1979. Energy policy thus always ranked relatively high on the public agenda, while energy intensive producers enjoy considerable political leverage.Footnote 12 In 2015 the new Energy Efficiency Law became the focal point of the country’s regulatory approach in this area. After adopting EU guidelines, energy suppliers (except small ones) must prove concrete measures to achieve annual efficiency gains of 0.6% relative to their previous year’s total energy sales. These efficiency gains may originate either from their own operations or from their customers and depend on the ratio of energy inputs to output (i.e. not on total energy use).Footnote 13 In addition, the law commands large companies either to install a proper energy management system (EMS), or to have an energy audit every four years. Compared to Germany and Austria, Swiss policy has generally been more reluctant to intervene in favour of GETs. The Swiss framework is mainly characterized by market incentives and voluntary agreements.Footnote 14 Switzerland nevertheless has some important targeted policies, though these were often introduced much later than in the two other countries. For example, in 2008 the first commitment period of the Kyoto protocol initiated a carbon tax and a (still rather narrow) emission trading system started in 2013. Similar to other rules applied in the European Union, there are regulations of, e.g., emissions of passenger cars, or the labeling, promotion and installation of renewable energy plants. Public subsidies are available in form of a technology fund to promote innovations for reducing greenhouse gas emissions and the consumption of resources, supporting also the use of renewable energy and the increase of energy efficiency. There are also subsidies for basic research and applied R&D in the form of pilot plants related to GETs. After these introductory remarks, Sect. 2 introduces the main heuristics and hypotheses, whereas Sect. 3 presents the data and descriptive statistics. Section 4 explains the econometric model and results. Section 5 summarizes and concludes. Finally, we provide a list of abbreviations, references, and an Annex with supplementary tables.",7
49.0,2.0,Empirica,11 November 2021,https://link.springer.com/article/10.1007/s10663-021-09528-3,How is the European Union progressing towards its Europe 2020 targets? A benefit-of-the-doubt window analysis,May 2022,Charlotte Wüst,Nicky Rogge,,Female,Male,Unknown,Mix,,
49.0,2.0,Empirica,01 September 2021,https://link.springer.com/article/10.1007/s10663-021-09524-7,The EU Structural Funds and trust in politicians: another unwanted outcome?,May 2022,Ivana Tomankova,,,Female,Unknown,Unknown,Female,,1
49.0,2.0,Empirica,12 August 2021,https://link.springer.com/article/10.1007/s10663-021-09518-5,Competition effects in EU external aid supply tenders funded with the Pre-accession and Neighbourhood instruments,May 2022,Luis Mario García Lafuente,Asunción Mochón Sáez,,Male,Female,Unknown,Mix,,
49.0,2.0,Empirica,28 August 2021,https://link.springer.com/article/10.1007/s10663-021-09523-8,Euro usage in international trade amidst threats to multilateralism: evidence from Malawian imports,May 2022,Angella Faith Montfaucon,,,Unknown,Unknown,Unknown,Unknown,,
49.0,2.0,Empirica,16 October 2021,https://link.springer.com/article/10.1007/s10663-021-09527-4,Logistics infrastructure and export survival in European Union countries,May 2022,Kemal Türkcan,Socrates Kraido Majune,,Male,Unknown,Unknown,Male,,
49.0,2.0,Empirica,02 April 2022,https://link.springer.com/article/10.1007/s10663-022-09537-w,"Finance, growth and (macro)prudential policy: European evidence",May 2022,Martin Hodula,Ngoc Anh Ngo,,Male,,Unknown,Mix,,
49.0,3.0,Empirica,13 May 2022,https://link.springer.com/article/10.1007/s10663-022-09542-z,Measuring private transfers between generations and gender: an application of national transfer accounts for Austria 2015,August 2022,Bernhard Hammer,Alexia Prskawetz,,Male,Female,Unknown,Mix,,
49.0,3.0,Empirica,11 April 2022,https://link.springer.com/article/10.1007/s10663-022-09540-1,"See you soon: fixed-term contracts, unemployment and recalls in Germany—a linked employer–employee analysis",August 2022,Oskar Jost,,,Male,Unknown,Unknown,Male,"Unemployed workers re-entering employment can either start working for a new firm or return to their previous firm.Footnote 1 The literature provides various theoretical models addressing the latter case, known as recalls. Feldstein (1976) and Baily (1977) build on the implicit contract theory to motivate recalls: Firms temporarily lay off workers to compensate for a decrease in demand, and recall them at a later point in time. This approach is linked to an implicit agreement according to which laid-off workers will be recalled as soon as the firm’s situation improves. Thus, temporary layoffs and recalls can be used as an instrument to shift labor costs onto the economy or the unemployment insurance system (UI), as shown by Albertini et al. (2020). Analyzing the job search behavior of employees during a temporary layoff, for instance, White (1983), Mortensen (1990) or Fujita and Moscarini (2017) reveal a lower search effort among workers who expect to be rehired. However, their search effort increases the longer the period of unemployment lasts in order to avoid negative effects on their productivity. Empirical studies analyzing this topic show high numbers of recalls and thus the relevance of recalls for the likelihood of unemployed individuals re-entering employment. Figures of 30% or more are found by almost all international studies, such as for the U.S. (Katz and Meyer 1990), Spain (Alba-Ramírez et al. 2007; Arranz and García-Serrano 2014), Austria (Böheim 2006; Nekoei and Weber 2015, 2020) or Sweden (Jansson 2002; Nivorozhkin 2008). For Germany, the corresponding figures are somewhat lower, ranging from 17 to 22% (Mavromaras and Rudolph 1995, 1997, 1998; Liebig and Hense 2007; Edler et al. 2019). Despite these high figures, the topic of temporary layoffs or recalls by previous employers is still often neglected when explaining unemployment dynamics, even though it is a popular instrument used by firms to reduce costs (Liebig and Hense 2007). Studies for Germany indicate large differences in the effects of recalls on employment and in the frequency of use between industry sectors. In particular the construction sector, but also hotels and restaurants, use recalls frequently (Edler et al. 2019). This is due above all to seasonal fluctuations in demand (Mavromaras and Rudolph 1995) and in economic activity (Liebig and Hense 2007, Nekoei and Weber 2020). Moreover, Mavromaras and Rudolph (1998) provide evidence of more frequent recalls in small firms and explain this by the absence of works councils in smaller firms, which tend to reject this instrument. Concerning the impacts of recalls, some studies find direct effects on wages. Kodrzycki (2007) and Edler et al. (2019) reveal wage penalties for rehired workers compared to workers not affected by temporary layoffs. However, re-employed workers earn higher wages in comparison to new employees. Mavromaras and Rudolph (1997) provide further evidence of higher wage penalties for re-employed women, suggesting discrimination. An important but neglected aspect that is closely related to temporary layoffs and recalls concerns fixed-term contracts, as shown by Alba-Ramírez et al. (2007) and Arranz and García-Serrano (2014) for Spain. Accordingly, spanish firms use fixed-term contracts, which enable them, amongst other things, to reduce cost-efficient work force by not extending these contracts as, for example, no redundancy payments have to be paid and no social aspects have to be considered. At the same time, firms still have the option of re-employing laid off workers at a later date if, for example, demand for goods rises. In this way, fixed-term contracts can be used to conduct recalls in Germany as well and to undermine employment protection laws, which usually prohibit temporary layoffs. Analyzing recalls in Spain, Alba-Ramírez et al. (2007) obtain results indicating that the probability of a recall is higher for unemployed workers who had previously had a fixed-term contract. Arranz and García-Serrano (2014) also provide evidence that firms use fixed-term contracts to mitigate seasonal fluctuations in demand and recall laid off workers later. Further, they demonstrate that the instrument of fixed-term contracts is an essential part of Spanish firms’ business strategies. I build on previous studies on recalls and closely follows the work of Mavromaras and Rudolph (1995), Liebig and Hense (2007), Alba-Ramírez et al. (2007), and Arranz and García-Serrano (2014). In particular, I analyze the importance of recalls for the German labor market and the relevance of fixed-term contracts in this context. The interplay between fixed-term contracts and recalls is particularly relevant in the German context, as the German labor market is considered less flexible due to strong employment protection laws. These laws make temporary layoffs and recalls more difficult to use. I use a large administrative individual data set, linked to establishment data for the years 2012–2017. Due to the administrative character of the data and information on individuals on a daily basis, the data are highly accurate and reliable. I can thus precisely identify transitions from unemployment to employment and control for various characteristics, such as wage, industry sector, occupation, education, or region. I provide at least three important contributions. First, I analyze the relationship between fixed-term contracts and recalls for Germany, which was not yet examined for Germany. Second, I consider seasonal and business-cycle recalls with regard to fixed-term contracts, which was not yet addressed by previous literature, either. Third, the extensive and accurate data, which are not available in most comparable studies, enable me to provide a more detailed picture of unemployment dynamics related to temporary layoffs. Using a competing risk framework based on survival time analysis with unobserved heterogeneity, my results indicate an interplay between fixed-term employment contracts, unemployment and recalls for Germany. Unemployed workers who were previously employed on fixed-term contracts are more often rehired by their previous firms. This applies in particular for women and migrants. Furthermore, my results provide evidence that firms use recalls to cope with seasonal fluctuations. The paper is organized as follows. Section 2 provides information on legal regulations and the identification strategy. The data, the summary statistics for the main variables as well as the data preparation are described in Sect. 3. Sections 4 and 5 present the estimation and sensitivity analyses, respectively. Finally, Sect. 6 concludes.",
49.0,3.0,Empirica,09 May 2022,https://link.springer.com/article/10.1007/s10663-022-09541-0,The nonlinear effect of financial literacy on wealth: evidence from Germany,August 2022,Jia Hou,Sebastian Schuler,,,Male,Unknown,Mix,,
49.0,3.0,Empirica,13 February 2022,https://link.springer.com/article/10.1007/s10663-022-09535-y,Ability to consume versus willingness to consume: the role of nonlinearities,August 2022,Petar Sorić,,,Male,Unknown,Unknown,Male,,1
49.0,3.0,Empirica,14 February 2022,https://link.springer.com/article/10.1007/s10663-022-09534-z,Commuting time and sickness absence of US workers,August 2022,J. I. Gimenez-Nadal,J. A. Molina,J. Velilla,Unknown,Unknown,Unknown,Unknown,,
49.0,3.0,Empirica,15 June 2022,https://link.springer.com/article/10.1007/s10663-022-09544-x,Productivity surplus and its distribution in Lithuanian agriculture,August 2022,Tomas Balezentis,Vaida Sapolaite,,Male,Female,Unknown,Mix,,
