Volume,Issue,Journal Name,Published Date,Link,Title,Journal Year,Author 1,Author 2,Author 3,Gender_Author 1,Gender_Author 2,Gender_Author 3,Article_Gender,Intro,Citations
46.0,3.0,Empirica,02 April 2019,https://link.springer.com/article/10.1007/s10663-019-09439-4,The Nationalökonomische Gesellschaft from its foundation to the postwar period: prosperity and depression,August 2019,Hansjörg Klausinger,,,Male,Unknown,Unknown,Male,"An association devoted to the discussion of economic affairs had not been without precedence in Austria. Already in the 19th century, such an association had been founded, the Gesellschaft österreichischer Volkswirte (that is, Association of Austrian Economists), which remained active well into the 1950s. The majority of its up to 300 members came from industry and banking, and it mainly focused on contributions to the economic policy debates of the time. Consequently most of its presidents were both luminaries of the Austrian economics community and involved in economic policy-making: Lorenz von Stein (1888–1890), the statistician Theodor Inama von Sternegg (1891–1896), the economist Eugen von Philippovich (1897–1909), Ernst von Plener, a liberal politician and minister of finance (1910–1925), Richard Reisch, minister of finance and president of the Austrian central bank (1925–1937), and finally the banker Ernst Mosing (1945–1956).Footnote 2 Somewhat in contrast, the bylaws of the NOeG identified as its fields of activity the fostering of theoretical economics by organizing lectures and discussions and by publishing papers. Apparently, the NOeG aimed at a smaller audience and at discussion within the group of acadamic economists rather than public recognition. This differed markedly from other Viennese societies, like the Vienna Soziologische Gesellschaft or the Österreichische Politische Gesellschaft (see e.g. Müller 2018; Morgenbrod 1994). The composition of the newly elected board also mirrored this emphasis. Besides the president Joseph Schumpeter, it consisted of Hans Mayer (vice-president), Karl Pribram (secretary), Ludwig von Mises (treasurer), and the ordinary members of the board Alfred Amonn, Moritz Dub, Viktor Grätz and Othmar Spann.Footnote 3 Most of the board members belonged to the younger generation and were to some extent affiliated with what had become to be known as the “Austrian School of Economics”. This is noteworthy insofar as German-language economics in the interwar period has been characterized as lacking a dominant paradigm (see e.g. Köster 2011). Rather, the economists teaching at the universities propagated a variety of approaches, ranging from adherence to the remnants of the German Historical School or mere eclecticism to the propagation of “autochthonous messages” (Schumpeter 1954, 1154). (Spann may be mentioned as a typical example of the latter.) This diagnosis certainly applied to the Austrian economics community, too. In particular, in the postwar period outside Vienna, at the Universities of Graz and Innsbruck, the Austrian School played only a limited role. The Austrian School as a distinct theoretical approach to economic and social phenomena derived from Carl Menger’s Grundsätze der Volkswirtschaftslehre (1871). Its main pillars consisted in a subjectivist theory of value and the explanation of social institutions as the (unintended) result of individual action. However, the school’s success was as much based on Menger’s foundation as on its development by Friedrich von Wieser and Eugen von Böhm-Bawerk, its second generation. While Wieser integrated Menger’s approach into a general analytical framework, Böhm-Bawerk developed a theory of capital based on the notion of time-consuming production. Menger had taught at the Faculty of Law of the University of Vienna until his early retirement in 1903. Wieser had been appointed to a chair in Prague before he moved to Vienna to fill Menger’s vacancy. Böhm-Bawerk after teaching for some time in Innsbruck served as Minister of Finance in various Austrian cabinets and eventually was appointed professor of economics at Vienna, where he taught and led the famous “serminar” until his death in 1914. Another important figure teaching in Vienna was Eugen von Philippovich, who combined the Austrian approach in economic theory with policy views more in line with the German “socialists of the chair”; he deceased in 1917. When, in the same year, Wieser left the university for the position of Minister of Trade in the last cabinets of the Monarchy, the only professor to represent economics at the faculty was the Austromarxist and economic historian Carl Grünberg. Thus a change of the guard appeared to be imminent. It fits this picture that the members of the Austrian School active in the NOeG all belonged to its third generation. (Moritz Dub, an economic journalist at the Neue Freie Presse, and Victor Grätz were the sole members of the NOeG board from outside academia.) The most prominent was certainly Joseph Schumpeter. At the time, he occupied an economics chair at the University of Graz and was the author of two books that had provoked his colleagues: In his habilitation thesis Schumpeter (1908) argued for a positivist methodological foundation of economics instead of introspection. And in his path-breaking theory of economic development (Schumpeter 1911), by introducing the notion of entrepreneurial innovation as the engine of progress, he attempted to shift the focus of economic analysis from statics to dynamics. In this sense, Schumpeter from the very outset was something like an outsider to the Austrian School. In 1918 he was busy in political activities in Vienna, and after the demise of the Monarchy became for a short period Secretary (that is, Minister) of Finance in the First Republic. Hans Mayer studied in Vienna under the supervision from Wieser. He concentrated in his research on special problems of Austrian value theory, e.g. on imputation and on the substantive laws of marginal utility. He planned to apply for a venia legendiFootnote 4 in Vienna, but accepted a call at a chair in Fribourg, before he had finished his thesis—in effect he never finished it. In 1914 he was appointed professor at the Technische Hochschule in Prague. Like his colleagues, Spann, Amonn and Mises, he was transferred during the war to Vienna to serve at the Scientific Committee for the War Economy at the Ministry of War (see Pinwinkler 2003, 84–89). Soon after the war, when Schumpeter had left academia for the banking business, he succeeded him in Graz. Of the remaining members Ludwig von Mises’s main occupation at the time was that of a secretary of the Vienna Chamber of Commerce; Karl Pribram and Viktor Grätz also had been associated with the Chamber for some time. Pribram and Mises held the positions of Privatdozent at the University of Vienna. In particular, in his thesis Mises (1912) applied the Austrian approach to the problems of money and thus laid the basis for “Austrian business cycle theory”, later on developed by Friedrich Hayek and others. Moreover, Mises—in contrast to Wieser—represented the liberal wing of the Austrian School and propagated this view from his position in the Chamber. Amonn and Spann were teaching at outposts of the Monarchy. Amonn, after his habilitation in Vienna on a subject in the methodology of economics, had taught like Mayer in Fribourg and then succeeded Schumpeter in Czernowitz. Spann had studied in Vienna, done work in empirical sociology in Frankfurt, and then taught at the Technische Hochschule in Brno (Brünn) where he succeeded his teacher Friedrich Gottl-Ottlilieneld. Originally both, Amonn and Spann, regarded themselves as critics within the wider ambit of the Austrian School. However, Spann increasingly fell under the spell of the 19th century economic romantic Adam Müller, and started to put forward his own program of “universalism” in opposition to the Austrians’ “individualism”. In the course of the 1920s this was to become a full-blown, if also obscure system in opposition to the “modernist” views of political and economic liberalism as well as the Marxist idea of class struggle. Spann propagated a corporate state resting on a regulated economy instead of competition, autarky instead of free trade, hierarchy instead of equality, and the rule of the elites instead of the rule of the masses—votes must be weighed, not counted, as Spann maintained. When the NOeG came into existence, Spann was just contemplating the prospect of his move from Brno to Vienna. Amonn, who had to leave Czernowitz after the war, taught for some years at the German University of Prague. Eventually, in the postwar period, the vacancies at the Vienna faculty were filled: While there was no successor to Böhm, after a short guest performance by Max Weber, in 1919 Spann succeeded Philippovich, Grünberg was raised to a full professorship, and Wieser returned to his chair for five more years.",4
46.0,3.0,Empirica,10 May 2019,https://link.springer.com/article/10.1007/s10663-019-09444-7,Economics in Austria from 1945 to today,August 2019,Ewald Nowotny,,,Male,Unknown,Unknown,Male,,1
46.0,3.0,Empirica,30 April 2019,https://link.springer.com/article/10.1007/s10663-019-09443-8,"Three outstanding NOeG presentations: Morgenstern, Viner, and Menger on the laws of costs and returns",August 2019,Christian Gehrke,,,Male,Unknown,Unknown,Male,"In the 1920s and 1930s, when the Nationalökonomische Gesellschaft (NOeG) was still an intimate debating club, consisting of a small circle of (predominantly Viennese) scholars interested in economic theory, a surprisingly large number of outstanding papers were presented at its meetings. One may recall papers by Ludwig Mises on socialist calculation, by Gottfried Haberler on international trade theory, by Adolf Löwe, Oskar Morgenstern, Friedrich Hayek and others on business cycle theory, or by Paul Rosenstein-Rodan, Karl Menger and Oskar Morgenstern on the role of time, uncertainty, and expectations (Klausinger 2016). In the present paper, I want to draw attention to three outstanding NOeG presentations on the laws of costs and returns and the construction of long-run industry supply curves. In the early 1930s this was a topical theme because of the criticisms that the treatment of these issues by Alfred Marshall had drawn in the so-called “cost controversies” of the 1920s. These debates, which took place mainly in the pages of the Economic Journal, had been completely ignored in the German-language area until Oskar Morgenstern took up this issue in a long review article which he presented at two consecutive NOeG meetings in January and February 1930 (Morgenstern 1931). On Morgenstern’s initiative, Jacob Viner then delivered his famous paper on “Cost curves and supply curves” at a further NOeG meeting in September 1930. Viner’s seminal contribution, which Morgenstern managed to secure for the Zeitschrift für Nationalökonomie (ZfN), provided a rigorous geometrical derivation of industry supply curves from the firms’ cost situations in competitive conditions, and became the springboard for numerous further contributions. In December 1935, the mathematician Karl Menger then severely criticized the axiomatic acceptance of the law of diminishing returns by showing that the existing a priori “proofs” of this alleged “law”, put forward by authors such as Böhm-Bawerk, Wicksell, Mises and others, were invalid. Menger was instigated to his contribution by discussions in the NOeG following the presentations of Morgenstern and Viner, and it was Morgenstern also who channeled the resulting (two-partite) paper into the ZfN for publication (see Menger 1936a, b; the two parts were later published together in a revised English translation as Menger 1954 and, in a slightly revised version, as Menger 1979).Footnote 1 The connecting link between the contributions of Morgenstern, Viner, and Menger is their common concern with the role of diminishing returns in the explanation of long-run industry supply curves with increasing costs. Accordingly, the present paper has been organised as follows. Section 2 briefly summarizes Morgenstern’s review article, focusing attention in particular on the problems relating to the construction of long-run industry supply curves with rising supply prices.Footnote 2 In Sect. 3, Viner’s 1931 article on “Cost curves and supply curves” is re-examined, with the main focus being, again, on the construction of upward-sloping industry supply curves in a partial equilibrium setting. Section 4 then turns to the discussion of Karl Menger’s “Remarks on the law of diminishing returns” (1979 [1936a, b]), and Sect. 5 offers some conclusions.",4
46.0,3.0,Empirica,13 May 2019,https://link.springer.com/article/10.1007/s10663-019-09448-3,Perpetrators and victims: Austrian economists under the Nazis,August 2019,Reinhard Neck,,,Male,Unknown,Unknown,Male,"The period of 1938–1945, when Austria was part of “Greater Germany”, the Third Reich, was certainly a most horrible time for all those who despised Nazi ideology and politics. This is especially true for those Austrian scientists who belonged to the large group of people persecuted by the Nazis for “racial”, political or other reasons. This period also contributed to the intellectual demise of Austrian academia, which had already started at the end of the Habsburg monarchy, continued in the First Republic with a lack of recognition by its right-wing governments and intensified under the Dollfuss-Schuschnigg dictatorship (“Austrofascism” or “Ständestaat”). However, the emergence of the Nazi regime brought about an even more devastating effect for science in Austria. The persecution of “Jewish”Footnote 1 academics started immediately the Nazis came to power (the Anschluss) on March 12, 1938, already prepared by (officially illegal) Austrian Nazi party officials and supporters. While the terror of the new rulers directed at the “Jews” and other minorities was prepared and approved of by too many Austrians, persecution intensified still further on the arrival of the SS and the Secret State Police (Gestapo) following the Anschluss. Among academics, doctors and lawyers were especially victimized because of the relatively large numbers of “Jews” in these professions. Economists proper were but a small group as there was no degree programme in this field; those studying economics had to take a degree in law or political science. Nevertheless, there were a few hundred people trained in economics in Austria in the 1930s, in academia, public administration and business. Most (but not all) of those with scientific interests were members of the Austrian Economic Association (Nationalökonomische Gesellschaft, NÖG), which had been founded after World War I following in the footsteps of a similar organization in the Habsburg Monarchy. Lionel Robbins (1971, p. 91) wrote the following about the NÖG: […] on the morrow of the Anschluss when, to his eternal shame, Hans Mayer, the senior Professor of Economics in the University of Menger, Wieser and Böhm-Bawerk, whom I myself had more than once heard denouncing Hitler and all his works, instead of closing it down as he could honourably have done, expelled the Jewish members from the famous Nationalökonomische Gesellschaft of which he was president. It was the opinion of the writer of this paper, when president of the NÖG, that it constitutes a moral obligation for the organization to deal with the fate of Austrian economists under the Third Reich. He therefore applied to the Jubiläumsfonds of the OeNB (Oesterreichische Nationalbank, the Austrian central bank) for a research project entitled “Austrian Economists during the NS period”, which was funded for the period 2016–2019 and is still work in progress at the time of writing. This paper reports on some preliminary results of this research project on Austrian economists under the Nazi regime from 1938 to 1945. The final results are planned to be published in a book in German (Neck forthcoming), including contributions by Theodor Venus and Hansjörg Klausinger, who also worked on the project.",
46.0,3.0,Empirica,09 April 2018,https://link.springer.com/article/10.1007/s10663-018-9403-0,Eliciting permanent and transitory undeclared work from matched administrative and survey data,August 2019,Péter Elek,János Köllő,,Male,Male,Unknown,Male,"Undeclared employment—when the worker is not reported to the authorities and neither the employer nor the employee pay taxes or contributions in the relationship—is notoriously difficult to measure. Survey-based methods rely on information directly provided by the population, but these tend to underestimate the true magnitude of black work, and are strongly affected by cultural differences. For instance, according to the Eurobarometer Survey, only 4% of the EU population responded in 2013 that they had undertaken undeclared paid work in the preceding year (European Commission 2014); the highest rates were recorded in Latvia, the Netherlands, Estonia and Denmark (9–11%), while Southern European countries reported very low rates (1–3% in Malta, Portugal, Cyprus, Italy and Greece).
 Indirect methods estimate total employment with observable proxies, and compare these with reported employment figures to obtain a measure of undeclared work. A wide range of techniques fall into this category,Footnote 1 the most promising being the discrepancy or labour input method, which was advocated by a task force as a methodologically appropriate tool for EU-wide measurement of undeclared work (GHK/FGB 2009). This technique assumes that labour force surveys register most of the undeclared work because individuals are not motivated to conceal their true employment status in an unofficial interview. Hence undeclared work can be approximated by comparing Labour Force Survey (LFS) employment with registered employment figures, which may come from administrative sources or enterprise surveys. This method—in line with other indirect techniques (Schneider 2012)—yields considerably larger estimates of undeclared work than do survey-based methods: e.g. 16–17% of total employment in Hungary between 2001 and 2005 (Elek et al. 2009; Benedek et al. 2013) and 8–30% of various macroeconomic aggregates in European countries.Footnote 2 These estimates do not suffer from the underreporting bias of surveys, but they are generally not suitable for multivariate analysis, because only group-wise comparisons are possible, across dimensions that are available in both data sources. Hence, most analysis using the labour input method provides only sectoral, regional or gender-specific breakdown (GHK/FGB 2009). In this paper, we exploit a unique panel dataset from Hungary that matches self-reported and administrative employment data at the individual level. The data relate to workers who reported at least 2 years of uninterrupted tenure in the jobs they held in January–March 2008, when they were interviewed for the LFS. We assess the pensionable years they accrued in 2001–2006, using quality-checked administrative data provided by the National Pension Insurance Directorate (NPID). The matched data enable us to combine the strengths of the ‘labour input’ method and survey-based methods by analysing the determinants of undeclared work in a multivariate setting. We examine the data with regard to biases stemming from non-random sampling, recall bias on the part of LFS respondents, and technical failures and negligence on the part of employers, the NPID or the postal service. Methodologically, we estimate random-effects (RE) linear and probit models as well as a RE probit model with endogenous selection to account for non-random sampling in the matched panel dataset. These models are estimated with maximum simulated likelihood. As a further advantage, the dataset allows us to separate permanent and transitory non-reporting. We build a two-regime model, where both permanent and transitory non-reporting probabilities depend on the observables, and where transitory non-reporting follows a Markov chain. This model is estimated with maximum likelihood. We find that of those workers who were observed in the sample for 6 years, around 6–7% were never reported; around 3–4% were unreported only once; and around 4% were unreported between two and five times. The econometric estimates (especially those relating to permanently unreported workers) offer support for the hypothesis that the bulk of non-reporting reflects informal employment: in line with other studies, they predict lower reporting rates in, for example, agriculture and transport, various forms of atypical work, among males and in small firms. The two-regime model allows us to examine the consequences of undeclared work on access to health care and pensions. We estimate that about one in ten workers are at risk of receiving only emergency treatment in health care, and about 6% foresee a substantial loss (of 15% or more) in terms of old-age pensions. Our analysis relates to two strands of existing literature. According to the traditional economic approach (Slemrod and Yitzhaki 2002), economic actors make decisions about tax evasion by comparing expected fines and the amount of tax that can be evaded. Therefore, tax evasion is reduced by higher individual risk aversion, stronger deterrence and lower tax rates (Buehn and Schneider 2012). However, it is difficult to explain willingness to pay taxes using the standard economic model—considering the limited risk of being caught and the rates of potential fines—and therefore more recent literature incorporates the effect of the social environment, such as rule following, the need to belong to groups and other interactions (Feld and Larsen 2012; Pickhardt and Prinz 2014). The monopsonistic position of employers and the low bargaining power of employees may also be important (Cichocki and Tyrowicz 2010). Our estimates of differences in undeclared work across gender, level of education, work experience, occupation, place of residence, sector, size and ownership of the employer provide insight into how differences in risk aversion, the expected costs of cheating and social interactions influence the prevalence of undeclared work. These results complement already existing cross-sectional multivariate analyses, which are, however, mainly available from survey-based studies (Williams 2007; Feld and Larsen 2012; European Commission 2014). By giving a detailed description of the dynamics of non-reporting, our approach is also related to the literature that models measurement error in earnings using matched administrative and survey data (Pischke 1995; Abowd and Stinson 2013). A few papers focus specifically on tax evasion using matched microdata (Baldini et al. 2009; Paulus 2015). However, in contrast to our paper, that stream of literature does not concentrate on undeclared work (i.e. full income tax evasion) and also follows a different econometrics modelling framework, because earnings are continuous, whereas our undeclared work dummy is a binary variable.",4
