Volume,Issue,Journal Name,Published Date,Link,Title,Journal Year,Author 1,Author 2,Author 3,Gender_Author 1,Gender_Author 2,Gender_Author 3,Article_Gender,Intro,Citations
40.0,4.0,Empirica,08 July 2012,https://link.springer.com/article/10.1007/s10663-012-9195-6,Competition and educational quality: evidence from the Netherlands,November 2013,Elbert Dijkgraaf,Raymond H. J. M. Gradus,J. Matthijs de Jong,Male,Male,Unknown,Male,"The literature discusses whether competition between schools increases the quality of educational outcomes. Friedman (1962) claimed that school choice policies promise to align the incentives of school management with demand. Positive effects on educational outcomes can occur if students choose schools with higher quality levels. This increases the incentives for schools to invest in the quality of the primary process to improve educational outcomes. From a theoretical point of view, a negative effect of competition on quality is also possible. In practice, many other characteristics influence school choice. If, for instance, students look more at their friends’ choices or at the attractiveness of sports programs, the link between school choice and quality might be very different. Schools might choose to invest time and money in characteristics appreciated by potential students which are not related to the (direct) quality of education and might see greater benefits in marketing themselves to prospective students than in improving their programs. In this case, the effect of competition on educational outcomes might become negative since less time and money are available for the primary process. In addition, measuring and interpreting quality might not be straightforward and costless for students and their parents. Which effect dominates is a matter for empirical analysis. In many cross-country studies differences in economic growth have been related to school attainment, years of schooling and school autonomy and decentralization and there is evidence for a significant positive relation between (cognitive) skills and economic growth [see for an overview Hanushek and Woessmann (2011)]. In addition, cross-country comparison indicates that students in countries with a larger share of privately managed schools (and public school funding) tend to perform better on average Woessmann (2009) and Maslowski et al. (2007). Recent macro evidence corroborates the conclusion that this seems due to a causal effect of private-sector competition measured by the share of students attending privately operated schools (West and Woessmann 2009). Nevertheless, the share of private students is only a weak proxy for competition. In addition, based on panel data empirical analysis of the effect of competition on the quality of educational outcomes is scarce due to the absence of micro data and large-scale competition in many countries. A few examples make this clear. Hoxby (2000) uses the concept of Tiebout choice, that parents choose between US school districts based on the quality differences between schools, to test this hypothesis. Her result suggests that competition enhances quality for elementary and secondary education. However, Rothstein (2007) shows that her results are sensitive to the construction of the competition variables and claims that alternative constructions yield insignificant results. Moreover, Rothstein (2007, p. 2034) finds that Hoxby’s specification is subject to selection bias because the sample excludes private school students. These criticisms are disputed in Hoxby (2007), but the discussion is still unsettled. More important seems the fact that Tiebout choice is only a weak indicator for the effect of free school choice. Parents have to move to another district in order to vote with their feet. Although there is evidence that parents actually do this (Barrow 2002), fully free choice results in much more competitive pressure as parents can choose other schools in and out of district without moving. Unfortunately, the only evidence available is for small-scale free choice or voucher programs as only a few countries in the world provide fully free choice for parents. Lavy (2010), for example, analyzes the effects of free school choice using an experiment in one of the districts of Tel Aviv (Israel) that allowed parents to choose between public schools both in and out of district. He finds significant positive effects of free school choice on the quality of public schools. Sandström and Bergström (2005) show that the increased parental choice in Sweden since 1992 as a result of a voucher program supports the hypothesis that school results in public schools improve due to competition with independent schools. However, if competition is measured by the commonly used Herfindahl–Hirschman concentration index, the effects are sometimes negative and sometimes insignificant. Also, the Swedish voucher program is small: only 7 % of students were enrolled in an independent school in 2004. Chakrabarti (2008) analyses the effects of a voucher program for private schools in Milwaukee. He finds a larger effect in the second phase of this program, suggesting that the larger availability of places resulted in more positive effects of competition on quality of public schools. He concludes that program characteristics might be important to explain effects of competition on quality. In addition, Hanushek et al. (2007) investigates the quality differences between charter and public schools using data for Texas. They find that quality differences are absent after the start-up phase, which is troublesome for most charter schools. Empirical studies for other US states have tended to find effects ranging from slightly positive to modestly negative on charter school students’ reading and math growth (see Bifulco and Ladd (2006) for North Carolina and Sass (2006) for Florida). Nevertheless, studies such as Hoxby and Rockoff (2005) and Hoxby and Murarka (2009) focusing on charters schools in relatively vibrant urban areas, and therefore with abundant choice, have found more positive effects. However, an important limitation of these studies is that they include only schools with oversubscribed lotteries, which are probably the most desirable schools in these areas. Therefore, in a US overview of the vouchers and chartered schools literature Loeb et al. (2011) claim that the empirical evidence of the effectiveness of vouchers in improving student’s achievement is decidedly mixed. Also Rouse and Barrow (2009, p. 22), after summarizing the literature on voucher programs, conclude that these small-scale experiments cannot be used to test Friedman’s hypothesis and thus that “many questions remain about the potential long-term impacts on academic outcomes and about both the public and private sector responses to a large, permanent, and well-funded voucher program.”Footnote 1 The Netherlands is one of the few countries in the world where such impacts can currently be measured as it has long experience with free choice, the role of both public and private schools is large and funding is the same for all types of schools. The other example might be Chile where 1,000 schools entered the market as a result of a voucher program open for all schools, more or less comparable to the situation in the Netherlands. Hsieh and Urquiola (2006) found no effects of competition on quality in this case. In the Netherlands, the model of free parental choice between different types of schools has been present since the historical national school dispute (“schoolstrijd”) came to an end in 1917 (Kossmann 1978).Footnote 2 Ever since, parental choice and equal opportunities for public and private schools have even been guaranteed in the Dutch constitution. Private primary and secondary schools are managed by independent non-profit boards, and they abide by practically the same rules as public schools. Many, but not all, private schools have a religious denomination. Private schools are fully financed by the government at exactly the same level as public schools, both based on the number of students. The Dutch system could, in fact, be characterized by a full voucher program with 100 % funding. Parents are free to choose any public or private school in the country. Schools are in principle obliged to accept all students. The only exception the law permits is for religious schools to ask that parents agree with their denomination. In practice, only a few, especially Protestant, schools use this exception. Selection with respect to the a priori quality of students is never allowed. This is an important difference from voucher programs in other countries, where schools can often select the students they want. Free choice is used very often: in 2006, 71 % of students are at private schools. Since the introduction of free parental choice, a large number of private schools entered the market. However, currently, new schools are created only very occasionally. The reason for this is that parents can start up a new school siteFootnote 3 as long as they prove that the denomination (or educational method, such as Dalton or Montessori) they present is not yet represented in their surroundings and that there are enough students who want to attend a school with such a denomination. Given the long history, nearly all types of schools already exist.Footnote 4 This means that competition in the Netherlands occurs between existing school sites and not with entrants. This is a very important institutional characteristic which allows us to use the number of school sites as an instrument for competition in the market to test for endogeneity problems. Thus, competition between school sites measured by concentration indices based on market shares (in our case, the Herfindahl–Hirschman index) might be endogenous with respect to quality as lower quality might lead to changes in market shares if higher-quality schools attract students. The number of school sites, however, is not endogenous in the Netherlands, as low quality in a market is not a possible reason for getting permission to start a new school site. The number of school sites in the Netherlands is therefore exogenous with respect to quality. This is a major difference from US markets, where entry is very often the result of dissatisfaction with existing school quality (Hoxby 2000). Given the long history of competition between schools in the Netherlands, one would expect effects on quality, if present, to be visible. However, the effect of competition on quality has never been systematically analyzed for the Netherlands. In this paper, we fill that gap based on data for secondary schools for the period 2002–2006. We use datasets from the Dutch Ministry of Education and the national monitoring agency for education (“Onderwijsinspectie”). We measure school quality by three achievement variables: the average score in the nationwide final exams, the percentage of students who obtain a diploma and the percentage of students graduating on time. For all three measures, we find evidence of a negative effect of competition on quality, which is quite small. This effect is robust for alternative specifications and sensitivity analyses, including endogeneity-correcting instrumental variable (IV) estimations. We show that the effect is dominated by small and medium-sized schools and by schools that do not have a Protestant or Catholic denomination. The article is organized as follows. Section 2 discusses the methodology and the available data. The estimation results are presented in Sect. 3 and the robustness of the results is discussed in Sect. 4. Section 5 draws some conclusions.",4
40.0,4.0,Empirica,14 December 2012,https://link.springer.com/article/10.1007/s10663-012-9208-5,Labour market institutions and unemployment: an international panel data analysis,November 2013,Gebhard Flaig,Horst Rottmann,,Male,Male,Unknown,Male,,19
40.0,4.0,Empirica,20 October 2012,https://link.springer.com/article/10.1007/s10663-012-9205-8,Has the Euro changed business cycle synchronization? Evidence from the core and the periphery,November 2013,Sybille Lehwald,,,Female,Unknown,Unknown,Female,,34
40.0,4.0,Empirica,31 October 2012,https://link.springer.com/article/10.1007/s10663-012-9206-7,Exchange-rate variability and U.S.-French trade flows: evidence from industry data,November 2013,Mohsen Bahmani-Oskooee,Hanafiah Harvey,Scott W. Hegerty,Male,Unknown,Male,Male,,4
41.0,1.0,Empirica,17 January 2014,https://link.springer.com/article/10.1007/s10663-014-9245-3,"Special issue: Selected papers of the 31st CIRECT conference, Vienna, 2012",February 2014,Christian Glocker,Gerhard Schwarz,,Male,Male,Unknown,Male,,2
41.0,1.0,Empirica,20 July 2013,https://link.springer.com/article/10.1007/s10663-013-9231-1,Price competition and market transparency: evidence from a random response technique,February 2014,Klaus Friesenbichler,George Clarke,Michael Wong,Male,Male,Male,Male,,5
41.0,1.0,Empirica,05 July 2013,https://link.springer.com/article/10.1007/s10663-013-9230-2,A micro-based non-inflationary rate of capacity utilisation as a measure of inflationary pressure: evidence for Austria,February 2014,Pirmin Fessler,Fabio Rumler,Gerhard Schwarz,Male,Male,Male,Male,,1
41.0,1.0,Empirica,08 June 2013,https://link.springer.com/article/10.1007/s10663-013-9228-9,Consumer confidence and consumption forecast: a non-parametric approach,February 2014,Giancarlo Bruno,,,Male,Unknown,Unknown,Male,,14
41.0,1.0,Empirica,05 June 2013,https://link.springer.com/article/10.1007/s10663-013-9227-x,Bayesian averaging of classical estimates in forecasting macroeconomic indicators with application of business survey data,February 2014,Piotr Białowolski,Tomasz Kuszewski,Bartosz Witkowski,Male,Male,Male,Male,,10
41.0,1.0,Empirica,04 June 2013,https://link.springer.com/article/10.1007/s10663-013-9225-z,Inflation and output growth uncertainty in individual survey expectations,February 2014,Maritta Paloviita,Matti Viren,,Female,Male,Unknown,Mix,,
41.0,1.0,Empirica,04 June 2013,https://link.springer.com/article/10.1007/s10663-013-9226-y,Corporate patents and knowledge sourcing from universities,February 2014,Martin Falk,,,Male,Unknown,Unknown,Male,,3
41.0,1.0,Empirica,30 May 2013,https://link.springer.com/article/10.1007/s10663-013-9224-0,Financial stress and economic activity in Germany,February 2014,Björn van Roye,,,Male,Unknown,Unknown,Male,,37
41.0,2.0,Empirica,09 April 2014,https://link.springer.com/article/10.1007/s10663-014-9256-0,Special issue: European Integration: Quo Vadis? Selected Papers from the 2013 Annual Meeting of the Austrian Economic Association,May 2014,Michael Pfaffermayr,Johann Scharler,,Male,Male,Unknown,Male,,
41.0,2.0,Empirica,10 December 2013,https://link.springer.com/article/10.1007/s10663-013-9242-y,Convergence as a heterogeneous process: what can be learnt about convergence in EMU from regional experiences?,May 2014,Matthias Firgo,Peter Huber,,Male,Male,Unknown,Male,,8
41.0,2.0,Empirica,05 April 2014,https://link.springer.com/article/10.1007/s10663-014-9252-4,“Haircuts” for the EMU periphery: virtue or vice?,May 2014,Reinhard Neck,Dmitri Blueschke,,Male,Male,Unknown,Male,,15
41.0,2.0,Empirica,05 April 2013,https://link.springer.com/article/10.1007/s10663-012-9207-6,The effect of currency unions on business cycle correlations: the EMU case,May 2014,Styliani Christodoulopoulou,,,Female,Unknown,Unknown,Female,,9
41.0,2.0,Empirica,13 February 2013,https://link.springer.com/article/10.1007/s10663-013-9209-z,"International trade, technological change and wage inequality in the UK economy",May 2014,Sabine Engelmann,,,Female,Unknown,Unknown,Female,,1
41.0,2.0,Empirica,28 February 2013,https://link.springer.com/article/10.1007/s10663-013-9210-6,The fundamentals of sovereign debt sustainability: evidence from 15 OECD countries,May 2014,Christian Schoder,,,Male,Unknown,Unknown,Male,,6
41.0,2.0,Empirica,21 March 2013,https://link.springer.com/article/10.1007/s10663-013-9211-5,Was Spanish fiscal policy sustainable?,May 2014,Ulrich Haskamp,,,Male,Unknown,Unknown,Male,,1
41.0,2.0,Empirica,28 January 2014,https://link.springer.com/article/10.1007/s10663-014-9247-1,Is the European integration speeding up the economic convergence process of the Central and South-Eastern European countries? A shock perspective,May 2014,Igor Veličkovski,Aleksandar Stojkov,,Male,Male,Unknown,Male,,3
41.0,2.0,Empirica,18 April 2014,https://link.springer.com/article/10.1007/s10663-014-9253-3,"Growth effects of structural reforms in Southern Europe: the case of Greece, Italy, Spain and Portugal",May 2014,Janos Varga,Werner Roeger,Jan in’t Veld,Unknown,Male,Male,Male,,14
41.0,2.0,Empirica,15 May 2013,https://link.springer.com/article/10.1007/s10663-013-9221-3,Government spending and revenues in the Greek economy: evidence from nonlinear cointegration,May 2014,Athanasios Athanasenas,Constantinos Katrakilidis,Emmanouil Trachanas,Male,Unknown,Male,Male,,19
41.0,3.0,Empirica,19 June 2014,https://link.springer.com/article/10.1007/s10663-014-9269-8,"Special issue: Selected papers of the WWWforEurope conference on modelling growth and socio-ecological transition, Vienna, 2013",August 2014,Margit Schratzenstaller,Teresa Weiss,Sigrid Stix,Female,Female,Female,Female,,1
41.0,3.0,Empirica,03 December 2013,https://link.springer.com/article/10.1007/s10663-013-9239-6,"A simple model of income, aggregate demand and the process of credit creation by private banks",August 2014,Giovanni Bernardo,Emanuele Campiglio,,Male,Male,Unknown,Male,,7
41.0,3.0,Empirica,27 May 2014,https://link.springer.com/article/10.1007/s10663-014-9262-2,Data envelopment analysis for measuring economic growth in terms of welfare beyond GDP,August 2014,M. Lábaj,M. Luptáčik,E. Nežinský,Unknown,Unknown,Unknown,Unknown,,
41.0,3.0,Empirica,19 June 2014,https://link.springer.com/article/10.1007/s10663-014-9264-0,Modeling the diffusion of general purpose technologies in an evolutionary multi-sector framework,August 2014,A. Rainer,R. Strohmaier,,Unknown,Unknown,Unknown,Unknown,,
41.0,3.0,Empirica,14 June 2014,https://link.springer.com/article/10.1007/s10663-014-9267-x,"A low growth path in Austria: potential causes, consequences and policy options",August 2014,Andrea Stocker,Anett Großmann,Marc Ingo Wolter,Female,Female,Male,Mix,,
41.0,3.0,Empirica,06 December 2013,https://link.springer.com/article/10.1007/s10663-013-9241-z,Logistics performance and export competitiveness: European experience,August 2014,Rosa Puertas,Luisa Martí,Leandro García,Female,Female,Male,Mix,,
41.0,3.0,Empirica,21 January 2014,https://link.springer.com/article/10.1007/s10663-014-9246-2,A financial market stress indicator for Austria,August 2014,Christian Glocker,Serguei Kaniovski,,Male,Male,Unknown,Male,,4
41.0,3.0,Empirica,20 February 2014,https://link.springer.com/article/10.1007/s10663-014-9249-z,A general equilibrium evaluation of the fiscal costs of trade liberalization in Ukraine,August 2014,Miriam Frey,Zoryana Olekseyuk,,Female,Unknown,Unknown,Female,,8
41.0,3.0,Empirica,23 April 2014,https://link.springer.com/article/10.1007/s10663-014-9254-2,Does integration and economic policy coordination promote business cycle synchronization in the EU?,August 2014,N. Antonakakis,G. Tondl,,Unknown,Unknown,Unknown,Unknown,,
41.0,3.0,Empirica,12 April 2014,https://link.springer.com/article/10.1007/s10663-014-9255-1,Institutions of conflict management and economic growth revisited: a short note,August 2014,Friedrich Schneider,Stefan D. Haigner,Florian Wakolbinger,Male,Male,Male,Male,,
41.0,4.0,Empirica,21 March 2013,https://link.springer.com/article/10.1007/s10663-013-9215-1,Rethinking the import-productivity nexus for Italian manufacturing,November 2014,Giuliano Conti,Alessia Lo Turco,Daniela Maggioni,Male,Female,Female,Mix,,
41.0,4.0,Empirica,01 May 2013,https://link.springer.com/article/10.1007/s10663-013-9218-y,The determinants of vulnerability to currency crises: country-specific factors versus regional factors,November 2014,Ping Wang,Tomoe Moore,,,Female,Unknown,Mix,,
41.0,4.0,Empirica,17 May 2013,https://link.springer.com/article/10.1007/s10663-013-9222-2,Do Balkan economies catch up with EU? New evidence from panel unit root analysis,November 2014,Eftychia Tsanana,Constantinos Katrakilidis,,Female,Unknown,Unknown,Female,,8
41.0,4.0,Empirica,22 May 2013,https://link.springer.com/article/10.1007/s10663-013-9223-1,Generational accounts for Belgium: fiscal sustainability at a glance,November 2014,André Decoster,Xavier Flawinne,Pieter Vanleenhove,Male,Male,Male,Male,,5
41.0,4.0,Empirica,27 August 2013,https://link.springer.com/article/10.1007/s10663-013-9232-0,Discretionary fiscal policy and economic activity in Greece,November 2014,Athanasios O. Tagkalakis,,,Male,Unknown,Unknown,Male,,3
41.0,4.0,Empirica,06 September 2013,https://link.springer.com/article/10.1007/s10663-013-9233-z,Nonlinear relationship between health care expenditure and its determinants: a panel smooth transition regression model,November 2014,Po-Chin Wu,Shiao-Yen Liu,Sheng-Chieh Pan,Unknown,Unknown,Unknown,Unknown,,
41.0,4.0,Empirica,27 September 2013,https://link.springer.com/article/10.1007/s10663-013-9234-y,Total factor productivity in the Lithuanian family farms after accession to the EU: application of the bias-corrected Malmquist indices,November 2014,Tomas Baležentis,,,Male,Unknown,Unknown,Male,,8
41.0,4.0,Empirica,03 October 2013,https://link.springer.com/article/10.1007/s10663-013-9235-x,Import-push or export-pull? An industry-level analysis of the impact of trade on firm exit,November 2014,Ina Charlotte Jäkel,,,Female,Unknown,Unknown,Female,,3
41.0,4.0,Empirica,06 November 2013,https://link.springer.com/article/10.1007/s10663-013-9236-9,Output growth and investment dynamics in Finland: a panel data analysis,November 2014,Tahir Mahmood,Eatzaz Ahmad,,Male,Unknown,Unknown,Male,,
41.0,4.0,Empirica,12 November 2013,https://link.springer.com/article/10.1007/s10663-013-9238-7,Who trusts others more? A cross-European study,November 2014,Giuseppe Albanese,Guido de Blasio,,Male,Male,Unknown,Male,,9
41.0,4.0,Empirica,10 December 2013,https://link.springer.com/article/10.1007/s10663-013-9240-0,A longer-run perspective on fiscal sustainability,November 2014,António Afonso,João Tovar Jalles,,Male,,Unknown,Mix,,
42.0,1.0,Empirica,12 November 2013,https://link.springer.com/article/10.1007/s10663-013-9237-8,Commodity trade between EU and Egypt and Orcutt’s hypothesis,February 2015,Mohsen Bahmani-Oskooee,Amr Sadek Hosny,,Male,Male,Unknown,Male,,3
42.0,1.0,Empirica,03 January 2014,https://link.springer.com/article/10.1007/s10663-013-9243-x,Which factors affect the distribution of direct payments among farmers in the EU Member States?,February 2015,S. Severini,A. Tantari,,Unknown,Unknown,Unknown,Unknown,,
42.0,1.0,Empirica,24 January 2014,https://link.springer.com/article/10.1007/s10663-014-9244-4,Decomposing wage discrimination in Germany and Austria with counterfactual densities,February 2015,Thomas Grandner,Dieter Gstach,,Male,Male,Unknown,Male,,18
42.0,1.0,Empirica,05 February 2014,https://link.springer.com/article/10.1007/s10663-014-9248-0,Regime dependent dynamics and European stock markets: Is asset allocation really possible?,February 2015,Wasim Ahmad,N. R. Bhanumurthy,Sanjay Sehgal,Male,Unknown,Male,Male,,8
42.0,1.0,Empirica,06 March 2014,https://link.springer.com/article/10.1007/s10663-014-9250-6,Exchange-rate volatility and commodity trade between the E.U. and Egypt: evidence from 59 industries,February 2015,Mohsen Bahmani-Oskooee,Scott W. Hegerty,Amr Hosny,Male,Male,Male,Male,,10
42.0,1.0,Empirica,18 March 2014,https://link.springer.com/article/10.1007/s10663-014-9251-5,"Access to finance, exporting and a non-monotonic firm expansion",February 2015,Jože P. Damijan,Črt Kostevc,Sašo Polanec,Male,Male,Male,Male,,5
42.0,1.0,Empirica,14 May 2014,https://link.springer.com/article/10.1007/s10663-014-9257-z,Price and non-price competitiveness in export demand: empirical evidence from Italy,February 2015,Bernardina Algieri,,,Female,Unknown,Unknown,Female,,9
42.0,1.0,Empirica,06 May 2014,https://link.springer.com/article/10.1007/s10663-014-9258-y,Financial market reaction to Federal Reserve communications: Does the global financial crisis make a difference?,February 2015,Bernd Hayo,Ali M. Kutan,Matthias Neuenkirch,Male,Male,Male,Male,,10
42.0,2.0,Empirica,25 March 2015,https://link.springer.com/article/10.1007/s10663-015-9297-z,Special Issue: The Economics of Inequality,May 2015,Wilfried Altzinger,Giacomo Corneo,Agnes Kügler,Male,Male,Female,Mix,,
42.0,2.0,Empirica,15 February 2015,https://link.springer.com/article/10.1007/s10663-015-9288-0,Can we reduce income inequality in OECD countries?,May 2015,Anthony B. Atkinson,,,Male,Unknown,Unknown,Male,,8
42.0,2.0,Empirica,07 February 2015,https://link.springer.com/article/10.1007/s10663-015-9283-5,Income inequality from a lifetime perspective,May 2015,Giacomo Corneo,,,Male,Unknown,Unknown,Male,,6
42.0,2.0,Empirica,07 February 2015,https://link.springer.com/article/10.1007/s10663-015-9282-6,Capital income shares and income inequality in 16 EU member countries,May 2015,Eva Schlenker,Kai D. Schmid,,Female,Male,Unknown,Mix,,
42.0,2.0,Empirica,12 March 2015,https://link.springer.com/article/10.1007/s10663-015-9293-3,Socioeconomic structures of the Austrian wealth distribution,May 2015,Stefan Humer,Mathias Moser,Matthias Schnetzer,Male,Male,Male,Male,,2
42.0,2.0,Empirica,12 March 2015,https://link.springer.com/article/10.1007/s10663-015-9290-6,Factor decomposition of the wealth distribution in the euro area,May 2015,Peter Lindner,,,Male,Unknown,Unknown,Male,,6
42.0,2.0,Empirica,22 March 2015,https://link.springer.com/article/10.1007/s10663-015-9295-1,Who holds risky assets and how much?,May 2015,Jun Chao Zhan,,,,Unknown,Unknown,Mix,,
