Volume,Issue,Journal Name,Published Date,Link,Title,Journal Year,Author 1,Author 2,Author 3,Author 4,Author 5,Author 6,Author 7,Author 8,Author 9,Author 10,Gender_Author 1,Gender_Author 2,Gender_Author 3,Gender_Author 4,Gender_Author 5,Gender_Author 6,Gender_Author 7,Gender_Author 8,Gender_Author 9,Gender_Author 10
28,2,Open Economies Review,17 November 2016,https://link.springer.com/article/10.1007/s11079-016-9423-y,International Trade Finance and Exports: Evidence from Korean Bank-Intermediated Trade Finance Instruments,April 2017,Sangyeon Hwang,Hyejoon Im,,,,,,,,,Unknown,Unknown,Unknown,Unknown,Unknown,Unknown,Unknown,Unknown,Unknown,Unknown
28,2,Open Economies Review,25 November 2016,https://link.springer.com/article/10.1007/s11079-016-9424-x,The Impact of US Uncertainty Shocks on Small Open Economies,April 2017,Pär Stockhammar,Pär Österholm,,,,,,,,,Male,Male,Unknown,Unknown,Unknown,Unknown,Unknown,Unknown,Unknown,Unknown
28,2,Open Economies Review,07 December 2016,https://link.springer.com/article/10.1007/s11079-016-9427-7,De Facto Exchange Rate Regime Classifications: An Evaluation,April 2017,Michael F. Bleaney,Mo Tian,Lin Yin,,,,,,,,Male,,Female,Unknown,Unknown,Unknown,Unknown,Unknown,Unknown,Unknown
28,3,Open Economies Review,12 April 2017,https://link.springer.com/article/10.1007/s11079-017-9434-3,The International Synchronisation of Business Cycles: the Role of Animal Spirits,July 2017,Paul De Grauwe,Yuemei Ji,,,,,,,,,Male,Unknown,Unknown,Unknown,Unknown,Unknown,Unknown,Unknown,Unknown,Unknown
28,3,Open Economies Review,19 January 2017,https://link.springer.com/article/10.1007/s11079-016-9430-z,China Spillovers: New Evidence from Time-Varying Estimates,July 2017,Davide Furceri,João Tovar Jalles,Aleksandra Zdzienicka,,,,,,,,Male,,Female,Unknown,Unknown,Unknown,Unknown,Unknown,Unknown,Unknown
28,3,Open Economies Review,07 March 2017,https://link.springer.com/article/10.1007/s11079-017-9435-2,The London Monetary and Economic Conference of 1933 and the End of the Great Depression,July 2017,Sebastian Edwards,,,,,,,,,,Male,Unknown,Unknown,Unknown,Unknown,Unknown,Unknown,Unknown,Unknown,Unknown
28,3,Open Economies Review,15 September 2016,https://link.springer.com/article/10.1007/s11079-016-9418-8,Capital Flow Management Policies and Riskiness of External Liability Structures: the Role of Local Financial Markets,July 2017,Wenwen Sheng,M. C. Sunny Wong,,,,,,,,,Unknown,Unknown,Unknown,Unknown,Unknown,Unknown,Unknown,Unknown,Unknown,Unknown
28,3,Open Economies Review,17 December 2016,https://link.springer.com/article/10.1007/s11079-016-9426-8,Central Bank Balance Sheet Policies and Inflation Expectations,July 2017,Jan Willem van den End,Christiaan Pattipeilohy,,,,,,,,,Male,Male,Unknown,Unknown,Unknown,Unknown,Unknown,Unknown,Unknown,Unknown
28,3,Open Economies Review,12 December 2016,https://link.springer.com/article/10.1007/s11079-016-9428-6,Globalization and Inflation: a Swiss Perspective,July 2017,John A. Tatom,,,,,,,,,,Male,Unknown,Unknown,Unknown,Unknown,Unknown,Unknown,Unknown,Unknown,Unknown
28,3,Open Economies Review,07 December 2016,https://link.springer.com/article/10.1007/s11079-016-9425-9,Credit Booms in Developing Countries: Are They Different from Those in Advanced and Emerging Market Countries?,July 2017,Channarith Meng,Roberto Leon Gonzalez,,,,,,,,,Unknown,Male,Unknown,Unknown,Unknown,Unknown,Unknown,Unknown,Unknown,Unknown
28,3,Open Economies Review,31 August 2016,https://link.springer.com/article/10.1007/s11079-016-9412-1,The Use of Cheques in the European Union: A Cross-Country Analysis,July 2017,Vânia G. Silva,Esmeralda A. Ramalho,Carlos R. Vieira,,,,,,,,Unknown,Female,Male,Unknown,Unknown,Unknown,Unknown,Unknown,Unknown,Unknown
28,4,Open Economies Review,10 May 2017,https://link.springer.com/article/10.1007/s11079-017-9439-y,Tariff Reduction and Income Inequality: Some Empirical Evidence,September 2017,Jorge Rojas-Vallejos,Stephen J. Turnovsky,,,,,,,,,Male,Male,Unknown,Unknown,Unknown,Unknown,Unknown,Unknown,Unknown,Unknown
28,4,Open Economies Review,28 March 2017,https://link.springer.com/article/10.1007/s11079-017-9438-z,"Real Wage Flexibility, Economic Fluctuations, and Exchange Rate Regimes",September 2017,Hyuk Jae Rhee,Jeongseok Song,,,,,,,,,,Unknown,Unknown,Unknown,Unknown,Unknown,Unknown,Unknown,Unknown,Unknown
28,4,Open Economies Review,17 February 2017,https://link.springer.com/article/10.1007/s11079-017-9433-4,"Government Size, Trade Openness, and Output Volatility: A Case of fully Integrated Economies",September 2017,Eiji Fujii,,,,,,,,,,Male,Unknown,Unknown,Unknown,Unknown,Unknown,Unknown,Unknown,Unknown,Unknown
28,4,Open Economies Review,13 January 2017,https://link.springer.com/article/10.1007/s11079-016-9429-5,A Tradeoff between the Output and Net Foreign Asset Effects of Pension Reform,September 2017,Mario Catalán,Nicolas E. Magud,,,,,,,,,Male,Male,Unknown,Unknown,Unknown,Unknown,Unknown,Unknown,Unknown,Unknown
28,4,Open Economies Review,18 February 2017,https://link.springer.com/article/10.1007/s11079-017-9432-5,Job Destruction and the Impact of Imports on Wages in U.S. Manufacturing,September 2017,Youngho Kang,,,,,,,,,,Unknown,Unknown,Unknown,Unknown,Unknown,Unknown,Unknown,Unknown,Unknown,Unknown
28,4,Open Economies Review,19 May 2017,https://link.springer.com/article/10.1007/s11079-017-9440-5,How Do Emerging Markets Respond to Macroeconomic Shocks? - Dynamic Panel Evidence on the Effects of Disasters,September 2017,Yabin Wang,,,,,,,,,,Unknown,Unknown,Unknown,Unknown,Unknown,Unknown,Unknown,Unknown,Unknown,Unknown
28,4,Open Economies Review,16 June 2017,https://link.springer.com/article/10.1007/s11079-017-9441-4,Capital Controls and Financial Frictions in a Small Open Economy,September 2017,Shigeto Kitano,Kenya Takaku,,,,,,,,,Male,,Unknown,Unknown,Unknown,Unknown,Unknown,Unknown,Unknown,Unknown
28,4,Open Economies Review,14 July 2017,https://link.springer.com/article/10.1007/s11079-017-9442-3,EU Enlargement and the New Goods Margin in Austrian Trade: Comment,September 2017,Ignacio del Rosal,,,,,,,,,,Male,Unknown,Unknown,Unknown,Unknown,Unknown,Unknown,Unknown,Unknown,Unknown
28,4,Open Economies Review,02 August 2017,https://link.springer.com/article/10.1007/s11079-017-9443-2,EU Enlargement and the New Goods Margin in Austrian Trade: Reply,September 2017,John T. Dalton,,,,,,,,,,Male,Unknown,Unknown,Unknown,Unknown,Unknown,Unknown,Unknown,Unknown,Unknown
28,5,Open Economies Review,23 September 2017,https://link.springer.com/article/10.1007/s11079-017-9458-8,"Introduction to the Open Economies Review Special Issue on “Monetary Policy, Exchange Rates and Integration”",November 2017,Ansgar Belke,,,,,,,,,,Male,Unknown,Unknown,Unknown,Unknown,Unknown,Unknown,Unknown,Unknown,Unknown
28,5,Open Economies Review,03 November 2017,https://link.springer.com/article/10.1007/s11079-017-9459-7,Central Bank Communication in a Low Interest Rate Environment,November 2017,Benoît Cœuré,,,,,,,,,,Male,Unknown,Unknown,Unknown,Unknown,Unknown,Unknown,Unknown,Unknown,Unknown
28,5,Open Economies Review,21 November 2017,https://link.springer.com/article/10.1007/s11079-017-9460-1,The macroeconomic effects of the ECB’s evolving QE programme: a model-based analysis,November 2017,Romanos Priftis,Lukas Vogel,,,,,,,,,Unknown,Male,Unknown,Unknown,Unknown,Unknown,Unknown,Unknown,Unknown,Unknown
28,5,Open Economies Review,18 September 2017,https://link.springer.com/article/10.1007/s11079-017-9462-z,EMU Stability: Direct and Indirect Risk Sharing,November 2017,Paolo Canofari,Giovanni Di Bartolomeo,Marcello Messori,,,,,,,,Male,Male,Male,Unknown,Unknown,Unknown,Unknown,Unknown,Unknown,Unknown
28,5,Open Economies Review,23 September 2017,https://link.springer.com/article/10.1007/s11079-017-9465-9,Business Cycle Synchronization in the EMU: Core vs. Periphery,November 2017,Ansgar Belke,Clemens Domnick,Daniel Gros,,,,,,,,Male,Male,Male,Unknown,Unknown,Unknown,Unknown,Unknown,Unknown,Unknown
28,5,Open Economies Review,07 October 2017,https://link.springer.com/article/10.1007/s11079-017-9466-8,Economic Costs and Benefits of EMU Membership from the Perspective of a Non-member,November 2017,Emilia Gyoerk,,,,,,,,,,Female,Unknown,Unknown,Unknown,Unknown,Unknown,Unknown,Unknown,Unknown,Unknown
28,5,Open Economies Review,18 October 2017,https://link.springer.com/article/10.1007/s11079-017-9463-y,Sectoral Wage Rigidities and Labour and Product Market Institutions in the Euro Area,November 2017,Robert Anderton,Arno Hantzsche,Máté Tóth,,,,,,,,Male,Male,Unknown,Unknown,Unknown,Unknown,Unknown,Unknown,Unknown,Unknown
28,5,Open Economies Review,23 September 2017,https://link.springer.com/article/10.1007/s11079-017-9461-0,Voting Behaviour in the European Parliament and Economic Governance Reform: Does Nationality Matter?,November 2017,Elisa Cencig,Laura Sabani,,,,,,,,,Female,Female,Unknown,Unknown,Unknown,Unknown,Unknown,Unknown,Unknown,Unknown
28,5,Open Economies Review,23 September 2017,https://link.springer.com/article/10.1007/s11079-017-9468-6,The Relevance of the Monetary Model for the Euro / USD Exchange Rate Determination: a Long Run Perspective,November 2017,Dimitris A. Georgoutsos,Georgios P. Kouretas,,,,,,,,,Male,Male,Unknown,Unknown,Unknown,Unknown,Unknown,Unknown,Unknown,Unknown
28,5,Open Economies Review,07 October 2017,https://link.springer.com/article/10.1007/s11079-017-9467-7,The long-run determination of the real exchange rate. Evidence from an intertemporal modelling framework using the dollar-pound exchange rate.,November 2017,Ioannis Litsios,Keith Pilbeam,,,,,,,,,Male,Male,Unknown,Unknown,Unknown,Unknown,Unknown,Unknown,Unknown,Unknown
28,5,Open Economies Review,02 October 2017,https://link.springer.com/article/10.1007/s11079-017-9464-x,Interlinkages Between Household and Corporate Debt in Advanced Economies,November 2017,Jean-Charles Bricongne,Aurora Mordonu,,,,,,,,,Unknown,Female,Unknown,Unknown,Unknown,Unknown,Unknown,Unknown,Unknown,Unknown
29,1,Open Economies Review,11 January 2018,https://link.springer.com/article/10.1007/s11079-017-9474-8,Uncovered Interest Parity and Monetary Policy Near and Far from the Zero Lower Bound,February 2018,Menzie D. Chinn,Yi Zhang,,,,,,,,,Unknown,,Unknown,Unknown,Unknown,Unknown,Unknown,Unknown,Unknown,Unknown
29,1,Open Economies Review,19 October 2017,https://link.springer.com/article/10.1007/s11079-017-9469-5,Are International Fund Flows Related to Exchange Rate Dynamics?,February 2018,Suxiao Li,Jakob de Haan,Bert Scholtens,,,,,,,,Unknown,Male,Male,Unknown,Unknown,Unknown,Unknown,Unknown,Unknown,Unknown
29,1,Open Economies Review,26 September 2017,https://link.springer.com/article/10.1007/s11079-017-9447-y,Populism and Central Bank Independence,February 2018,Charles Goodhart,Rosa Lastra,,,,,,,,,Male,Female,Unknown,Unknown,Unknown,Unknown,Unknown,Unknown,Unknown,Unknown
29,1,Open Economies Review,25 August 2017,https://link.springer.com/article/10.1007/s11079-017-9446-z,On the Logic of Fiscal Policy Coordination in a Monetary Union,February 2018,Oliver Landmann,,,,,,,,,,Male,Unknown,Unknown,Unknown,Unknown,Unknown,Unknown,Unknown,Unknown,Unknown
29,1,Open Economies Review,15 November 2017,https://link.springer.com/article/10.1007/s11079-017-9471-y,The Impact of US Financial Uncertainty Shocks on Emerging Market Economies: An International Credit Channel,February 2018,Sangyup Choi,,,,,,,,,,Unknown,Unknown,Unknown,Unknown,Unknown,Unknown,Unknown,Unknown,Unknown,Unknown
29,1,Open Economies Review,26 September 2017,https://link.springer.com/article/10.1007/s11079-017-9457-9,On the Suitability of Alternative Competitiveness Indicators for Explaining Real Exports of Advanced Economies,February 2018,Christoph Fischer,Oliver Hossfeld,Karin Radeck,,,,,,,,Male,Male,Female,Unknown,Unknown,Unknown,Unknown,Unknown,Unknown,Unknown
29,1,Open Economies Review,21 December 2017,https://link.springer.com/article/10.1007/s11079-017-9472-x,Free Trade Agreements and Volatility of Stock Returns and Exchange Rates: Evidence from NAFTA,February 2018,Bram Daelemans,Joseph P. Daniels,Farrokh Nourzad,,,,,,,,Male,Male,Male,Unknown,Unknown,Unknown,Unknown,Unknown,Unknown,Unknown
29,1,Open Economies Review,15 July 2017,https://link.springer.com/article/10.1007/s11079-017-9444-1,Multiple Import Sourcing. First Evidence for German Enterprises from Manufacturing Industries,February 2018,Joachim Wagner,,,,,,,,,,Male,Unknown,Unknown,Unknown,Unknown,Unknown,Unknown,Unknown,Unknown,Unknown
29,1,Open Economies Review,19 October 2017,https://link.springer.com/article/10.1007/s11079-017-9445-0,The Algebraic Galaxy of Simple Macroeconomic Models: A Hitchhiker’s Guide,February 2018,Evan C. Tanner,,,,,,,,,,Male,Unknown,Unknown,Unknown,Unknown,Unknown,Unknown,Unknown,Unknown,Unknown
29,2,Open Economies Review,12 April 2018,https://link.springer.com/article/10.1007/s11079-018-9493-0,"Special Issue: Financial Market Dynamics, Monetary Policy, Investment and Trade. Papers Presented at the Fourth International Symposium in Computational Economics and Finance (Paris, April 14–16, 2016)",April 2018,Fredj Jawadi,,,,,,,,,,Unknown,Unknown,Unknown,Unknown,Unknown,Unknown,Unknown,Unknown,Unknown,Unknown
29,2,Open Economies Review,24 August 2017,https://link.springer.com/article/10.1007/s11079-017-9448-x,Broker-dealer Leverage and the Stock Market,April 2018,Apostolos Serletis,Khandokar Istiak,,,,,,,,,Male,Unknown,Unknown,Unknown,Unknown,Unknown,Unknown,Unknown,Unknown,Unknown
29,2,Open Economies Review,09 March 2018,https://link.springer.com/article/10.1007/s11079-018-9480-5,Can We Still Lean Against the Wind?,April 2018,Indrani Manna,,,,,,,,,,Female,Unknown,Unknown,Unknown,Unknown,Unknown,Unknown,Unknown,Unknown,Unknown
29,2,Open Economies Review,18 April 2018,https://link.springer.com/article/10.1007/s11079-017-9452-1,The Size of the Rental Market and Housing Market Fluctuations,April 2018,Adam Czerniak,Michał Rubaszek,,,,,,,,,Male,Male,Unknown,Unknown,Unknown,Unknown,Unknown,Unknown,Unknown,Unknown
29,2,Open Economies Review,18 April 2018,https://link.springer.com/article/10.1007/s11079-017-9454-z,Oil Price Shocks and the Credit Default Swap Market,April 2018,Wei Dai,Apostolos Serletis,,,,,,,,,,Male,Unknown,Unknown,Unknown,Unknown,Unknown,Unknown,Unknown,Unknown
29,2,Open Economies Review,18 April 2018,https://link.springer.com/article/10.1007/s11079-017-9456-x,"Inflation Dynamics of Franc-Zone Countries Determinants, Co-movements and Spatial Interactions",April 2018,Eric Girardin,Cheikh A. T. Sall,,,,,,,,,Male,Unknown,Unknown,Unknown,Unknown,Unknown,Unknown,Unknown,Unknown,Unknown
29,2,Open Economies Review,26 February 2018,https://link.springer.com/article/10.1007/s11079-018-9482-3,How should Central Banks Respond to Non-neutral Inflation Expectations?,April 2018,Imran H. Shah,Ian Corrick,Abdul Saboor,,,,,,,,Male,Male,Male,Unknown,Unknown,Unknown,Unknown,Unknown,Unknown,Unknown
29,2,Open Economies Review,18 April 2018,https://link.springer.com/article/10.1007/s11079-017-9453-0,The Demand for Money for EMU: a Flexible Functional Form Approach,April 2018,William A. Barnett,Neepa B. Gaekwad,,,,,,,,,Male,Unknown,Unknown,Unknown,Unknown,Unknown,Unknown,Unknown,Unknown,Unknown
29,2,Open Economies Review,18 April 2018,https://link.springer.com/article/10.1007/s11079-017-9455-y,Optimal Currency Area: A twentieth Century Idea for the twenty-first Century?,April 2018,Joshua Aizenman,,,,,,,,,,Male,Unknown,Unknown,Unknown,Unknown,Unknown,Unknown,Unknown,Unknown,Unknown
29,2,Open Economies Review,18 April 2018,https://link.springer.com/article/10.1007/s11079-017-9451-2,"Monetary Policy, Market Structure and the Income Shares in the U.S",April 2018,George C. Bitros,,,,,,,,,,Male,Unknown,Unknown,Unknown,Unknown,Unknown,Unknown,Unknown,Unknown,Unknown
29,2,Open Economies Review,18 April 2018,https://link.springer.com/article/10.1007/s11079-017-9449-9,"Regulation, Institutions and Aggregate Investment: New Evidence from OECD Countries",April 2018,Balázs Égert,,,,,,,,,,Male,Unknown,Unknown,Unknown,Unknown,Unknown,Unknown,Unknown,Unknown,Unknown
29,2,Open Economies Review,17 March 2018,https://link.springer.com/article/10.1007/s11079-018-9479-y,New Evidence on Trade and FDI: how Large is the Euro Effect?,April 2018,Mariam Camarero,Estrella Gómez-Herrera,Cecilio Tamarit,,,,,,,,Female,Female,Male,Unknown,Unknown,Unknown,Unknown,Unknown,Unknown,Unknown
29,2,Open Economies Review,18 April 2018,https://link.springer.com/article/10.1007/s11079-017-9450-3,Assessing the Effect of Trade Openness on Health in the MENA Region: a Panel Data Analysis,April 2018,Fredj Jawadi,Sami El Gouddi,Abdeljaoued Kacem,,,,,,,,Unknown,Male,Unknown,Unknown,Unknown,Unknown,Unknown,Unknown,Unknown,Unknown
29,3,Open Economies Review,10 February 2018,https://link.springer.com/article/10.1007/s11079-017-9473-9,The Purchasing Power Parity Fallacy: Time to Reconsider the PPP Hypothesis,July 2018,Maria Eleftheriou,Nikolas A. Müller-Plantenberg,,,,,,,,,Female,Male,Unknown,Unknown,Unknown,Unknown,Unknown,Unknown,Unknown,Unknown
29,3,Open Economies Review,24 January 2018,https://link.springer.com/article/10.1007/s11079-018-9476-1,"Productivity, Demand, and the Home Market Effect",July 2018,Iader Giraldo,Fernando Jaramillo,,,,,,,,,Unknown,Male,Unknown,Unknown,Unknown,Unknown,Unknown,Unknown,Unknown,Unknown
29,3,Open Economies Review,08 March 2018,https://link.springer.com/article/10.1007/s11079-018-9481-4,Stock Market Contagion: a New Approach,July 2018,Štefan Lyócsa,Roman Horváth,,,,,,,,,Male,Male,Unknown,Unknown,Unknown,Unknown,Unknown,Unknown,Unknown,Unknown
29,3,Open Economies Review,19 December 2017,https://link.springer.com/article/10.1007/s11079-017-9470-z,Classical or Gravity? Which Trade Model Best Matches the UK Facts?,July 2018,Patrick Minford,Yongdeng Xu,,,,,,,,,Male,Unknown,Unknown,Unknown,Unknown,Unknown,Unknown,Unknown,Unknown,Unknown
29,3,Open Economies Review,16 March 2018,https://link.springer.com/article/10.1007/s11079-018-9484-1,To Whom Does Outward FDI Give Jobs?,July 2018,Youngho Kang,Unjung Whang,,,,,,,,,Unknown,Unknown,Unknown,Unknown,Unknown,Unknown,Unknown,Unknown,Unknown,Unknown
29,3,Open Economies Review,23 February 2018,https://link.springer.com/article/10.1007/s11079-017-9475-7,"Vocational Education, Manufacturing, and Income Distribution: International Evidence and Case Studies",July 2018,Joshua Aizenman,Yothin Jinjarak,Ilan Noy,,,,,,,,Male,Unknown,Male,Unknown,Unknown,Unknown,Unknown,Unknown,Unknown,Unknown
29,3,Open Economies Review,14 March 2018,https://link.springer.com/article/10.1007/s11079-018-9483-2,International Investment Patterns: the Case of German Sectors,July 2018,Vahagn Galstyan,Adnan Velic,,,,,,,,,Male,Male,Unknown,Unknown,Unknown,Unknown,Unknown,Unknown,Unknown,Unknown
29,3,Open Economies Review,15 May 2018,https://link.springer.com/article/10.1007/s11079-018-9497-9,Populism and Central Bank Independence: Comment,July 2018,Itai Agur,,,,,,,,,,Male,Unknown,Unknown,Unknown,Unknown,Unknown,Unknown,Unknown,Unknown,Unknown
29,4,Open Economies Review,22 June 2018,https://link.springer.com/article/10.1007/s11079-018-9502-3,Slow Recovery to Nowhere? Labor Market Issues in Advanced Economies: Introduction,September 2018,Nauro Campos,Karim El Aynaoui,Prakash Loungani,,,,,,,,Unknown,Male,,Unknown,Unknown,Unknown,Unknown,Unknown,Unknown,Unknown
29,4,Open Economies Review,26 March 2018,https://link.springer.com/article/10.1007/s11079-018-9488-x,Inequality and Unemployment Patterns in Europe: Does Integration Lead to (Real) Convergence?,September 2018,Mercedes Monfort,Javier Ordóñez,Hector Sala,,,,,,,,Female,,Male,Unknown,Unknown,Unknown,Unknown,Unknown,Unknown,Unknown
29,4,Open Economies Review,16 May 2018,https://link.springer.com/article/10.1007/s11079-018-9487-y,Productivity Gap between Sectors and Double Duality in Labor Markets,September 2018,Elise S. Brezis,Gilad Brand,,,,,,,,,Female,Male,Unknown,Unknown,Unknown,Unknown,Unknown,Unknown,Unknown,Unknown
29,4,Open Economies Review,20 March 2018,https://link.springer.com/article/10.1007/s11079-018-9489-9,Is Informal Job Experience of Youth Undermining their Labor-Market Prospects in Transition Economies?,September 2018,Marjan Petreski,,,,,,,,,,Male,Unknown,Unknown,Unknown,Unknown,Unknown,Unknown,Unknown,Unknown,Unknown
29,4,Open Economies Review,17 April 2018,https://link.springer.com/article/10.1007/s11079-018-9485-0,Labour Market Adjustments to Financing Conditions under Sectoral Rigidities in the Euro Area,September 2018,Arno Hantzsche,Simon Savsek,Sebastian Weber,,,,,,,,Male,Male,Male,Unknown,Unknown,Unknown,Unknown,Unknown,Unknown,Unknown
29,4,Open Economies Review,04 April 2018,https://link.springer.com/article/10.1007/s11079-018-9494-z,Are House Prices Responsible for Unemployment Persistence?,September 2018,Ekkehard Ernst,Faten Saliba,,,,,,,,,Male,Female,Unknown,Unknown,Unknown,Unknown,Unknown,Unknown,Unknown,Unknown
29,4,Open Economies Review,03 April 2018,https://link.springer.com/article/10.1007/s11079-018-9491-2,What Lies beneath? A Sub-National Look at Okun’s Law in the United States,September 2018,Nathalie Gonzalez Prieto,Prakash Loungani,Saurabh Mishra,,,,,,,,Female,,Unknown,Unknown,Unknown,Unknown,Unknown,Unknown,Unknown,Unknown
29,4,Open Economies Review,20 March 2018,https://link.springer.com/article/10.1007/s11079-018-9486-z,Short and Long Effects of Productivity on Unemployment,September 2018,Pu Chen,Willi Semmler,,,,,,,,,,Male,Unknown,Unknown,Unknown,Unknown,Unknown,Unknown,Unknown,Unknown
29,4,Open Economies Review,27 March 2018,https://link.springer.com/article/10.1007/s11079-018-9490-3,Can Reform Waves Turn the Tide? Some Case Studies using the Synthetic Control Method,September 2018,Bibek Adhikari,Romain Duval,Prakash Loungani,,,,,,,,Unknown,Male,,Unknown,Unknown,Unknown,Unknown,Unknown,Unknown,Unknown
29,5,Open Economies Review,26 April 2018,https://link.springer.com/article/10.1007/s11079-018-9496-x,Does Central Bank Financial Strength Really Matter for Inflation? The Key Role of the Fiscal Support,November 2018,Julien Pinter,,,,,,,,,,Male,Unknown,Unknown,Unknown,Unknown,Unknown,Unknown,Unknown,Unknown,Unknown
29,5,Open Economies Review,17 May 2018,https://link.springer.com/article/10.1007/s11079-018-9498-8,Assessing Productivity Gains from International Trade in a Small Open Economy,November 2018,Umut Kılınç,,,,,,,,,,Male,Unknown,Unknown,Unknown,Unknown,Unknown,Unknown,Unknown,Unknown,Unknown
29,5,Open Economies Review,21 April 2018,https://link.springer.com/article/10.1007/s11079-018-9495-y,Safety for Whom? The Scattered Global Financial Safety Net and the Role of Regional Financial Arrangements,November 2018,Laurissa Mühlich,Barbara Fritz,,,,,,,,,Unknown,Female,Unknown,Unknown,Unknown,Unknown,Unknown,Unknown,Unknown,Unknown
29,5,Open Economies Review,05 April 2018,https://link.springer.com/article/10.1007/s11079-018-9492-1,The Performance of Islamic Vs. Conventional Banks: Evidence on the Suitability of the Basel Capital Ratios,November 2018,Mohammad Bitar,M. Kabir Hassan,Thomas Walker,,,,,,,,Male,Unknown,Male,Unknown,Unknown,Unknown,Unknown,Unknown,Unknown,Unknown
29,5,Open Economies Review,07 May 2018,https://link.springer.com/article/10.1007/s11079-018-9499-7,Who’s Who in Global Value Chains? A Weighted Network Approach,November 2018,João Amador,Sónia Cabral,Franco Ruzzenenti,,,,,,,,,Female,Male,Unknown,Unknown,Unknown,Unknown,Unknown,Unknown,Unknown
29,5,Open Economies Review,26 June 2018,https://link.springer.com/article/10.1007/s11079-018-9501-4,Network Effects of Countries’ Exchange Rate Regime Choices: A Spatial Analysis,November 2018,Mengdi Song,,,,,,,,,,Unknown,Unknown,Unknown,Unknown,Unknown,Unknown,Unknown,Unknown,Unknown,Unknown
29,5,Open Economies Review,26 June 2018,https://link.springer.com/article/10.1007/s11079-018-9500-5,Do Free Trade Agreements Increase the New Goods Margin? Evidence from Korea,November 2018,Sang-wook (Stanley) Cho,Hansoo Choi,Julián P. Díaz,,,,,,,,Unknown,Unknown,Male,Unknown,Unknown,Unknown,Unknown,Unknown,Unknown,Unknown
29,5,Open Economies Review,31 January 2018,https://link.springer.com/article/10.1007/s11079-018-9477-0,Currency Misalignments in the BRIICS Countries: Fixed Vs. Floating Exchange Rates,November 2018,Nikolaos Giannellis,Minoas Koukouritakis,,,,,,,,,Male,Unknown,Unknown,Unknown,Unknown,Unknown,Unknown,Unknown,Unknown,Unknown
29,5,Open Economies Review,16 July 2018,https://link.springer.com/article/10.1007/s11079-018-9504-1,Erratum to: Labour Market Adjustments to Financing Conditions under Sectoral Rigidities in the Euro Area,November 2018,Arno Hantzsche,Simon Savsek,Sebastian Weber,,,,,,,,Male,Male,Male,Unknown,Unknown,Unknown,Unknown,Unknown,Unknown,Unknown
30,1,Open Economies Review,02 October 2018,https://link.springer.com/article/10.1007/s11079-018-9516-x,Trilemma-Dilemma: Constraint or Choice? Some Empirical Evidence from a Structurally Identified Heterogeneous Panel VAR,February 2019,Peter J. Montiel,Peter Pedroni,,,,,,,,,Male,Male,Unknown,Unknown,Unknown,Unknown,Unknown,Unknown,Unknown,Unknown
30,1,Open Economies Review,06 November 2018,https://link.springer.com/article/10.1007/s11079-018-9512-1,"Financial Frictions, the Great Trade Collapse and International Trade over the Business Cycle",February 2019,Anna Watson,,,,,,,,,,Female,Unknown,Unknown,Unknown,Unknown,Unknown,Unknown,Unknown,Unknown,Unknown
30,1,Open Economies Review,16 October 2018,https://link.springer.com/article/10.1007/s11079-018-9515-y,Explaining International Business Cycle Synchronization: Recursive Preferences and the Terms of Trade Channel,February 2019,Robert Kollmann,,,,,,,,,,Male,Unknown,Unknown,Unknown,Unknown,Unknown,Unknown,Unknown,Unknown,Unknown
30,1,Open Economies Review,17 July 2018,https://link.springer.com/article/10.1007/s11079-018-9505-0,International Monetary Policy Spillovers,February 2019,Dennis Nsafoah,Apostolos Serletis,,,,,,,,,Male,Male,Unknown,Unknown,Unknown,Unknown,Unknown,Unknown,Unknown,Unknown
