Volume,Issue,Journal Name,Published Date,Link,Title,Journal Year,Author 1,Author 2,Author 3,Author 4,Author 5,Author 6,Author 7,Author 8,Author 9,Author 10,Gender_Author 1,Gender_Author 2,Gender_Author 3,Gender_Author 4,Gender_Author 5,Gender_Author 6,Gender_Author 7,Gender_Author 8,Gender_Author 9,Gender_Author 10
14,2,Open Economies Review,,https://link.springer.com/article/10.1023/A:1022331412107,Optimum Currency Areas Under Inflation Targeting,April 2003,Øistein RØisland,Ragnar Torvik,,,,,,,,,Male,Male,Unknown,Unknown,Unknown,Unknown,Unknown,Unknown,Unknown,Unknown
14,2,Open Economies Review,,https://link.springer.com/article/10.1023/A:1022357828945,Is the J-Curve Effect Observable for Small North European Economies?,April 2003,R. Scott Hacker,Abdulnasser Hatemi-J,,,,,,,,,Unknown,Unknown,Unknown,Unknown,Unknown,Unknown,Unknown,Unknown,Unknown,Unknown
14,2,Open Economies Review,,https://link.springer.com/article/10.1023/A:1022309913015,Risk Related Non Linearities in Exchange Rates: Evidence from a Panel of Central and Eastern European Countries,April 2003,Andrea Brasili,Bruno Sitzia,,,,,,,,,Female,Male,Unknown,Unknown,Unknown,Unknown,Unknown,Unknown,Unknown,Unknown
14,2,Open Economies Review,,https://link.springer.com/article/10.1023/A:1022361929854,The Sacrifice Ratio and Central Bank Independence Revisited,April 2003,Harold J. Brumm,Richard S. Krashevski,,,,,,,,,Male,Male,Unknown,Unknown,Unknown,Unknown,Unknown,Unknown,Unknown,Unknown
14,2,Open Economies Review,,https://link.springer.com/article/10.1023/A:1022314013924,"The Exchange Rate Macroeconomic Balance Approach: New Methodology and Results for the Euro, the Dollar, the Yen and the Pound Sterling",April 2003,Didier Borowski,Cecile Couharde,,,,,,,,,Male,Female,Unknown,Unknown,Unknown,Unknown,Unknown,Unknown,Unknown,Unknown
14,2,Open Economies Review,,https://link.springer.com/article/10.1023/A:1022366030762,Intra-Industry Trade in Intermediate Goods and Final Goods in a General Equilibrium Setting,April 2003,Teit Lüthje,,,,,,,,,,Male,Unknown,Unknown,Unknown,Unknown,Unknown,Unknown,Unknown,Unknown,Unknown
14,3,Open Economies Review,,https://link.springer.com/article/10.1023/A:1023937802624,Preface—Monetary and Exchange Rate Strategies for the European Union's Eastern Enlargement,July 2003,Lucjan T. Orlowski,,,,,,,,,,Male,Unknown,Unknown,Unknown,Unknown,Unknown,Unknown,Unknown,Unknown,Unknown
14,3,Open Economies Review,,https://link.springer.com/article/10.1023/A:1023931019462,A Small Macroeconomic Model of the EU-Accession Countries,July 2003,Bruno Merlevede,Joseph Plasmans,Bas van Aarle,,,,,,,,Male,Male,Male,Unknown,Unknown,Unknown,Unknown,Unknown,Unknown,Unknown
14,3,Open Economies Review,,https://link.springer.com/article/10.1023/A:1023983003532,Monetary Convergence and Risk Premiums in the EU Accession Countries,July 2003,Lucjan T. Orlowski,,,,,,,,,,Male,Unknown,Unknown,Unknown,Unknown,Unknown,Unknown,Unknown,Unknown,Unknown
14,3,Open Economies Review,,https://link.springer.com/article/10.1023/A:1023935120371,Direct Inflation Targeting and Nominal Convergence: The Czech Case,July 2003,Roman Matoušek,Anita Taci,,,,,,,,,Male,Female,Unknown,Unknown,Unknown,Unknown,Unknown,Unknown,Unknown,Unknown
14,3,Open Economies Review,,https://link.springer.com/article/10.1023/A:1023987104441,The Forex Regime and EMU Expansion,July 2003,Pieter van Foreest,Casper G. de Vries,,,,,,,,,Male,Male,Unknown,Unknown,Unknown,Unknown,Unknown,Unknown,Unknown,Unknown
14,3,Open Economies Review,,https://link.springer.com/article/10.1023/A:1023939321279,Has International Financial Integration Increased?,July 2003,Lawrence G. Goldberg,James R. Lothian,John Okunev,,,,,,,,Male,Male,Male,Unknown,Unknown,Unknown,Unknown,Unknown,Unknown,Unknown
14,3,Open Economies Review,,https://link.springer.com/article/10.1023/A:1023991305350,Narrow Target Zones within Broad Zones: A Non-Speculative Exchange Rate Solution with Limited Resources,July 2003,Staffan Ringbom,,,,,,,,,,Male,Unknown,Unknown,Unknown,Unknown,Unknown,Unknown,Unknown,Unknown,Unknown
14,4,Open Economies Review,,https://link.springer.com/article/10.1023/A:1025388009519,Credibility and Interest Rate Discretion in the ERM,October 2003,Hali Edison,Ronald MacDonald,,,,,,,,,Female,Male,Unknown,Unknown,Unknown,Unknown,Unknown,Unknown,Unknown,Unknown
14,4,Open Economies Review,,https://link.springer.com/article/10.1023/A:1025360726358,Has the Link Between the Spot and Forward Exchange Rates Broken Down? Evidence from Rolling Cointegration Tests,October 2003,Ali M. Kutan,Su Zhou,,,,,,,,,Male,,Unknown,Unknown,Unknown,Unknown,Unknown,Unknown,Unknown,Unknown
14,4,Open Economies Review,,https://link.springer.com/article/10.1023/A:1025312810428,U.S. Saving and Investment: Policy Implications,October 2003,Martin B. Schmidt,,,,,,,,,,Male,Unknown,Unknown,Unknown,Unknown,Unknown,Unknown,Unknown,Unknown,Unknown
14,4,Open Economies Review,,https://link.springer.com/article/10.1023/A:1025364827266,Multinational Enterprises and New Trade Theory: Evidence for the Convergence Hypothesis,October 2003,Salvador Barrios,Holger Görg,Eric Strobl,,,,,,,,Male,Male,Male,Unknown,Unknown,Unknown,Unknown,Unknown,Unknown,Unknown
14,4,Open Economies Review,,https://link.springer.com/article/10.1023/A:1025316911337,Resistance to Trade Liberalization in Unionized Sector,October 2003,Koichi Kagitani,,,,,,,,,,Male,Unknown,Unknown,Unknown,Unknown,Unknown,Unknown,Unknown,Unknown,Unknown
15,1,Open Economies Review,,https://link.springer.com/article/10.1023/B:OPEN.0000009422.66952.4b,Do IMF and IBRD Cause Moral Hazard and Political Business Cycles? Evidence from Panel Data,January 2004,Axel Dreher,Roland Vaubel,,,,,,,,,Male,Male,Unknown,Unknown,Unknown,Unknown,Unknown,Unknown,Unknown,Unknown
15,1,Open Economies Review,,https://link.springer.com/article/10.1023/B:OPEN.0000009423.30895.fe,The Role of the Exchange Rate as a Shock Absorber in a Small Open Economy,January 2004,Hilde C. Bjørnland,,,,,,,,,,Female,Unknown,Unknown,Unknown,Unknown,Unknown,Unknown,Unknown,Unknown,Unknown
15,1,Open Economies Review,,https://link.springer.com/article/10.1023/B:OPEN.0000009424.34810.0a,The Balassa-Samuelson Hypothesis and Oil Price Shocks in a Small Open Economy: Evidence from Cyprus,January 2004,Charalambos Pattichis,Mona Kanaan,,,,,,,,,Male,Female,Unknown,Unknown,Unknown,Unknown,Unknown,Unknown,Unknown,Unknown
15,1,Open Economies Review,,https://link.springer.com/article/10.1023/B:OPEN.0000009425.44974.6a,The Optimal Enforcement of a Finance-Constrained Immigration Law,January 2004,Chisato Yoshida,,,,,,,,,,Female,Unknown,Unknown,Unknown,Unknown,Unknown,Unknown,Unknown,Unknown,Unknown
15,1,Open Economies Review,,https://link.springer.com/article/10.1023/B:OPEN.0000009426.38655.f2,The European Periphery in the Era of the Gold Standard: The Case of the Spanish Peseta and the Pound Sterling from 1883 to 1931,January 2004,María Dolores Gadea,Marcela Sabaté,,,,,,,,,,Female,Unknown,Unknown,Unknown,Unknown,Unknown,Unknown,Unknown,Unknown
15,1,Open Economies Review,,https://link.springer.com/article/10.1023/B:OPEN.0000009427.83916.68,Welfare Implications of RTAs Within the WTO System in the Presence of FDI,January 2004,Jung Hur,Donghyun Park,,,,,,,,,,Unknown,Unknown,Unknown,Unknown,Unknown,Unknown,Unknown,Unknown,Unknown
15,2,Open Economies Review,,https://link.springer.com/article/10.1023/B:OPEN.0000012296.51641.fc,Monetary Union and the Interest-Exchange Rate Trade-off,April 2004,Frank Bohn,,,,,,,,,,Male,Unknown,Unknown,Unknown,Unknown,Unknown,Unknown,Unknown,Unknown,Unknown
15,2,Open Economies Review,,https://link.springer.com/article/10.1023/B:OPEN.0000012300.71559.9a,“Set a Sufficiently Ambitious Budget Target and Let the Automatic Stabilizers Work”. Will it Really Work in the European Monetary Union?,April 2004,Francesco Farina,Roberto Tamborini,,,,,,,,,Male,Male,Unknown,Unknown,Unknown,Unknown,Unknown,Unknown,Unknown,Unknown
15,2,Open Economies Review,,https://link.springer.com/article/10.1023/B:OPEN.0000012301.35570.ee,Informational Contagion of Sudden Stops in a Global Games Framework,April 2004,Victor E. Vaugirard,,,,,,,,,,Male,Unknown,Unknown,Unknown,Unknown,Unknown,Unknown,Unknown,Unknown,Unknown
15,2,Open Economies Review,,https://link.springer.com/article/10.1023/B:OPEN.0000012302.43468.c3,The New Open Economy Macroeconomics: A Critical Appraisal,April 2004,David D. VanHoose,,,,,,,,,,Male,Unknown,Unknown,Unknown,Unknown,Unknown,Unknown,Unknown,Unknown,Unknown
15,3,Open Economies Review,,https://link.springer.com/article/10.1023/B:OPEN.0000037698.89816.a1,Are Interventions Self Exciting?,July 2004,Andreas M. Fischer,Mathias Zurlinden,,,,,,,,,Male,Male,Unknown,Unknown,Unknown,Unknown,Unknown,Unknown,Unknown,Unknown
15,3,Open Economies Review,,https://link.springer.com/article/10.1023/B:OPEN.0000037699.34047.be,The Link between Institutional and Economic Integration: Insights for Latin America from the European Experience,July 2004,Ettore Dorrucci,Stefano Firpo,Francesco Paolo Mongelli,,,,,,,,Male,Male,Male,Unknown,Unknown,Unknown,Unknown,Unknown,Unknown,Unknown
15,3,Open Economies Review,,https://link.springer.com/article/10.1023/B:OPEN.0000037700.78347.af,Measuring Pricing to Market in the Eurozone: The Case of the Automobile Industry,July 2004,Jacint Balaguer,Vicente Orts,José C. Pernías,,,,,,,,Unknown,Male,Male,Unknown,Unknown,Unknown,Unknown,Unknown,Unknown,Unknown
15,3,Open Economies Review,,https://link.springer.com/article/10.1023/B:OPEN.0000037701.37962.0e,Singapore's Collective Bargaining in a Game of Wage and Exchange Rate Policies,July 2004,Ying Wu,,,,,,,,,,,Unknown,Unknown,Unknown,Unknown,Unknown,Unknown,Unknown,Unknown,Unknown
15,3,Open Economies Review,,https://link.springer.com/article/10.1023/B:OPEN.0000037702.33704.20,Economic and Geographical Distance: Explaining Mercosur Sectoral Exports to the EU,July 2004,Inmaculada Martínez-Zarzoso,Felicitas D. Nowak-Lehmann,,,,,,,,,Female,Female,Unknown,Unknown,Unknown,Unknown,Unknown,Unknown,Unknown,Unknown
15,4,Open Economies Review,,https://link.springer.com/article/10.1023/B:OPEN.0000048522.97418.99,Overall Specialization Empirics: Techniques and Applications,October 2004,Luca De Benedictis,Massimo Tamberi,,,,,,,,,Male,Male,Unknown,Unknown,Unknown,Unknown,Unknown,Unknown,Unknown,Unknown
15,4,Open Economies Review,,https://link.springer.com/article/10.1023/B:OPEN.0000048523.79011.b2,"Optimal Monetary Policy Rules and Inflation Targets: Are Australia, Canada, and New Zealand Different from the U.S.?",October 2004,Sean Collins,Pierre L. Siklos,,,,,,,,,Male,Male,Unknown,Unknown,Unknown,Unknown,Unknown,Unknown,Unknown,Unknown
15,4,Open Economies Review,,https://link.springer.com/article/10.1023/B:OPEN.0000048524.05345.b9,Divide and Rule: Geographical Diversification and the Multinational Firm,October 2004,Dermot Leahy,Stephen Pavelin,,,,,,,,,Male,Male,Unknown,Unknown,Unknown,Unknown,Unknown,Unknown,Unknown,Unknown
15,4,Open Economies Review,,https://link.springer.com/article/10.1023/B:OPEN.0000048525.81100.6c,"Agricultural Productivity, Business Services, and Comparative Advantage",October 2004,Toru Kikuchi,,,,,,,,,,Male,Unknown,Unknown,Unknown,Unknown,Unknown,Unknown,Unknown,Unknown,Unknown
15,4,Open Economies Review,,https://link.springer.com/article/10.1023/B:OPEN.0000048526.52803.b9,"Central Bank Independence, Speed of Disinflation and the Sacrifice Ratio",October 2004,Giuseppe Diana,Moïse Sidiropoulos,,,,,,,,,Male,Male,Unknown,Unknown,Unknown,Unknown,Unknown,Unknown,Unknown,Unknown
15,4,Open Economies Review,,https://link.springer.com/article/10.1023/B:OPEN.0000048527.11320.f8,Real Versus Tariff Liberalization: A Welfare Comparison Under Monopolistic Competition,October 2004,Philipp J.H. Schröder,,,,,,,,,,Male,Unknown,Unknown,Unknown,Unknown,Unknown,Unknown,Unknown,Unknown,Unknown
16,1,Open Economies Review,,https://link.springer.com/article/10.1007/s11079-005-6990-8,Editorial Announcement,January 2005,Michele Fratianni,,,,,,,,,,Female,Unknown,Unknown,Unknown,Unknown,Unknown,Unknown,Unknown,Unknown,Unknown
16,1,Open Economies Review,,https://link.springer.com/article/10.1007/s11079-005-5329-9,Does the WTO Make Trade More Stable?,January 2005,Andrew K. Rose,,,,,,,,,,Male,Unknown,Unknown,Unknown,Unknown,Unknown,Unknown,Unknown,Unknown,Unknown
16,1,Open Economies Review,,https://link.springer.com/article/10.1007/s11079-005-5330-3,A Theoretical Inefficiency in the International Marketing of Tradable Global Warming Emission Permits,January 2005,Robert E. Kohn,,,,,,,,,,Male,Unknown,Unknown,Unknown,Unknown,Unknown,Unknown,Unknown,Unknown,Unknown
16,1,Open Economies Review,,https://link.springer.com/article/10.1007/s11079-005-5331-2,Central Bank Intervention and Heterogeneous Exchange Rate Expectations: Evidence from the Daily DEM/US-Dollar Exchange Rate,January 2005,Stefan Reitz,,,,,,,,,,Male,Unknown,Unknown,Unknown,Unknown,Unknown,Unknown,Unknown,Unknown,Unknown
16,1,Open Economies Review,,https://link.springer.com/article/10.1007/s11079-005-5332-1,Inflation Persistence under Semi-Fixed Exchange Rate Regimes: The European Evidence 1974–1998,January 2005,Clemens J. M. Kool,Alex Lammertsma,,,,,,,,,Male,Male,Unknown,Unknown,Unknown,Unknown,Unknown,Unknown,Unknown,Unknown
16,1,Open Economies Review,,https://link.springer.com/article/10.1007/s11079-005-5333-0,Crony Capitalism and Sovereign Default,January 2005,Victor Vaugirard,,,,,,,,,,Male,Unknown,Unknown,Unknown,Unknown,Unknown,Unknown,Unknown,Unknown,Unknown
16,2,Open Economies Review,,https://link.springer.com/article/10.1007/s11079-005-5871-5,A Sequential Test for Structural Breaks in the Causal Linkages Between the G7 Short-Term Interest Rates,April 2005,Marco R. Barassi,Guglielmo Maria Caporale,Stephen G. Hall,,,,,,,,Male,Male,Male,Unknown,Unknown,Unknown,Unknown,Unknown,Unknown,Unknown
16,2,Open Economies Review,,https://link.springer.com/article/10.1007/s11079-005-5872-4,"Monetary Union, Trade Integration, and Business Cycles in 19th Century Europe",April 2005,Marc Flandreau,Mathilde Maurel,,,,,,,,,Male,Female,Unknown,Unknown,Unknown,Unknown,Unknown,Unknown,Unknown,Unknown
16,2,Open Economies Review,,https://link.springer.com/article/10.1007/s11079-005-5873-3,Home Employment Effects of EU Firms’ Activities in Central and Eastern European Countries,April 2005,Ludo Cuyvers,Michel Dumont,Katrien Stevens,,,,,,,,Male,Male,Female,Unknown,Unknown,Unknown,Unknown,Unknown,Unknown,Unknown
16,2,Open Economies Review,,https://link.springer.com/article/10.1007/s11079-005-5874-2,Technology Transfer from Acquisition FDI and the Absorptive Capacity of Domestic Firms: An Empirical Investigation,April 2005,Sourafel Girma,,,,,,,,,,Unknown,Unknown,Unknown,Unknown,Unknown,Unknown,Unknown,Unknown,Unknown,Unknown
16,2,Open Economies Review,,https://link.springer.com/article/10.1007/s11079-005-5875-1,On Optimal Monetary Policy Rules and the Construction of MCIs in the Open Economy,April 2005,Alfred V. Guender,,,,,,,,,,Male,Unknown,Unknown,Unknown,Unknown,Unknown,Unknown,Unknown,Unknown,Unknown
16,2,Open Economies Review,,https://link.springer.com/article/10.1007/s11079-005-5876-0,Robustness of Forecasting Financial Crises in Emerging Market Economies with Data Revisions—A Note,April 2005,Derrick Reagle,Dominick Salvatore,,,,,,,,,Male,Male,Unknown,Unknown,Unknown,Unknown,Unknown,Unknown,Unknown,Unknown
16,3,Open Economies Review,,https://link.springer.com/article/10.1007/s11079-005-1023-1,Asymmetric Effect of Currency Union for Developing Countries,July 2005,Ayako Saiki,,,,,,,,,,Female,Unknown,Unknown,Unknown,Unknown,Unknown,Unknown,Unknown,Unknown,Unknown
16,3,Open Economies Review,,https://link.springer.com/article/10.1007/s11079-005-1024-0,International R&D Spillovers Revisited,July 2005,Gwanghoon Lee,,,,,,,,,,Unknown,Unknown,Unknown,Unknown,Unknown,Unknown,Unknown,Unknown,Unknown,Unknown
16,3,Open Economies Review,,https://link.springer.com/article/10.1007/s11079-005-1025-z,Limited Reserves and the Optimal Width of an Exchange Rate Target Zone,July 2005,Simon Broome,,,,,,,,,,Male,Unknown,Unknown,Unknown,Unknown,Unknown,Unknown,Unknown,Unknown,Unknown
16,3,Open Economies Review,,https://link.springer.com/article/10.1007/s11079-005-1026-y,Exchange Rate Disconnect in a Standard Open-Economy Macro Model,July 2005,Bernd Kempa,,,,,,,,,,Male,Unknown,Unknown,Unknown,Unknown,Unknown,Unknown,Unknown,Unknown,Unknown
16,3,Open Economies Review,,https://link.springer.com/article/10.1007/s11079-005-1027-x,The Policy Challenge with Floating Exchange Rates: Turkey’s Recent Experience,July 2005,Faruk Selçuk,,,,,,,,,,Male,Unknown,Unknown,Unknown,Unknown,Unknown,Unknown,Unknown,Unknown,Unknown
16,4,Open Economies Review,,https://link.springer.com/article/10.1007/s11079-005-4736-2,Editorial Announcement,October 2005,George Tavlas,,,,,,,,,,Male,Unknown,Unknown,Unknown,Unknown,Unknown,Unknown,Unknown,Unknown,Unknown
16,4,Open Economies Review,,https://link.springer.com/article/10.1007/s11079-005-4738-0,Does IMF Support Accelerate Inflation Stabilization?,October 2005,Francisco Joséveiga,,,,,,,,,,Male,Unknown,Unknown,Unknown,Unknown,Unknown,Unknown,Unknown,Unknown,Unknown
16,4,Open Economies Review,,https://link.springer.com/article/10.1007/s11079-005-4741-5,Can Import Tariffs Deter Outward FDI?,October 2005,David Collie,Hylke Vandenbussche,,,,,,,,,Male,,Unknown,Unknown,Unknown,Unknown,Unknown,Unknown,Unknown,Unknown
16,4,Open Economies Review,,https://link.springer.com/article/10.1007/s11079-005-4740-6,"Exports, Product Differentiation and Knowledge Spillovers",October 2005,Miguel A. León-Ledesma,,,,,,,,,,Male,Unknown,Unknown,Unknown,Unknown,Unknown,Unknown,Unknown,Unknown,Unknown
16,4,Open Economies Review,,https://link.springer.com/article/10.1007/s11079-005-4743-3,The Disciplinary Effect of the Single Market on Swedish Firms,October 2005,Joakim Gullstrand,Helena Johansson,,,,,,,,,Male,Female,Unknown,Unknown,Unknown,Unknown,Unknown,Unknown,Unknown,Unknown
16,4,Open Economies Review,,https://link.springer.com/article/10.1007/s11079-005-4742-4,Solution to the Siegel Paradox,October 2005,Kam Hon Chu,,,,,,,,,,Male,Unknown,Unknown,Unknown,Unknown,Unknown,Unknown,Unknown,Unknown,Unknown
16,4,Open Economies Review,,https://link.springer.com/article/10.1007/s11079-005-4737-1,The Heckscher-Ohlin-Vanek Theorem and International Factor Price Differences,October 2005,Avik Chakrabarti,,,,,,,,,,Unknown,Unknown,Unknown,Unknown,Unknown,Unknown,Unknown,Unknown,Unknown,Unknown
16,4,Open Economies Review,,https://link.springer.com/article/10.1007/s11079-005-4746-0,Conference Announcement and Call for Papers 10th International Conference on Macroeconomic Analysis and International Finance,October 2005,,,,,,,,,,,Unknown,Unknown,Unknown,Unknown,Unknown,Unknown,Unknown,Unknown,Unknown,Unknown
17,1,Open Economies Review,,https://link.springer.com/article/10.1007/s11079-006-5212-3,Price Rigidity and the Selection of the Exchange Rate Regime,January 2006,Fabrice Collard,Harris Dellas,,,,,,,,,Male,Male,Unknown,Unknown,Unknown,Unknown,Unknown,Unknown,Unknown,Unknown
17,1,Open Economies Review,,https://link.springer.com/article/10.1007/s11079-006-5213-2,New Keynesian Explanations of Cyclical Movements in Aggregate Inflation and Regional Inflation Differentials,January 2006,Matthew B. Canzoneri,Robert E. Cumby,Olena Mykhaylova,,,,,,,,Male,Male,Female,Unknown,Unknown,Unknown,Unknown,Unknown,Unknown,Unknown
17,1,Open Economies Review,,https://link.springer.com/article/10.1007/s11079-006-5214-1,Currency Crises and the Term Structure of Interest Rates,January 2006,Alan Sutherland,,,,,,,,,,Male,Unknown,Unknown,Unknown,Unknown,Unknown,Unknown,Unknown,Unknown,Unknown
17,1,Open Economies Review,,https://link.springer.com/article/10.1007/s11079-006-4739-7,E Pluribus Unum? Authorities' Design in Financial Supervision: Trends and Determinants,January 2006,Donato Masciandaro,,,,,,,,,,Male,Unknown,Unknown,Unknown,Unknown,Unknown,Unknown,Unknown,Unknown,Unknown
17,1,Open Economies Review,,https://link.springer.com/article/10.1007/s11079-006-4744-x,"Multinationals, Hedging, and Capital Structure under Exchange Rate Uncertainty",January 2006,Udo Broll,Kit Pong Wong,,,,,,,,,Male,,Unknown,Unknown,Unknown,Unknown,Unknown,Unknown,Unknown,Unknown
17,1,Open Economies Review,,https://link.springer.com/article/10.1007/s11079-006-5215-0,"A Primer on Real Effective Exchange Rates: Determinants, Overvaluation, Trade Flows and Competitive Devaluation",January 2006,Menzie D. Chinn,,,,,,,,,,Unknown,Unknown,Unknown,Unknown,Unknown,Unknown,Unknown,Unknown,Unknown,Unknown
17,2,Open Economies Review,,https://link.springer.com/article/10.1007/s11079-006-6808-3,"Stock Prices, Output and the Monetary Regime",April 2006,Robert Flood,Nancy Marion,,,,,,,,,Male,Female,Unknown,Unknown,Unknown,Unknown,Unknown,Unknown,Unknown,Unknown
17,2,Open Economies Review,,https://link.springer.com/article/10.1007/s11079-006-6809-2,The Impact of EMU on Inflation Expectations,April 2006,Friedrich Heinemann,Katrin Ullrich,,,,,,,,,Male,Female,Unknown,Unknown,Unknown,Unknown,Unknown,Unknown,Unknown,Unknown
17,2,Open Economies Review,,https://link.springer.com/article/10.1007/s11079-006-6810-9,"Uncertainty, Flexible Exchange Rates, and Agglomeration",April 2006,Luca Antonio Ricci,,,,,,,,,,Male,Unknown,Unknown,Unknown,Unknown,Unknown,Unknown,Unknown,Unknown,Unknown
17,2,Open Economies Review,,https://link.springer.com/article/10.1007/s11079-006-4745-9,"Dynamic Links Between Unexpected Exchange Rate Variation, Prices, and International Trade",April 2006,Chongcheul Cheong,Tesfa Mehari,Leighton Vaughan Williams,,,,,,,,Unknown,Unknown,Male,Unknown,Unknown,Unknown,Unknown,Unknown,Unknown,Unknown
17,2,Open Economies Review,,https://link.springer.com/article/10.1007/s11079-006-6812-7,Forecasting Performance of Exponential Smooth Transition Autoregressive Exchange Rate Models,April 2006,Ahmad Zubaidi Baharumshah,Venus Khim-Sen Liew,,,,,,,,,Male,Female,Unknown,Unknown,Unknown,Unknown,Unknown,Unknown,Unknown,Unknown
17,3,Open Economies Review,,https://link.springer.com/article/10.1007/s11079-006-6811-8,The International Business Cycle in a Changing World: Volatility and the Propagation of Shocks in the G-7,July 2006,Pedro J. Perez,Denise R. Osborn,Michael Artis,,,,,,,,Male,Female,Male,Unknown,Unknown,Unknown,Unknown,Unknown,Unknown,Unknown
17,3,Open Economies Review,,https://link.springer.com/article/10.1007/s11079-006-9050-0,Joining the European Monetary Union—Comparing First and Second Generation Open Economy Models,July 2006,Vo Phuong Mai Le,Patrick Minford,,,,,,,,,Unknown,Male,Unknown,Unknown,Unknown,Unknown,Unknown,Unknown,Unknown,Unknown
17,3,Open Economies Review,,https://link.springer.com/article/10.1007/s11079-006-9051-z,Economic Integration and Manufacturing Concentration Patterns: Evidence from MERCOSUR,July 2006,Iulia Traistaru-Siedschlag,Christian Volpe Martincus,,,,,,,,,Female,Male,Unknown,Unknown,Unknown,Unknown,Unknown,Unknown,Unknown,Unknown
17,3,Open Economies Review,,https://link.springer.com/article/10.1007/s11079-006-9052-y,Trade Verticality and Structural Change in Industries:The Cases of Taiwan and South Korea,July 2006,Hung-Yi Chen,Yang-Ming Chang,,,,,,,,,Unknown,,Unknown,Unknown,Unknown,Unknown,Unknown,Unknown,Unknown,Unknown
17,3,Open Economies Review,,https://link.springer.com/article/10.1007/s11079-006-9053-x,"Devaluation, Capital Formation, and the Current Account",July 2006,Wen-Ya Chang,Hsueh-Fang Tsai,,,,,,,,,,Unknown,Unknown,Unknown,Unknown,Unknown,Unknown,Unknown,Unknown,Unknown
17,4,Open Economies Review,,https://link.springer.com/article/10.1007/s11079-006-0353-y,"Perspectives on Monetary, Financial, and Economic Integration: Editor’s Introduction",December 2006,Jürgen von Hagen,,,,,,,,,,Male,Unknown,Unknown,Unknown,Unknown,Unknown,Unknown,Unknown,Unknown,Unknown
17,4,Open Economies Review,,https://link.springer.com/article/10.1007/s11079-006-0354-x,Michele Fratianni’s Professional Career and Contributions to Economic Analysis,December 2006,Paolo Savona,,,,,,,,,,Male,Unknown,Unknown,Unknown,Unknown,Unknown,Unknown,Unknown,Unknown,Unknown
17,4,Open Economies Review,,https://link.springer.com/article/10.1007/s11079-006-0355-9,Financial Liberalization in a Small Open Economy,December 2006,Jürgen von Hagen,Haiping Zhang,,,,,,,,,Male,Unknown,Unknown,Unknown,Unknown,Unknown,Unknown,Unknown,Unknown,Unknown
17,4,Open Economies Review,,https://link.springer.com/article/10.1007/s11079-006-0356-8,International Financial Contagion and the Fund —A Theoretical Framework,December 2006,Peter B. Clark,Haizhou Huang,,,,,,,,,Male,Unknown,Unknown,Unknown,Unknown,Unknown,Unknown,Unknown,Unknown,Unknown
17,4,Open Economies Review,,https://link.springer.com/article/10.1007/s11079-006-0357-7,A Spatial Modelling Approach to Contagion Among Emerging Economies,December 2006,Harry H. Kelejian,George S. Tavlas,George Hondroyiannis,,,,,,,,Male,Male,Male,Unknown,Unknown,Unknown,Unknown,Unknown,Unknown,Unknown
17,4,Open Economies Review,,https://link.springer.com/article/10.1007/s11079-006-0358-6,International Financial Cooperation and the Number of Adherents: The Basel Committee and Capital Regulation,December 2006,John C. Pattison,,,,,,,,,,Male,Unknown,Unknown,Unknown,Unknown,Unknown,Unknown,Unknown,Unknown,Unknown
17,4,Open Economies Review,,https://link.springer.com/article/10.1007/s11079-006-0359-5,"Explaining Compliance with G8 Finance Commitments: Agency, Institutionalization and Structure",December 2006,John Kirton,,,,,,,,,,Male,Unknown,Unknown,Unknown,Unknown,Unknown,Unknown,Unknown,Unknown,Unknown
17,4,Open Economies Review,,https://link.springer.com/article/10.1007/s11079-006-0360-z,Maastricht: New and Old Rules,December 2006,Franco Spinelli,Carmine Trecroci,,,,,,,,,Male,Male,Unknown,Unknown,Unknown,Unknown,Unknown,Unknown,Unknown,Unknown
