Volume,Issue,Journal Name,Published Date,Link,Title,Journal Year,Author 1,Author 2,Author 3,Author 4,Author 5,Author 6,Author 7,Author 8,Author 9,Author 10,Gender_Author 1,Gender_Author 2,Gender_Author 3,Gender_Author 4,Gender_Author 5,Gender_Author 6,Gender_Author 7,Gender_Author 8,Gender_Author 9,Gender_Author 10
22,3,Open Economies Review,05 August 2009,https://link.springer.com/article/10.1007/s11079-009-9126-8,Patterns of Current Account Adjustment—Insights from Past Experience,July 2011,Bernardina Algieri,Thierry Bracke,,,,,,,,,Female,Male,Unknown,Unknown,Unknown,Unknown,Unknown,Unknown,Unknown,Unknown
22,3,Open Economies Review,03 September 2009,https://link.springer.com/article/10.1007/s11079-009-9131-y,Business Cycle Synchronisation with(in) the Euro Area: in Search of a ‘Euro Effect’,July 2011,Klaus Weyerstrass,Bas van Aarle,Atilim Seymen,,,,,,,,Male,Male,Unknown,Unknown,Unknown,Unknown,Unknown,Unknown,Unknown,Unknown
22,3,Open Economies Review,11 September 2009,https://link.springer.com/article/10.1007/s11079-009-9130-z,A Simple Cross-Country Index of Trade Specialization,July 2011,João Amador,Sónia Cabral,José R. Maria,,,,,,,,,Female,Male,Unknown,Unknown,Unknown,Unknown,Unknown,Unknown,Unknown
22,3,Open Economies Review,04 November 2009,https://link.springer.com/article/10.1007/s11079-009-9135-7,Cost of Protection: A Second Look at the Romer Variety Effect,July 2011,Purba Mukerji,Arvind Panagariya,,,,,,,,,Unknown,Male,Unknown,Unknown,Unknown,Unknown,Unknown,Unknown,Unknown,Unknown
22,3,Open Economies Review,11 September 2009,https://link.springer.com/article/10.1007/s11079-009-9132-x,Determinants of Deep Integration: Examining Socio-political Factors,July 2011,Laura Márquez-Ramos,Inmaculada Martínez-Zarzoso,Celestino Suárez-Burguet,,,,,,,,Female,Female,Male,Unknown,Unknown,Unknown,Unknown,Unknown,Unknown,Unknown
22,3,Open Economies Review,02 February 2010,https://link.springer.com/article/10.1007/s11079-009-9140-x,Financial Openness and Macroeconomic Instability in Emerging Market Economies,July 2011,Massimiliano Pisani,,,,,,,,,,Male,Unknown,Unknown,Unknown,Unknown,Unknown,Unknown,Unknown,Unknown,Unknown
22,4,Open Economies Review,28 May 2011,https://link.springer.com/article/10.1007/s11079-011-9206-4,Exchange-Rate Policies in Emerging Countries: Eleven Empirical Regularities From Latin America and East Asia,September 2011,Sebastian Edwards,,,,,,,,,,Male,Unknown,Unknown,Unknown,Unknown,Unknown,Unknown,Unknown,Unknown,Unknown
22,4,Open Economies Review,24 September 2009,https://link.springer.com/article/10.1007/s11079-009-9133-9,"Business Cycles, Core, and Periphery in Monetary Unions: Comparing Europe and North America",September 2011,Alexandra Ferreira-Lopes,Álvaro M. Pina,,,,,,,,,Female,Male,Unknown,Unknown,Unknown,Unknown,Unknown,Unknown,Unknown,Unknown
22,4,Open Economies Review,11 November 2009,https://link.springer.com/article/10.1007/s11079-009-9137-5,"Institutional Uncertainty, Economic Integration, and Vertical Foreign Direct Investment Decisions",September 2011,Yu-Fu Chen,Michael Funke,,,,,,,,,,Male,Unknown,Unknown,Unknown,Unknown,Unknown,Unknown,Unknown,Unknown
22,4,Open Economies Review,18 December 2009,https://link.springer.com/article/10.1007/s11079-009-9138-4,Imperfect Intersectoral Labor Mobility and Monetary Shocks in a Small Open Economy,September 2011,Juan Antonio Garcia-Cebro,Ramon Varela-Santamaria,,,,,,,,,Male,Male,Unknown,Unknown,Unknown,Unknown,Unknown,Unknown,Unknown,Unknown
22,4,Open Economies Review,27 August 2009,https://link.springer.com/article/10.1007/s11079-009-9129-5,"Crime, Terror and Corruption and Their Effect on Private Investment in Israel",September 2011,Yaron Zelekha,Ohad Bar-Efrat,,,,,,,,,Male,Male,Unknown,Unknown,Unknown,Unknown,Unknown,Unknown,Unknown,Unknown
22,4,Open Economies Review,14 January 2010,https://link.springer.com/article/10.1007/s11079-009-9164-2,Identifying the Liquidity Effects of Monetary Policy Shocks for a Small Open Economy: Turkey,September 2011,M. Hakan Berument,Selahattin Togay,Afsin Sahin,,,,,,,,Unknown,Male,Unknown,Unknown,Unknown,Unknown,Unknown,Unknown,Unknown,Unknown
22,4,Open Economies Review,09 February 2010,https://link.springer.com/article/10.1007/s11079-010-9166-0,The Effect of the Exchange Rates on Investment in Mexican Manufacturing Industry,September 2011,Mustafa Caglayan,Rebeca I. Muñoz Torres,,,,,,,,,Male,Female,Unknown,Unknown,Unknown,Unknown,Unknown,Unknown,Unknown,Unknown
22,4,Open Economies Review,13 February 2010,https://link.springer.com/article/10.1007/s11079-010-9168-y,Agglomeration and Welfare with Heterogeneous Preferences,September 2011,Fabien Candau,Marc Fleurbaey,,,,,,,,,Male,Male,Unknown,Unknown,Unknown,Unknown,Unknown,Unknown,Unknown,Unknown
22,4,Open Economies Review,17 February 2010,https://link.springer.com/article/10.1007/s11079-010-9169-x,Sharing the Market or Getting Closer for a Fight? Strategic Reaction to Reduced Trade Costs,September 2011,Karl Morasch,Martin Bandulet,,,,,,,,,Male,Male,Unknown,Unknown,Unknown,Unknown,Unknown,Unknown,Unknown,Unknown
22,4,Open Economies Review,03 March 2010,https://link.springer.com/article/10.1007/s11079-010-9171-3,Demand Shocks and Trade Balance Dynamics,September 2011,José García-Solanes,Jesús Rodríguez-López,José Luis Torres,,,,,,,,Male,,Male,Unknown,Unknown,Unknown,Unknown,Unknown,Unknown,Unknown
22,5,Open Economies Review,27 October 2011,https://link.springer.com/article/10.1007/s11079-011-9224-2,Challenges and Risks in the International Monetary System,November 2011,,,,,,,,,,,Unknown,Unknown,Unknown,Unknown,Unknown,Unknown,Unknown,Unknown,Unknown,Unknown
22,5,Open Economies Review,13 March 2010,https://link.springer.com/article/10.1007/s11079-010-9173-1,Monetary Policy in Estimated Models of Small Open and Closed Economies,November 2011,Ali Dib,,,,,,,,,,Male,Unknown,Unknown,Unknown,Unknown,Unknown,Unknown,Unknown,Unknown,Unknown
22,5,Open Economies Review,18 May 2010,https://link.springer.com/article/10.1007/s11079-010-9176-y,Heterogeneous Popularity and Exporting Uncertainty,November 2011,Eddy Bekkers,,,,,,,,,,Male,Unknown,Unknown,Unknown,Unknown,Unknown,Unknown,Unknown,Unknown,Unknown
22,5,Open Economies Review,12 May 2010,https://link.springer.com/article/10.1007/s11079-010-9177-x,Deciding to Peg the Exchange Rate in Developing Countries: The Role of Private-Sector Debt,November 2011,Philipp Harms,Mathias Hoffmann,,,,,,,,,Male,Male,Unknown,Unknown,Unknown,Unknown,Unknown,Unknown,Unknown,Unknown
22,5,Open Economies Review,20 July 2010,https://link.springer.com/article/10.1007/s11079-010-9178-9,MFN Status and the Choice of Tariff Regime,November 2011,Nigar Hashimzade,Hassan Khodavaisi,Gareth D. Myles,,,,,,,,Female,Male,Male,Unknown,Unknown,Unknown,Unknown,Unknown,Unknown,Unknown
22,5,Open Economies Review,13 July 2010,https://link.springer.com/article/10.1007/s11079-010-9179-8,Financial Globalization and Banking Crises in Emerging Markets,November 2011,Joseph P. Joyce,,,,,,,,,,Male,Unknown,Unknown,Unknown,Unknown,Unknown,Unknown,Unknown,Unknown,Unknown
22,5,Open Economies Review,16 November 2010,https://link.springer.com/article/10.1007/s11079-010-9190-0,Structural Breaks and Spatial Linkages in FDI: Further Evidence in OECD Countries,November 2011,Viktor Hultgren,Petr Mariel,Carlos Rodríguez González,,,,,,,,Male,Male,Male,Unknown,Unknown,Unknown,Unknown,Unknown,Unknown,Unknown
22,5,Open Economies Review,17 August 2010,https://link.springer.com/article/10.1007/s11079-010-9181-1,Self-Fulfilling Currency Crises with Borrowing Constraints and Domestic Currency Debt,November 2011,Nestor Azcona,,,,,,,,,,Male,Unknown,Unknown,Unknown,Unknown,Unknown,Unknown,Unknown,Unknown,Unknown
22,5,Open Economies Review,10 August 2010,https://link.springer.com/article/10.1007/s11079-010-9180-2,Optimum Currency Areas in Emerging Market Regions: Evidence Based on the Symmetry of Economic Shocks,November 2011,Stefan Eichler,Alexander Karmann,,,,,,,,,Male,Male,Unknown,Unknown,Unknown,Unknown,Unknown,Unknown,Unknown,Unknown
22,5,Open Economies Review,17 September 2010,https://link.springer.com/article/10.1007/s11079-010-9186-9,A Measure of Trade Induced Adjustment in Volume and Quality Space,November 2011,Abdul K. M. Azhar,Robert James Ross Elliott,,,,,,,,,Male,Male,Unknown,Unknown,Unknown,Unknown,Unknown,Unknown,Unknown,Unknown
22,5,Open Economies Review,01 December 2010,https://link.springer.com/article/10.1007/s11079-010-9191-z,Employment and Exchange Rates: The Role of Openness and Technology,November 2011,Fernando Alexandre,Pedro Bação,Miguel Portela,,,,,,,,Male,Male,Male,Unknown,Unknown,Unknown,Unknown,Unknown,Unknown,Unknown
22,5,Open Economies Review,10 August 2010,https://link.springer.com/article/10.1007/s11079-010-9183-z,The Political and Economic Dimension of Monetary Unions,November 2011,Filippo Cesarano,,,,,,,,,,Male,Unknown,Unknown,Unknown,Unknown,Unknown,Unknown,Unknown,Unknown,Unknown
23,1,Open Economies Review,31 December 2011,https://link.springer.com/article/10.1007/s11079-011-9237-x,The Future International Monetary System: Dominant Currencies or Supranational Money? An Introduction,February 2012,Michele Fratianni,,,,,,,,,,Female,Unknown,Unknown,Unknown,Unknown,Unknown,Unknown,Unknown,Unknown,Unknown
23,1,Open Economies Review,25 October 2011,https://link.springer.com/article/10.1007/s11079-011-9216-2,The Benefits and Costs of an International Currency: Getting the Calculus Right,February 2012,Benjamin J. Cohen,,,,,,,,,,Male,Unknown,Unknown,Unknown,Unknown,Unknown,Unknown,Unknown,Unknown,Unknown
23,1,Open Economies Review,22 October 2011,https://link.springer.com/article/10.1007/s11079-011-9225-1,"Sectoral Interests and Global Money: Renminbi, Dollars and the Domestic Foundations of International Currency Policy",February 2012,Eric Helleiner,Anton Malkin,,,,,,,,,Male,Male,Unknown,Unknown,Unknown,Unknown,Unknown,Unknown,Unknown,Unknown
23,1,Open Economies Review,12 October 2011,https://link.springer.com/article/10.1007/s11079-011-9217-1,"The Federal Reserve, the Bank of England, and the Rise of the Dollar as an International Currency, 1914–1939",February 2012,Barry Eichengreen,Marc Flandreau,,,,,,,,,Male,Male,Unknown,Unknown,Unknown,Unknown,Unknown,Unknown,Unknown,Unknown
23,1,Open Economies Review,13 October 2011,https://link.springer.com/article/10.1007/s11079-011-9222-4,Euro vs Dollar: An Improbable Threat,February 2012,Giovanni B. Pittaluga,Elena Seghezza,,,,,,,,,Male,Female,Unknown,Unknown,Unknown,Unknown,Unknown,Unknown,Unknown,Unknown
23,1,Open Economies Review,29 October 2011,https://link.springer.com/article/10.1007/s11079-011-9218-0,The Fed as the Engine of Worldwide Inflation,February 2012,Ronald McKinnon,,,,,,,,,,Male,Unknown,Unknown,Unknown,Unknown,Unknown,Unknown,Unknown,Unknown,Unknown
23,1,Open Economies Review,05 October 2011,https://link.springer.com/article/10.1007/s11079-011-9221-5,Reserves and Baskets,February 2012,Michael D. Bordo,Harold James,,,,,,,,,Male,Male,Unknown,Unknown,Unknown,Unknown,Unknown,Unknown,Unknown,Unknown
23,1,Open Economies Review,24 December 2011,https://link.springer.com/article/10.1007/s11079-011-9232-2,Low-Income Countries and an SDR-based International Monetary System,February 2012,Pietro Alessandrini,Andrea F. Presbitero,,,,,,,,,Male,Female,Unknown,Unknown,Unknown,Unknown,Unknown,Unknown,Unknown,Unknown
23,1,Open Economies Review,20 December 2011,https://link.springer.com/article/10.1007/s11079-011-9230-4,Rules for Correcting External Imbalances,February 2012,John Williamson,,,,,,,,,,Male,Unknown,Unknown,Unknown,Unknown,Unknown,Unknown,Unknown,Unknown,Unknown
23,1,Open Economies Review,13 October 2011,https://link.springer.com/article/10.1007/s11079-011-9223-3,Reducing Global Imbalances: Can Fixed Exchange Rates and Current Account Limits Help?,February 2012,Andrew Hughes Hallett,Juan Carlos Martinez Oliva,,,,,,,,,Male,Male,Unknown,Unknown,Unknown,Unknown,Unknown,Unknown,Unknown,Unknown
23,1,Open Economies Review,30 November 2011,https://link.springer.com/article/10.1007/s11079-011-9231-3,IMF Support and Inter-Regime Exchange Rate Volatility,February 2012,Ivo J. M. Arnold,Ronald MacDonald,Casper G. de Vries,,,,,,,,Male,Male,Male,Unknown,Unknown,Unknown,Unknown,Unknown,Unknown,Unknown
23,2,Open Economies Review,10 September 2011,https://link.springer.com/article/10.1007/s11079-011-9210-8,Slow Pass-through Around the World: A New Import for Developing Countries?,April 2012,Jeffrey Frankel,David Parsley,Shang-Jin Wei,,,,,,,,Male,Male,Unknown,Unknown,Unknown,Unknown,Unknown,Unknown,Unknown,Unknown
23,2,Open Economies Review,01 September 2010,https://link.springer.com/article/10.1007/s11079-010-9182-0,"Exchange Rate Regimes and Reserve Policy: The Italian Lira, 1883–1911",April 2012,Filippo Cesarano,Giulio Cifarelli,Gianni Toniolo,,,,,,,,Male,Male,Male,Unknown,Unknown,Unknown,Unknown,Unknown,Unknown,Unknown
23,2,Open Economies Review,16 October 2010,https://link.springer.com/article/10.1007/s11079-010-9187-8,"Gravity Approach for Modelling International Trade in South-Eastern Europe and the Commonwealth of Independent States: The Role of Geography, Policy and Institutions",April 2012,Oxana Babecká Kucharčuková,Jan Babecký,Martin Raiser,,,,,,,,Female,Male,Male,Unknown,Unknown,Unknown,Unknown,Unknown,Unknown,Unknown
23,2,Open Economies Review,18 November 2010,https://link.springer.com/article/10.1007/s11079-010-9192-y,Rotating Slumps in a Monetary Union,April 2012,Oliver Landmann,,,,,,,,,,Male,Unknown,Unknown,Unknown,Unknown,Unknown,Unknown,Unknown,Unknown,Unknown
23,2,Open Economies Review,21 December 2010,https://link.springer.com/article/10.1007/s11079-010-9193-x,Specific Factors and International Monetary Policy Coordination,April 2012,William D. Craighead,,,,,,,,,,Male,Unknown,Unknown,Unknown,Unknown,Unknown,Unknown,Unknown,Unknown,Unknown
23,2,Open Economies Review,09 December 2010,https://link.springer.com/article/10.1007/s11079-010-9194-9,Episodic Nonlinearity in Leading Global Currencies,April 2012,Apostolos Serletis,Anastasios G. Malliaris,Periklis Gogas,,,,,,,,Male,Male,Male,Unknown,Unknown,Unknown,Unknown,Unknown,Unknown,Unknown
23,2,Open Economies Review,13 January 2011,https://link.springer.com/article/10.1007/s11079-010-9195-8,Exchange Rate Pass-Through: Evidence Based on Vector Autoregression with Sign Restrictions,April 2012,Lian An,Jian Wang,,,,,,,,,,,Unknown,Unknown,Unknown,Unknown,Unknown,Unknown,Unknown,Unknown
23,2,Open Economies Review,21 January 2011,https://link.springer.com/article/10.1007/s11079-011-9197-1,Convergence of EMU Equity Portfolios,April 2012,Maela Giofré,,,,,,,,,,Female,Unknown,Unknown,Unknown,Unknown,Unknown,Unknown,Unknown,Unknown,Unknown
23,3,Open Economies Review,23 November 2011,https://link.springer.com/article/10.1007/s11079-011-9226-0,Exchange Rate Policy in Small Rich Economies,July 2012,Francis Breedon,Thórarinn G. Pétursson,Andrew K. Rose,,,,,,,,Male,Unknown,Male,Unknown,Unknown,Unknown,Unknown,Unknown,Unknown,Unknown
23,3,Open Economies Review,08 March 2011,https://link.springer.com/article/10.1007/s11079-011-9200-x,Targeting Rules for an Open Economy,July 2012,Hyuk Jae Rhee,Nurlan Turdaliev,,,,,,,,,,Male,Unknown,Unknown,Unknown,Unknown,Unknown,Unknown,Unknown,Unknown
23,3,Open Economies Review,16 March 2011,https://link.springer.com/article/10.1007/s11079-011-9201-9,"Changes in the Terms of Trade and Sectoral Reallocation of Labor: The Case of Guyana, Jamaica, and Trinidad and Tobago",July 2012,Talan B. İşcan,,,,,,,,,,Unknown,Unknown,Unknown,Unknown,Unknown,Unknown,Unknown,Unknown,Unknown,Unknown
23,3,Open Economies Review,26 May 2011,https://link.springer.com/article/10.1007/s11079-011-9205-5,Exchange Rate Volatility and Productivity Growth: The Role of Liability Dollarization,July 2012,Kenza Benhima,,,,,,,,,,Female,Unknown,Unknown,Unknown,Unknown,Unknown,Unknown,Unknown,Unknown,Unknown
23,3,Open Economies Review,28 April 2011,https://link.springer.com/article/10.1007/s11079-011-9204-6,Productivity Differences and Foreign Market Entry in an Oligopolistic Industry,July 2012,Andrzej Cieślik,Michael Ryan,,,,,,,,,Male,Male,Unknown,Unknown,Unknown,Unknown,Unknown,Unknown,Unknown,Unknown
23,3,Open Economies Review,11 May 2011,https://link.springer.com/article/10.1007/s11079-011-9203-7,Structural Reform and Transparency in a Monetary Union,July 2012,Marcelo Sánchez,,,,,,,,,,Male,Unknown,Unknown,Unknown,Unknown,Unknown,Unknown,Unknown,Unknown,Unknown
23,4,Open Economies Review,03 December 2011,https://link.springer.com/article/10.1007/s11079-011-9233-1,Trade Liberalization and Industry Dynamics,September 2012,Roberto Álvarez,Ricardo A. López,,,,,,,,,Male,Male,Unknown,Unknown,Unknown,Unknown,Unknown,Unknown,Unknown,Unknown
23,4,Open Economies Review,25 November 2011,https://link.springer.com/article/10.1007/s11079-011-9228-y,From the Great Moderation to the Global Crisis: Exchange Market Pressure in the 2000s,September 2012,Joshua Aizenman,Jaewoo Lee,Vladyslav Sushko,,,,,,,,Male,Unknown,Male,Unknown,Unknown,Unknown,Unknown,Unknown,Unknown,Unknown
23,4,Open Economies Review,16 July 2011,https://link.springer.com/article/10.1007/s11079-011-9208-2,Business Cycle Synchronisation: Disentangling Trade and Financial Linkages,September 2012,Stéphane Dées,Nico Zorell,,,,,,,,,,Male,Unknown,Unknown,Unknown,Unknown,Unknown,Unknown,Unknown,Unknown
23,4,Open Economies Review,14 June 2011,https://link.springer.com/article/10.1007/s11079-011-9207-3,Bounded Love of Variety and Patterns of Trade,September 2012,Philip Sauré,,,,,,,,,,Male,Unknown,Unknown,Unknown,Unknown,Unknown,Unknown,Unknown,Unknown,Unknown
23,4,Open Economies Review,27 July 2011,https://link.springer.com/article/10.1007/s11079-011-9209-1,Examining Foreign Aid Fungibility in Small Open Economies,September 2012,Sharri Byron,,,,,,,,,,Female,Unknown,Unknown,Unknown,Unknown,Unknown,Unknown,Unknown,Unknown,Unknown
23,4,Open Economies Review,18 August 2011,https://link.springer.com/article/10.1007/s11079-011-9211-7,"Bilateral Trade, Openness, and Asset Holdings",September 2012,Alexandra Peter,,,,,,,,,,Female,Unknown,Unknown,Unknown,Unknown,Unknown,Unknown,Unknown,Unknown,Unknown
23,4,Open Economies Review,26 August 2011,https://link.springer.com/article/10.1007/s11079-011-9212-6,Intra-Industry Trade Revisited: A Note,September 2012,Maria E. de Boyrie,Mordechai Kreinin,,,,,,,,,Female,Male,Unknown,Unknown,Unknown,Unknown,Unknown,Unknown,Unknown,Unknown
23,5,Open Economies Review,06 December 2011,https://link.springer.com/article/10.1007/s11079-011-9235-z,"Exports, Imports and Profitability: First Evidence for Manufacturing Enterprises",November 2012,Joachim Wagner,,,,,,,,,,Male,Unknown,Unknown,Unknown,Unknown,Unknown,Unknown,Unknown,Unknown,Unknown
23,5,Open Economies Review,09 December 2011,https://link.springer.com/article/10.1007/s11079-011-9234-0,"PPP in OECD Countries: An Analysis of Real Exchange Rate Stationarity, Cross-Sectional Dependency and Structural Breaks",November 2012,Mark J. Holmes,Jesús Otero,Theodore Panagiotidis,,,,,,,,Male,,Male,Unknown,Unknown,Unknown,Unknown,Unknown,Unknown,Unknown
23,5,Open Economies Review,22 November 2011,https://link.springer.com/article/10.1007/s11079-011-9229-x,"Currency Networks, Bilateral Exchange Rate Volatility and the Role of the US Dollar",November 2012,Michael Bleaney,Mo Tian,,,,,,,,,Male,,Unknown,Unknown,Unknown,Unknown,Unknown,Unknown,Unknown,Unknown
23,5,Open Economies Review,09 December 2011,https://link.springer.com/article/10.1007/s11079-011-9236-y,Financial Integration and Fiscal Policy,November 2012,Davide Furceri,Aleksandra Zdzienicka,,,,,,,,,Male,Female,Unknown,Unknown,Unknown,Unknown,Unknown,Unknown,Unknown,Unknown
23,5,Open Economies Review,21 September 2011,https://link.springer.com/article/10.1007/s11079-011-9215-3,Third-person Effect and Financial Contagion in the Context of a Global Game,November 2012,Tai-kuang Ho,Ming-yen Wu,,,,,,,,,Unknown,Unknown,Unknown,Unknown,Unknown,Unknown,Unknown,Unknown,Unknown,Unknown
23,5,Open Economies Review,30 November 2011,https://link.springer.com/article/10.1007/s11079-011-9227-z,"Keynesian and Austrian Perspectives on Crisis, Shock Adjustment, Exchange Rate Regime and (Long-Term) Growth",November 2012,Mathilde Maurel,Gunther Schnabl,,,,,,,,,Female,Male,Unknown,Unknown,Unknown,Unknown,Unknown,Unknown,Unknown,Unknown
23,5,Open Economies Review,14 September 2011,https://link.springer.com/article/10.1007/s11079-011-9213-5,Preferential Trade Agreements and the Margins of Imports,November 2012,Neil Foster,,,,,,,,,,Male,Unknown,Unknown,Unknown,Unknown,Unknown,Unknown,Unknown,Unknown,Unknown
23,5,Open Economies Review,06 October 2011,https://link.springer.com/article/10.1007/s11079-011-9214-4,Determinants of Trade Misinvoicing,November 2012,Ila Patnaik,Abhijit Sen Gupta,Ajay Shah,,,,,,,,Female,Unknown,Male,Unknown,Unknown,Unknown,Unknown,Unknown,Unknown,Unknown
24,1,Open Economies Review,09 September 2012,https://link.springer.com/article/10.1007/s11079-012-9252-6,Challenges and Risks in the International Monetary System: An Overview,February 2013,Georgios P. Kouretas,Athanasios P. Papadopoulos,,,,,,,,,Male,Male,Unknown,Unknown,Unknown,Unknown,Unknown,Unknown,Unknown,Unknown
24,1,Open Economies Review,09 October 2012,https://link.springer.com/article/10.1007/s11079-012-9254-4,Systematic and Liquidity Risk in Subprime-Mortgage Backed Securities,February 2013,Mardi Dungey,Gerald P. Dwyer,Thomas Flavin,,,,,,,,Unknown,Male,Male,Unknown,Unknown,Unknown,Unknown,Unknown,Unknown,Unknown
24,1,Open Economies Review,21 September 2012,https://link.springer.com/article/10.1007/s11079-012-9255-3,U.S. Monetary Policy: A View from Macro Theory,February 2013,William T. Gavin,Benjamin D. Keen,,,,,,,,,Male,Male,Unknown,Unknown,Unknown,Unknown,Unknown,Unknown,Unknown,Unknown
24,1,Open Economies Review,23 September 2012,https://link.springer.com/article/10.1007/s11079-012-9253-5,"Interest Rates, Leverage, and Money",February 2013,Apostolos Serletis,Khandokar Istiak,Periklis Gogas,,,,,,,,Male,Unknown,Male,Unknown,Unknown,Unknown,Unknown,Unknown,Unknown,Unknown
24,1,Open Economies Review,23 September 2012,https://link.springer.com/article/10.1007/s11079-012-9256-2,"Discretionary Government Consumption, Private Domestic Demand, and Crisis Episodes",February 2013,Luca Agnello,Davide Furceri,Ricardo M. Sousa,,,,,,,,Male,Male,Male,Unknown,Unknown,Unknown,Unknown,Unknown,Unknown,Unknown
24,1,Open Economies Review,13 September 2012,https://link.springer.com/article/10.1007/s11079-012-9257-1,"The New CFS Divisia Monetary Aggregates: Design, Construction, and Data Sources",February 2013,William A. Barnett,Jia Liu,Jeff van den Noort,,,,,,,,Male,,Male,Unknown,Unknown,Unknown,Unknown,Unknown,Unknown,Unknown
24,1,Open Economies Review,30 September 2012,https://link.springer.com/article/10.1007/s11079-012-9259-z,What Drives Clarity of Central Bank Communication About Inflation?,February 2013,Aleš Bulíř,Martin Čihák,David-Jan Jansen,,,,,,,,Male,Male,Unknown,Unknown,Unknown,Unknown,Unknown,Unknown,Unknown,Unknown
24,1,Open Economies Review,28 September 2012,https://link.springer.com/article/10.1007/s11079-012-9260-6,Automatic Fiscal Stabilisers: What They Are and What They Do,February 2013,Jan in’t Veld,Martin Larch,Marieke Vandeweyer,,,,,,,,Male,Male,Female,Unknown,Unknown,Unknown,Unknown,Unknown,Unknown,Unknown
24,1,Open Economies Review,30 September 2012,https://link.springer.com/article/10.1007/s11079-012-9258-0,The Performance of Simple Fiscal Policy Rules in Monetary Union,February 2013,Lukas Vogel,Werner Roeger,Bernhard Herz,,,,,,,,Male,Male,Male,Unknown,Unknown,Unknown,Unknown,Unknown,Unknown,Unknown
24,2,Open Economies Review,01 February 2013,https://link.springer.com/article/10.1007/s11079-012-9267-z,Addressing International Empirical Puzzles: the Liquidity of Bonds,April 2013,Matthew Canzoneri,Robert Cumby,Behzad Diba,,,,,,,,Male,Male,Male,Unknown,Unknown,Unknown,Unknown,Unknown,Unknown,Unknown
24,2,Open Economies Review,18 February 2012,https://link.springer.com/article/10.1007/s11079-012-9239-3,An Estimated Stochastic General Equilibrium Model with Partial Dollarization: A Bayesian Approach,April 2013,Paul Castillo,Carlos Montoro,Vicente Tuesta,,,,,,,,Male,Male,Male,Unknown,Unknown,Unknown,Unknown,Unknown,Unknown,Unknown
24,2,Open Economies Review,27 April 2012,https://link.springer.com/article/10.1007/s11079-012-9241-9,The Simple Analytics of Sudden Stops,April 2013,Peter J. Montiel,,,,,,,,,,Male,Unknown,Unknown,Unknown,Unknown,Unknown,Unknown,Unknown,Unknown,Unknown
24,2,Open Economies Review,17 January 2012,https://link.springer.com/article/10.1007/s11079-011-9238-9,Government Debt Denomination Policies Before and After the EMU Advent,April 2013,Georges Hübner,Robert Joliet,,,,,,,,,Male,Male,Unknown,Unknown,Unknown,Unknown,Unknown,Unknown,Unknown,Unknown
24,2,Open Economies Review,06 March 2012,https://link.springer.com/article/10.1007/s11079-012-9240-x,The Quantitative Importance of the Expenditure-Switching Effect,April 2013,Wei Dong,,,,,,,,,,,Unknown,Unknown,Unknown,Unknown,Unknown,Unknown,Unknown,Unknown,Unknown
24,2,Open Economies Review,03 May 2012,https://link.springer.com/article/10.1007/s11079-012-9243-7,Heterogeneous Productivity and the Gains from Trade and FDI,April 2013,Ehsan U. Choudhri,Antonio Marasco,,,,,,,,,Male,Male,Unknown,Unknown,Unknown,Unknown,Unknown,Unknown,Unknown,Unknown
24,2,Open Economies Review,28 April 2012,https://link.springer.com/article/10.1007/s11079-012-9242-8,A Note on the Endogenous Timing of Tariff Policy in the Presence of a Time Lag between Production and Trade Decisions,April 2013,Tsuyoshi Toshimitsu,,,,,,,,,,Male,Unknown,Unknown,Unknown,Unknown,Unknown,Unknown,Unknown,Unknown,Unknown
